,Name,Website,Phone Number,LON,LAT,Rating,Popularity,Last 5 Reviews
19,Residenza di Ripetta,https://www.residenzadiripetta.com/?utm_source=GB&utm_medium=organic,+39 06 323 1144,12.4761793,41.9088792,4.3,550,"[]<b>Author: </b>Caroline N; <br><b>Rating: </b>5<br><b>When: </b>7 months ago<br>I stayed at this lovely hotel back in mid-September. It has with wonderful staff. Good central location. The garden is very peaceful and pretty. The rooftop cocktail bar is an added bonus. The hotel is handling the Covid situation very well, I felt very safe there<br><br><b>Author: </b>Alessia Mattiaccio; <br><b>Rating: </b>5<br><b>When: </b>10 months ago<br>We only stayed for one night and we had a great time! The hotel was located in the center, with two steps you are in Trinita 'dei Monti. We had breakfast in a really nice garden inside! Very kind staff.<br><br><b>Author: </b>Peter B; <br><b>Rating: </b>5<br><b>When: </b>a year ago<br>Amazing hotel, staff are so friendly and helpful, food is excellent, the location is great. Would highly recommend staying here. We loved it so much we had our wedding here :)<br><br><b>Author: </b>Francesco M.; <br><b>Rating: </b>3<br><b>When: </b>a year ago<br>Like almost all the hotels in the city center of Rome, no matters what you pay, they are a bit old fashion or even oldish... Residenza di Ripetta is no exception. A bit oldish, a bit outdated... The effort they put in keeping it good, it would need a complete renovation... At least new paint on the walls and new furniture... In the rooms and in the common areas.
The people are very nice, they really try their best. A great thanks to all the people.
Breakfast is good, location is great.<br><br><b>Author: </b>Paolo Saccone; <br><b>Rating: </b>4<br><b>When: </b>a year ago<br>It's elegant and fine, Palace of the 18 century within an good restaurant! Near Piazza del Popolo and Via del Corso in Rom. 👍<br><br>"
20,Hostaria Da Cesare,http://www.ristorantecesare.com/,+39 06 686 1227,12.4683735,41.9052894,4.1,499,"[]<b>Author: </b>Spionas Ribbson; <br><b>Rating: </b>1<br><b>When: </b>9 months ago<br>We had already had dinner and walked past on our way home and decided to get one more glass of wine before bedtime. While sitting there we asked the waitor for some snacks, maybe a couple of cheeses or something - to go with the wine. It was not on the menu but he said he could make something for us. We were super clear that we were not looking for something to eat, that we had already ate and just wanted a small snack with the wine. He ended up serving us a four different types of cheese, including a big mozzarella and then charging us €30 for it. The wine was €7/glass which was totally fine. This place really screwed us over. Don't go there!<br><br><b>Author: </b>Michael Asheroff; <br><b>Rating: </b>4<br><b>When: </b>a year ago<br>Really good food at rational pricing.  The sauces are excellent - tried several different dishes.  Not fine dining but better than most in the area.  Great wine selection.<br><br><b>Author: </b>Vorname Nachname; <br><b>Rating: </b>2<br><b>When: </b>a year ago<br>The food is good, not great. The prices are okay.
My glass was broken at the bottom and on the wine bottle the date was blacked out for whatever reason, nevermind.

There are a lot of friendly waiters, the one who served my table however was very unfriendly. An old guy with white hair, near bold head.
At one point he brought my dish and shouted ""Eh!"" to place directly on my serviette, close to pushing away my hands with the plate.
The other dishes he served wordlessly and in a harsh manner.
Sorry for coming to your restaurant, old man!
This place shouldn't be listed in the Guide Michelin, the food doesn't make up for things like this.<br><br><b>Author: </b>Clive Field; <br><b>Rating: </b>5<br><b>When: </b>a year ago<br>Stunning food! Amazing fish menu items. All dishes are prepared to order, not pre cooked. Authentic Italian food lovingly prepared and presented.<br><br><b>Author: </b>Violeta Villaseñor; <br><b>Rating: </b>5<br><b>When: </b>a year ago<br>Always the best food, service and kindness, thanks a million Alessandro 👍😋😋♥️😘😊<br><br>"
21,Enoteca Ferrara,https://enotecaferrara.com/,+39 06 5833 3920,12.470248,41.8913591,4.4,478,"[]<b>Author: </b>Olive Elwell; <br><b>Rating: </b>5<br><b>When: </b>2 weeks ago<br>Really great cave-like restaurant in a very cute area! It may seem a bit expensive but you get a lot and the atmosphere is amazing. I will definitely go here again on the very first night I am back on holiday in Rome. It is a really special experience and the wait staff is very friendly. My boyfriend and I have little to no knowledge about wine and they helped us find a really delicious bottle in our price range.

We had fried gnocchi, fried goat cheese with candied peaches, fondue gnocchi with mushrooms, stuffed guineafowl, baked goat, and tiramisu.<br><br><b>Author: </b>Anh Lee; <br><b>Rating: </b>5<br><b>When: </b>a year ago<br>Delicious food and homemade pasta. The gnocchi with truffle sauce are highly recommended. The service is very friendly and special requests were made without any ifs and buts. Very good restaurant!<br><br><b>Author: </b>jay9000; <br><b>Rating: </b>5<br><b>When: </b>a year ago<br>Excellent everything. Best meal in Rome so far. Excellent service. Really can’t say enough good things. A great mix of traditional and contemporary cuisine.<br><br><b>Author: </b>Brittney Nelson; <br><b>Rating: </b>5<br><b>When: </b>a year ago<br>Super friendly staff with delicious wine +snacks!!<br><br><b>Author: </b>Joe Giosa; <br><b>Rating: </b>5<br><b>When: </b>a year ago<br>Excellent !  It would take me all day to rave about this restaurant . Fried arthichoke , fried sardines, mussels , etc.<br><br>"
22,Hotel Clodio,http://www.hotelclodio.it/,+39 06 372 1122,12.456768,41.919854,3.9,444,"[]<b>Author: </b>Lulu Ahmad; <br><b>Rating: </b>3<br><b>When: </b>4 months ago<br>Nothing special about this hotel other than they have a nice lounge area<br><br><b>Author: </b>Liam Forde; <br><b>Rating: </b>4<br><b>When: </b>a year ago<br>I love the view from the balcony and the old traditional style rooms. It’s a 2-minute walk to the Clodio bus station. The staff were very friendly and informative, and spoke English well. Breakfast was delicious.

The downsides were that the bed was quite firm, the bathroom was quite small and the door to the room was a bit of a hassle to open.

Make sure you bring a power adaptor suited to Italy otherwise you could find your appliances out of battery, and getting around could be much more difficult!<br><br><b>Author: </b>Ruben; <br><b>Rating: </b>4<br><b>When: </b>a year ago<br>For being a 4 star hotel the room could be cleaner (my sheets had a couple of spots). Breakfast is real good though, staff is friendly and the common area is nice and quiet.<br><br><b>Author: </b>KeroLos Philip; <br><b>Rating: </b>5<br><b>When: </b>a year ago<br>Kind staff, prefect location and suitable prices.<br><br><b>Author: </b>Rhiannon; <br><b>Rating: </b>1<br><b>When: </b>a year ago<br>The room was nothing like described. Dingey, smelt funky and tiny. Booked a double room but got a twin, hotel staff were unhelpful. Had to find alternative last minute accommodation.<br><br>"
23,Taba Café Campo de' Fiori,https://instagram.com/tabacafecampo?igshid=17gc929my2qos,+39 06 6813 5590,12.4719555,41.8954642,3.9,430,"[]<b>Author: </b>Joachim Falck-Hansen; <br><b>Rating: </b>5<br><b>When: </b>3 weeks ago<br>You have to love Mariano’s attentiveness and kindness and the piscos with the flamingos. Always welcoming us with a warm smile and genuinely interested in making sure we have the best experience. The best waiter ever. The same goes for delicious<br><br><b>Author: </b>Nina Wendel; <br><b>Rating: </b>5<br><b>When: </b>in the last week<br>Best Bar in Town!!
If you are in Rome visit Taba Cafe, enjoy the view, the friendly stuff (Hey Mamun, you're the best!) and the great Cocktails.<br><br><b>Author: </b>Marta Massarelli; <br><b>Rating: </b>5<br><b>When: </b>a month ago<br>This place is the one to go to if you are near Piazza Navona for a chill aperitivo or dinner. I came here just after bars reopened and had great wine and food. Mamun is a great waiter and made the atmosphere welcoming and warm!<br><br><b>Author: </b>Fabio Marziali; <br><b>Rating: </b>4<br><b>When: </b>in the last week<br>Wonderful place with thoughtful forniture and ambient. I dont give 5 stars because on a holiday day they could afford live music or dj and a few times the music was just awful. Metal and speed rock doesn't belong here, IMHO.<br><br><b>Author: </b>tom williams; <br><b>Rating: </b>5<br><b>When: </b>10 months ago<br>Came here for some drinks beautiful view and fun my furniture.
Drinks are reasonable price.
Good atmosphere<br><br>"
24,Ristrot San Pietro,http://www.ristrotsanpietro.com/,+39 06 631559,12.4537325,41.8996174,4.0,406,"[]<b>Author: </b>Mireya Castro; <br><b>Rating: </b>3<br><b>When: </b>6 months ago<br>If you are in Trastevere visit the church is part of the tour, I liked the apartment that has different types of designs<br><br><b>Author: </b>M; <br><b>Rating: </b>3<br><b>When: </b>a year ago<br>The staff handled my problem well but I still wish I'd have gone elsewhere. Friendly service and good atmosphere but I came for a very quick dinner, ordered a sandwich, waited 20 minutes for it only to realize they gave me the wrong one. They remedied the problem quickly and gave me a few different options and the food was fine, so 3 stars, but if I had known I would be so delayed over something so simple, I would have picked any other cafe on that street. Fine if you are sitting down for a while.<br><br><b>Author: </b>Vignesh Shanker; <br><b>Rating: </b>1<br><b>When: </b>a year ago<br>Terrible terrible experience. The two Waiters are complete dimwits. Ordered a Vegetarian Pizza and French Fries and these jokers took 40 mins to prepare it.  And they took 15 mins to get the bill.  Food was decent but the wait is a killer, don't waste your valuable time in Rome visiting this joke of a restaurant.  Save it and go somewhere else!.;2<br><br><b>Author: </b>Anil Baptist; <br><b>Rating: </b>5<br><b>When: </b>a year ago<br>The food here is fresh and tasty. Service good with friendly staff. Average price was around 10 euros. Wonderful atmosphere had outside seating as well. Can enjoy your meal with St. Peters basilica in the background.<br><br><b>Author: </b>Tim Carpenter; <br><b>Rating: </b>5<br><b>When: </b>10 months ago<br>Friendly staff very welcoming. Great food and price.<br><br>"
