,LAT,LON,order,Distance [m],lugares,quotes,Position_book,Type
5,41.9029468,12.4544835,27,90,"<a href=""http://www.museivaticani.va/content/museivaticani/it/collezioni/musei/cappella-sistina/storia-cappella-sistina.html""target=""_blank""> Sistine Chapel </a><br><b>Rating: </b>4.7<br><b>Popularity: </b><br>34184","[]<b>Author: </b>David Herbst; <br><b>Rating: </b>3<br><b>When: </b>4 months ago<br>I can appreciate the history behind it but I fail to understand why the ceiling of this place seems to be one of the highlights of Rome.

If you can, be sure to do the entire tour of the Vatican Museum. Along your way you will see dozens of long hallways with tall ceilings, all of which are painted with beautiful art.

Don't rush to see it, rather enjoy all the other beautiful art Rome shows you just by walking anywhere.<br><br><b>Author: </b>Dmitriy Mitin; <br><b>Rating: </b>5<br><b>When: </b>8 months ago<br>This place has already more than 32k reviews, so I don't think I could add something new. I was blessed to visit this place during the pandemic - it was so calm and peaceful without tourists. As a short remark - if you take an audio guide, the content will be different for different languages. The most complete is Italian and English.<br><br><b>Author: </b>heath; <br><b>Rating: </b>4<br><b>When: </b>a week ago<br>The most magnificent architecture in Rome. The paintings were fascinating. The whole experience was engaging. My only complaint is that some in my family are claustrophobic, and they were letting way too many people into a room at a time. They packed some rooms full so that there was virtually no room. Other than that, it was an amazing experience.<br><br><b>Author: </b>Karen Blanco; <br><b>Rating: </b>5<br><b>When: </b>8 months ago<br>A must see. So much art and so much more. Tons of stolen relics from other cultures are on display here. This is the Louvre of Italy, if you like seeing everything you may need a full day or two<br><br><b>Author: </b>Elena Vidotto; <br><b>Rating: </b>5<br><b>When: </b>6 months ago<br>I took the audio guide and It was saying all or even more than what was supposed to.
The chapel is amazing but I believe without a guide you wouldn't appreciate it as much as you should. I mean only if you are a normal person who doesn't know that much about Michelangelo and the history of the Sistine chapel.<br><br>",,TOUR
6,41.9029468,12.4544835,41,0,"<a href=""http://www.museivaticani.va/content/museivaticani/it/collezioni/musei/cappella-sistina/storia-cappella-sistina.html""target=""_blank""> Sistine Chapel </a><br><b>Rating: </b>4.7<br><b>Popularity: </b><br>34184","[]<b>Author: </b>David Herbst; <br><b>Rating: </b>3<br><b>When: </b>4 months ago<br>I can appreciate the history behind it but I fail to understand why the ceiling of this place seems to be one of the highlights of Rome.

If you can, be sure to do the entire tour of the Vatican Museum. Along your way you will see dozens of long hallways with tall ceilings, all of which are painted with beautiful art.

Don't rush to see it, rather enjoy all the other beautiful art Rome shows you just by walking anywhere.<br><br><b>Author: </b>Dmitriy Mitin; <br><b>Rating: </b>5<br><b>When: </b>8 months ago<br>This place has already more than 32k reviews, so I don't think I could add something new. I was blessed to visit this place during the pandemic - it was so calm and peaceful without tourists. As a short remark - if you take an audio guide, the content will be different for different languages. The most complete is Italian and English.<br><br><b>Author: </b>heath; <br><b>Rating: </b>4<br><b>When: </b>a week ago<br>The most magnificent architecture in Rome. The paintings were fascinating. The whole experience was engaging. My only complaint is that some in my family are claustrophobic, and they were letting way too many people into a room at a time. They packed some rooms full so that there was virtually no room. Other than that, it was an amazing experience.<br><br><b>Author: </b>Karen Blanco; <br><b>Rating: </b>5<br><b>When: </b>8 months ago<br>A must see. So much art and so much more. Tons of stolen relics from other cultures are on display here. This is the Louvre of Italy, if you like seeing everything you may need a full day or two<br><br><b>Author: </b>Elena Vidotto; <br><b>Rating: </b>5<br><b>When: </b>6 months ago<br>I took the audio guide and It was saying all or even more than what was supposed to.
The chapel is amazing but I believe without a guide you wouldn't appreciate it as much as you should. I mean only if you are a normal person who doesn't know that much about Michelangelo and the history of the Sistine chapel.<br><br>",,MUSE
7,41.9035313,12.4561705,9,154,the Papal Apartments,"<b>220</b><br>Peter’s Square,
the palace houses both the Papal Apartments and the Office of the Pope<br><b>1000</b><br>A fellow cardinal emerged from the Apostolic Palace and strode beside him<br><b>811</b><br>Rocher
year’s worth of cancer res 
led Kohler up a handicapped ramp on a circuitous route into the Apostolic Palace",220.0,LIB
8,41.9038641,12.4567781,10,62,Vatican Bank,<b>249</b><br>then there is the gold bullion and the real estate deeds inside the Vatican Bank vaults,249.0,LIB
9,41.9022225,12.456728300000002,5,182,St. Peter’s Square,"<b>219</b><br>With a commanding
view of StPeter’s Square,
the palace houses both the Papal Apartments and the Office of the Pope<br><b>896</b><br> 
The silence of StPeter’s Square broke with a ripple at first<br><b>156</b><br>She motioned frantically
downward toward StPeter’s Square directly beneath them<br><b>1003</b><br> 
Far below, in StPeter’s Square, reporter Gunther Glick watched in reflective silence<br><b>799</b><br>.”109
M
of S 
eanwhile, in StPeter’s Square, the wall
wiss Guards yelled orders and fanned
outward, trying to push the crowds back to a safer distance<br><b>833</b><br>Pe 
ter’s Square<br><b>265</b><br> 43
L angdon stood m nless at the Pope’s bulle 
otio 
tproof window and gazed down at the
bustle of media trailers in StPeter’s Square<br><b>840</b><br> 117
R obert Langdon had little doubt that the chaos and hysteria coursing through StPeter’s Square at this very instant exceeded anything Vatican Hill had ever witnessed<br><b>566</b><br> 
Her video came 
nchor as sh 
ra felt like an a 
e lumbered across StPeter’s Square, pushing
through the gathering crowd<br><b>549</b><br>As Langdon looked out at the wide-open spaces of StPeter’s Square, a familiar question nagged<br><b>523</b><br>The path intersected the Margherita Bridge, Via Cola di Riezo, and passed through Piazza del Risorgimento, hitting no churches at all until it dead-ended abruptly at the center of StPeter’s Square<br><b>575</b><br> 
Robert Langdon stood nearby staring out at StPeter’s Square<br><b>586</b><br> 
The soldier pointed to StPeter’s Square<br><b>555</b><br> 
Somewhere around the obelisk, boldly positioned outside the largest church in the world, was the second altar of science-Bernini’s West Ponente -an elliptical block in StPeter’s Square<br><b>805</b><br>To her shock, much of StPeter’s Square was still packed with people! The Swiss Guard had apparently been able to clear only
rea
about a hundred and fifty feet back-the a 
directly in front of the basilica-less than one-third of the square<br><b>990</b><br> 
They were singing in StPeter’s Square <br><b>529</b><br>StPeter’s Square is in Vatican City<br><b>1021</b><br>He and Vittoria had talked about it last night as they stole away from StPeter’s Square<br><b>538</b><br>“I wasn’t thinking in those terms! That tile you’re talking about in StPeter’s Square is called the West Ponente -the i 
West W nd<br><b>993</b><br> 
An early rainstorm had washed the crowds from StPeter’s Square<br><b>536</b><br>I know every corner of StPeter’s Square",156.0,LIB
10,41.9021225,12.4615696,43,400,"<a href=""http://www.leonardodavincimuseo.com/""target=""_blank""> Museum Leonardo Da Vinci Experience </a><br><b>Rating: </b>4.4<br><b>Popularity: </b><br>1665","[]<b>Author: </b>Dr. Francesco Prato; <br><b>Rating: </b>5<br><b>When: </b>6 months ago<br>A reduced version of the original museum in Vinci (near Florence) but with all the most important inventions showcased. You can also try them out. Well done.<br><br><b>Author: </b>Daniel Stiller; <br><b>Rating: </b>4<br><b>When: </b>7 months ago<br>It waa a nice and informativ visit, although the tour is a littlebit shorter then expected first. Bit the audio guides are kreativ and well made and the workers are very helpful.

I can recommend it, espacially as a ""free"" addition to one of the city pass tourist tickets.<br><br><b>Author: </b>Kyle Taylor; <br><b>Rating: </b>5<br><b>When: </b>8 months ago<br>Very friendly staff, some awesome gifts and items for the house or friends :)<br><br><b>Author: </b>Paul R; <br><b>Rating: </b>5<br><b>When: </b>8 months ago<br>Really good value...nice place to escape the heat for a bit<br><br><b>Author: </b>Dave Ruijer; <br><b>Rating: </b>5<br><b>When: </b>a year ago<br>Fun and interactive museum about the great ideas and creations from Leonardo Da Vinci. We went late afternoon without a line stopping us to enter the museum quickly. By entrance you get a map of the museum with pictures of the objects on it. With a little scanner, headphone included, you can tab on the picture what is relevant at the moment you stand in front of an object. You will here a voice in your selected language explaining the background of the piece. Several mechanical creations can be tried. By doing this you get close in the genius mind of Leonardo Da Vinci and realize he went far in front of his era. Also for kids this is a very educative museum wich stimulates the mind. After the tour in the museum you can buy fun souvenirs like T-shirts, books, etc.<br><br>",,MUSE
11,41.9026429,12.4621915,33,77,"<a href=""http://www.parrocchiatraspontina.it/""target=""_blank""> Santa Maria in Traspontina </a><br><b>Rating: </b>4.6<br><b>Popularity: </b><br>1275","[]<b>Author: </b>Vinay Kulkarni; <br><b>Rating: </b>4<br><b>When: </b>2 months ago<br>Nice church. Right on the main road. Good building design.<br><br><b>Author: </b>Lee Condemi; <br><b>Rating: </b>5<br><b>When: </b>3 months ago<br>This church has always been open  during lockdown...and the pastors  at complete attention to all the church goers.
It is so well taken care of clean and beautifully adorned with flowers always<br><br><b>Author: </b>Billie-Jean Marcelle; <br><b>Rating: </b>5<br><b>When: </b>8 months ago<br>WOW! A stunning church. It's not much from the outside but go through the doors and you'll be knocked off your feet.<br><br><b>Author: </b>Tony Gonzalez; <br><b>Rating: </b>3<br><b>When: </b>a year ago<br>One of the beautiful magnificent interiors, the altar and the paintings. It's fantastic opportunity to relive and admire the patrimony of history.<br><br><b>Author: </b>dylayla Noreth quintero; <br><b>Rating: </b>5<br><b>When: </b>a year ago<br>One of the most important testimonies for the Christian tradition can be found in the third chapel on the left, Flagelation of Saints Peter and Paul and stories of the two saints by Ricci; Crucifix, 14th century goldsmith's work; on the altar milks, two stalks of columns to which, according to tradition, the two saints would have been tied.
In the baptistery Pietá in earthenware of the fifteenth century and wooden angels of the school of Ercole Ferrata.
At the main altar based on a design by Carlo Fontana (1674), with a crown canopy illusionistically supported by stucco angels by Leonardo Retti - Icon of the Virgin brought from the Holy Land to Rome perhaps in 1216 by the Carmelites.

L'un des témoignages les plus importants de la tradition chrétienne se trouve dans la troisième chapelle à gauche, la Flagellation des Saints Pierre et Paul et les histoires des deux saints de Ricci; Crucifix, travail d'orfèvre du XIVe siècle; sur l'autel traire deux tiges de colonnes auxquelles, selon la tradition, les deux saints auraient été attachés.
Dans le baptistère Pietá en terre cuite du XVe siècle et les anges en bois de l'école d'Ercole Ferrata.
Sur le maître-autel basé sur un dessin de Carlo Fontana (1674), avec un auvent couronné illusionniquement par des anges en stuc par Leonardo Retti - Icône de la Vierge amenée de Terre Sainte à Rome, peut-être en 1216 par les carmes.<br><br>",,TOUR
12,41.90306319999999,12.466276,26,341,"<a href=""http://castelsantangelo.beniculturali.it/""target=""_blank""> Castel Sant'Angelo </a><br><b>Rating: </b>4.7<br><b>Popularity: </b><br>54036","[]<b>Author: </b>Ghazzal Mehdi; <br><b>Rating: </b>5<br><b>When: </b>8 months ago<br>Surely a five star place. Perhaps the most iconic in Rome? To be honest, Rome has so many iconic places that I lost the count...
Anyway, near to. Vetican, great bridges.. Simply outstanding...<br><br><b>Author: </b>Marcos Chavarria; <br><b>Rating: </b>4<br><b>When: </b>a month ago<br>Greater sight from the outside, I hope the pictures make sense of the very nice place this is. The architecture is different from other landmarks as it was intended for a different purpose in the religious history. Prepare to walk a lot. I would recommend the walking tour if possible.<br><br><b>Author: </b>Marcel van Poeijer; <br><b>Rating: </b>4<br><b>When: </b>3 months ago<br>This huge Castle is definitely worth a visit. Even though I did not go in (entrance fee = 15EU), I still loved the outside area and the little park next to it. When you go inside, it is recommended to go before sunrise, as the sunrise view on top of the terrace should be lovely.<br><br><b>Author: </b>Ken Saberi; <br><b>Rating: </b>4<br><b>When: </b>7 months ago<br>Great place to visit with spectacular views all around Rome. Interesting artefacts and some Papal history to see. Some of the rooms are stunning. There are a lot of stairs so people with mobility issues may struggle although there is a lift to the second level which can be used on request. This does mean that you will lose out on the top terrace which provides the best views. All the staff were extremely helpful and kind.<br><br><b>Author: </b>Rich; <br><b>Rating: </b>3<br><b>When: </b>7 months ago<br>A fine visit. The best thing about this castle is the view you get once you're on the top floor.<br><br>",,TOUR
13,41.90306319999999,12.466276,40,0,"<a href=""http://castelsantangelo.beniculturali.it/""target=""_blank""> Castel Sant'Angelo </a><br><b>Rating: </b>4.7<br><b>Popularity: </b><br>54036","[]<b>Author: </b>Ghazzal Mehdi; <br><b>Rating: </b>5<br><b>When: </b>8 months ago<br>Surely a five star place. Perhaps the most iconic in Rome? To be honest, Rome has so many iconic places that I lost the count...
Anyway, near to. Vetican, great bridges.. Simply outstanding...<br><br><b>Author: </b>Marcos Chavarria; <br><b>Rating: </b>4<br><b>When: </b>a month ago<br>Greater sight from the outside, I hope the pictures make sense of the very nice place this is. The architecture is different from other landmarks as it was intended for a different purpose in the religious history. Prepare to walk a lot. I would recommend the walking tour if possible.<br><br><b>Author: </b>Marcel van Poeijer; <br><b>Rating: </b>4<br><b>When: </b>3 months ago<br>This huge Castle is definitely worth a visit. Even though I did not go in (entrance fee = 15EU), I still loved the outside area and the little park next to it. When you go inside, it is recommended to go before sunrise, as the sunrise view on top of the terrace should be lovely.<br><br><b>Author: </b>Ken Saberi; <br><b>Rating: </b>4<br><b>When: </b>7 months ago<br>Great place to visit with spectacular views all around Rome. Interesting artefacts and some Papal history to see. Some of the rooms are stunning. There are a lot of stairs so people with mobility issues may struggle although there is a lift to the second level which can be used on request. This does mean that you will lose out on the top terrace which provides the best views. All the staff were extremely helpful and kind.<br><br><b>Author: </b>Rich; <br><b>Rating: </b>3<br><b>When: </b>7 months ago<br>A fine visit. The best thing about this castle is the view you get once you're on the top floor.<br><br>",,MUSE
14,41.90306320000001,12.466276,22,0,Castle St. Angelo,"<b>892</b><br> 
He had come for her at Castle StAngelo<br><b>781</b><br>Il Passetto -The Little Passage-was a slender, three-quarter-mile tunnel built between Castle StAngelo and the Vatican<br><b>961</b><br>Europe’s top scientists mocking religion as they secretly assembled in the Vatican’s own Castle StAngelo",781.0,LIB
15,41.901788,12.4664617,21,142,the famous Bridge of Angels,"<b>771</b><br>And as if that were not enough, leading solely and directly to the castle’s main entrance stood the famous Bridge of Angels ",771.0,LIB
16,41.901788,12.4664617,28,0,"<a href=""""target=""_blank""> St. Angelo Bridge </a><br><b>Rating: </b>4.7<br><b>Popularity: </b><br>14830","[]<b>Author: </b>Aayush Khandelwal; <br><b>Rating: </b>5<br><b>When: </b>7 months ago<br>It's worth to visit. Look at the alignment with St Peters basilica. Sit near by on bridge and feel the beauty of place and architecture.<br><br><b>Author: </b>Vasilis Karaman; <br><b>Rating: </b>5<br><b>When: </b>3 months ago<br>Amazing bridge! The most beautiful I have ever seen. All these statues all over the road are in the highest level! At the night this beauty increases!!<br><br><b>Author: </b>Father Kenny Ang; <br><b>Rating: </b>4<br><b>When: </b>7 months ago<br>Seeing the statues of Saints Peter and Paul at the eastern end of this bridge reminds me that I’m standing in a city that witnessed the life of the early Christians. When I came here about two years ago, there were people dressed as Roman soldiers with whom tourists eagerly took pictures (I did too!). Unfortunately, I see that many visitors missed the ten statues of angels holding the symbols of Christ’s Passion devised by none other than Bernini (he wasn’t the only sculptor though; other sculptors collaborated in the project).<br><br><b>Author: </b>Dom Swatton; <br><b>Rating: </b>5<br><b>When: </b>7 months ago<br>Couldn't recommend this bridge more for crossing the water.
It has everything you need, clearly marked walkways, cobble stones and even statues.
Great views of the homeless camping along side the water.
Simply stunning<br><br><b>Author: </b>מאור לוי; <br><b>Rating: </b>5<br><b>When: </b>3 months ago<br>Their shark was, in this moment, a pioneering sheep. Credible grapefruits show us how goldfishes can be snails. An eager chicken is a grape of the mind! A powerful melon without bees is truly a chicken of boundless melons. Recent controversy aside, the chimpanzee of a peach becomes a painstaking lime; Few can name an amusing fish that isn't a confident camel. After a long day at school and work, they were lost without the pro-active giraffe that composed their peach. After a long day at school and work, a sympathetic squirrel without sheeps is truly a giraffe of dynamic sharks; Few can name a skillful lime that isn't a decisive cat. The kumquat is a cow!<br><br>",,TOUR
17,41.9010278,12.4670349,53,96,"<a href=""http://www.ilpontecontemporanea.com/""target=""_blank""> Galleria Il Ponte </a><br><b>Rating: </b>3.4<br><b>Popularity: </b><br>5",[]<b>Author: </b>Elisabetta Kaliszuk; <br><b>Rating: </b>4<br><b>When: </b>6 years ago<br>Great surroundings<br><br><b>Author: </b>mario barbato; <br><b>Rating: </b>3<br><b>When: </b>a year ago<br><br><br><b>Author: </b>Morgan Ditson Moscoso; <br><b>Rating: </b>4<br><b>When: </b>2 years ago<br><br><br><b>Author: </b>Jin seok Kwak; <br><b>Rating: </b>1<br><b>When: </b>2 years ago<br><br><br><b>Author: </b>Roberta Primerano; <br><b>Rating: </b>5<br><b>When: </b>a year ago<br><br><br>,,MUSE
18,41.899673,12.465558,52,193,"<a href=""https://www.operativa-arte.com/""target=""_blank""> Operativa Arte Contemporanea </a><br><b>Rating: </b>4.1<br><b>Popularity: </b><br>21","[]<b>Author: </b>Sakari Hiltunen; <br><b>Rating: </b>2<br><b>When: </b>a year ago<br>Avoid<br><br><b>Author: </b>Paolo Tessitore; <br><b>Rating: </b>5<br><b>When: </b>a year ago<br>Very nice structure with impeccable service. You can taste excellent dishes such as spaghettone cacio and pepe the beef tartare with quail eggs and tortelli alla carbonara. Excellent view. I highly recommend this place<br><br><b>Author: </b>Ulf Silfverberg; <br><b>Rating: </b>5<br><b>When: </b>a year ago<br>Rome is a very nice city🇮🇹🇮🇹😍🤗<br><br><b>Author: </b>Pedro1000; <br><b>Rating: </b>4<br><b>When: </b>a year ago<br>It's great, although the Romans don't like it<br><br><b>Author: </b>Marguerite Diaw; <br><b>Rating: </b>5<br><b>When: </b>2 years ago<br>Superb architecture. Rome is superb<br><br>",,MUSE
19,41.8985622,12.466014,74,129,"<a href=""""target=""_blank""> Fontana del Putto </a><br><b>Rating: </b>4.0<br><b>Popularity: </b><br>2","[]<b>Author: </b>Stefano Manzo; <br><b>Rating: </b>4<br><b>When: </b>9 months ago<br>The Fontana del Putto, of the Renaissance type, is located in the V (Ponte) district, in Via Giulia, leaning against the left corner of the 16th century Palazzo Sacchetti, built on a project by Antonio da Sangallo the Younger to use it as his home.

History:

The fountain was built in a later period, but always in the 16th century and is attributed to Nanni di Baccio Bigio, who did some restoration work on the palace.

Description of the work:

The non-functioning fountain (mute) is quite graceful inside a niche, decorated with a valve there is a Putto embracing the tails of two dolphins in the shape of volutes under him, who have their mouths open, from which a time the water poured out on a pan.

Two niches frame the niche, adorned with bas-reliefs depicting masks and which have human figures as capitals which are surmounted by a broken lintel above which has two stars on the sides with eight points on the sides, probably heraldic symbols.

NOTE on the conservation status of the work:

It is not in good condition and a restoration activity is required that would require the integration of the deficiencies and a cleaning of the incrustations.<br><br><b>Author: </b>Paolo Emilio Capaldi; <br><b>Rating: </b>4<br><b>When: </b>4 years ago<br>Pretty fountain in Via Giulia, leaning against the left corner of Palazzo Sacchetti, corner via the mullet.
Made in the second half of the fifteenth century, perhaps by Sangallo the Younger.
At the center is a child supported by two dolphins and below, was a pan to collect water.
The frame shows two women and two faces of masks.
At the center, above the Putto, there is a shell; close the top frame the stars, the Chigi family crest.<br><br>",,PRK
20,41.8976285,12.4667171,50,119,"<a href=""https://www.museocriminologico.it/""target=""_blank""> Museum of Criminology </a><br><b>Rating: </b>3.5<br><b>Popularity: </b><br>60","[]<b>Author: </b>maxine lloyd; <br><b>Rating: </b>1<br><b>When: </b>a year ago<br>We came from England to attend the museum which showed on the internet that it was open, we got a taxi and made our way to the door only to be told that it was closed!! Even though the door was clearly open!! Very disappointed by the ladies response to us. Update your page if you’re going to be closed!! Wasted journey would not recommend wasting your time or money clearly do not want your business as they were too busy talking on the doorstep!!!!!<br><br><b>Author: </b>Rise Above; <br><b>Rating: </b>4<br><b>When: </b>a year ago<br>Very interesting place! If you like criminal novels!<br><br><b>Author: </b>YourGuideInRomeDotCom FrancescoApice; <br><b>Rating: </b>1<br><b>When: </b>a year ago<br>Ihe museum is CLOSED , and it won't open for at least 18/24 months !  There is a renovation need , but no band has been published yet ...<br><br><b>Author: </b>Raphael Aretakis; <br><b>Rating: </b>4<br><b>When: </b>5 years ago<br>We bumped into this museum while wandering the city. It was an amazing surprise for us. We ended up seeing things we would normally never see. If you like police novels and criminal stories, that is the place to be!!<br><br><b>Author: </b>Julia Coleman; <br><b>Rating: </b>1<br><b>When: </b>3 years ago<br>Still closed for work no information as to when it's reopening :( was disappointed really wanted to visit.<br><br>",,MUSE
21,41.89647949999999,12.469174,54,240,"<a href=""http://www.nuovagalleriacampodeifiori.it""target=""_blank""> New Gallery Campo dei Fiori </a><br><b>Rating: </b>4.5<br><b>Popularity: </b><br>4","[]<b>Author: </b>Elvis Spadoni; <br><b>Rating: </b>4<br><b>When: </b>5 years ago<br>The gallery as a space is not bad a white room plus a half room to form a large room was exposed a photographer born in 40. I did not like the photos.<br><br><b>Author: </b>Stanisław Puda; <br><b>Rating: </b>5<br><b>When: </b>4 years ago<br>My favorite Roman square, unfortunately the sellers are not what they used to be<br><br><b>Author: </b>Cijo Jose; <br><b>Rating: </b>4<br><b>When: </b>4 years ago<br><br><br><b>Author: </b>Jafar Saeedi; <br><b>Rating: </b>5<br><b>When: </b>2 years ago<br><br><br>",,MUSE
