,LAT,LON,order,Distance [m],lugares,quotes,Position_book,Type
22,41.89735160000001,12.4710878,47,185,"<a href=""http://www.welcometo-rome.it/""target=""_blank""> Welcome To Rome </a><br><b>Rating: </b>4.8<br><b>Popularity: </b><br>633","[]<b>Author: </b>Katelyn McMaster; <br><b>Rating: </b>5<br><b>When: </b>a year ago<br>Loved this place!! We were told to visit here before truly starting our adventures in Rome, and we were so grateful that we followed the advice. The presentations are awesome, and it really helps you to understand the history of Rome and the history of the most important locations. Well worth a visit for anyone who is going to Rome without a tour group. The presentations are really great quality too! Can't recommend it enough. The staff are also REALLY helpful and friendly.<br><br><b>Author: </b>A Melete; <br><b>Rating: </b>4<br><b>When: </b>a year ago<br>Interesting experience and insight into Rome’s history. Worth a visit<br><br><b>Author: </b>Frank Pulliza; <br><b>Rating: </b>4<br><b>When: </b>a year ago<br>Cool, but a little underwhelming..... Kids might enjoy it.  You might run across their ads in a magazine like we did.  But when we got there, it was like a small storefront.  There were four 3D ""animations"" that lasted a few minutes each.  Then the movie was maybe 20 minutes.  Good history lesson, movie was interesting.....we just thought we were headed to almost a museum and that is not what this is.<br><br><b>Author: </b>Alessandro Cavazza de Altamer; <br><b>Rating: </b>5<br><b>When: </b>6 months ago<br>The best experience in town for who's visiting Rome and want to discover the eternal city's history in an interesting and entertaining way<br><br><b>Author: </b>Valek; <br><b>Rating: </b>5<br><b>When: </b>a year ago<br>Wow! Its the next step in education, the history i learned by reading books is narrated and display by 3D collections! A really enjoyable time learning about most of Rome history.

I really recommend go to this attraction before going to Roman Forum so you can get the idea of things looks centuries ago.<br><br>",,MUSE
23,41.897551,12.4727241,42,137,"<a href=""http://www.museodiroma.it/""target=""_blank""> Museo di Roma - Palazzo Braschi </a><br><b>Rating: </b>4.5<br><b>Popularity: </b><br>2610","[]<b>Author: </b>M in Paris; <br><b>Rating: </b>3<br><b>When: </b>a month ago<br>The building is amazing and especially on the third floor there is a very interesting little exhibition of the evolution of the Roman architecture. The second floor you'll find a little bit of history of the clergy and romans aristocracy through the centuries but no ground breaking paintings.<br><br><b>Author: </b>Dominic Arbuthnott; <br><b>Rating: </b>4<br><b>When: </b>8 months ago<br>Great view from top floor<br><br><b>Author: </b>Vijay Sisodia; <br><b>Rating: </b>4<br><b>When: </b>a year ago<br>Nice little museum. (Be warned that it isn't very big so don't expect to spend more than a few hours here.)
Information is multilingual
Staff are friendly
Has seating area in almost every room.
Has good interactive videos explaining the history of Rome.
For those with a Roma pass, you still have to go to the ticket office to get your tickets.<br><br><b>Author: </b>David naftalis; <br><b>Rating: </b>2<br><b>When: </b>9 months ago<br>Museum with variable exhibitions.
Not pricy.
The staff not welcoming and very not patience...<br><br><b>Author: </b>Tony Popa; <br><b>Rating: </b>5<br><b>When: </b>a year ago<br>The Museo di Roma is a museum in Rome, Italy, part of the network of Roman civic museums. The museum was founded in the Fascist era with the aim of documenting the local history and traditions of the ""old Rome"" that was rapidly disappearing, but following many donations and acquisitions of works of art is now principally an art museum. The collections initially included 120 water-colours by the nineteenth-century painter Ettore Roesler Franz of Roma sparita, ""vanished Rome"", later moved to the Museo di Roma in Trastevere.<br><br>",,MUSE
24,41.8975985,12.4735755,75,70,"<a href=""http://060608.it/it/cultura-e-svago/beni-culturali/beni-architettonici-e-storici/fontanella-di-via-della-posta-vecchia.html""target=""_blank""> Fontana della Posta Vecchia </a><br><b>Rating: </b>3.5<br><b>Popularity: </b><br>2","[]<b>Author: </b>Stefano Manzo; <br><b>Rating: </b>4<br><b>When: </b>2 years ago<br>In Via della Posta Vecchia is located in the district VI (Parione), between the picturesque Piazza De 'Massimi and Piazza Navona, it is a small quaint fountain in its simplicity.

It is leaning against a wall of the palace through a rectangular slab of white granite, in the upper part adorned on the sides by two bas-reliefs that represent flowers, always at the top but in the middle there is a cartouche with the inscription:

S.P.Q.R.
1872

Where the initials S.P.Q.R. Latin Senatvs PopvlvsQve Romanvs - the Senate and the Roman People, as the year 1872 is the year of construction.

As I said the fountain is very simple a small cinnamon, inserted in a circular panel, which pours water into a tray which is also circular but partially embedded (supported by an iron support like a modiglione), unfortunately the pan has the chipped edge in the front part, the water then falls into a collection basin on the ground of the semicircular shape.

To access it, there is a step always semicircular in shape, paved (like the basin) with the characteristic cobblestones, which act together with metal columns from delimiters of the area of ​​respect.

Not to be missed a few meters away, two sacred 17th century aedicules.<br><br><b>Author: </b>Roberto Michetti; <br><b>Rating: </b>3<br><b>When: </b>2 years ago<br>One of the first fountains built by the municipality of Rome after the unification of Italy ... dated 1872 is located a stone's throw from Piazza Navona.<br><br>",,PRK
25,41.8981206,12.4731517,65,67,"<a href=""http://060608.it/it/cultura-e-svago/beni-culturali/beni-architettonici-e-storici/fontana-del-moro.html""target=""_blank""> Moor Fountain </a><br><b>Rating: </b>4.7<br><b>Popularity: </b><br>514",[]<b>Author: </b>Vinay Kulkarni; <br><b>Rating: </b>5<br><b>When: </b>2 months ago<br>Lovely fountain in piazza novona. Nice old construction.<br><br><b>Author: </b>Davide Danti; <br><b>Rating: </b>5<br><b>When: </b>7 months ago<br>Amazing fountain in Piazza Navona!! Is a sculpure made in marble and is amazing by night!! 🇮🇹🌃❤️<br><br><b>Author: </b>Ievgenii Omelchenko; <br><b>Rating: </b>5<br><b>When: </b>7 months ago<br>Fontana del Moro is very nice fountain on the Piazza navona Square recommend to visit<br><br><b>Author: </b>David naftalis; <br><b>Rating: </b>5<br><b>When: </b>9 months ago<br>1 of the 3 great fountains in piazza navona.<br><br><b>Author: </b>Derek Stewart (Stew-Art-Prints); <br><b>Rating: </b>5<br><b>When: </b>a year ago<br>Epic square in Rome many gorgeous fountains to admire.<br><br>,,PRK
26,41.898937,12.473092,78,90,"<a href=""""target=""_blank""> Fontana dei Quattro Fiumi </a><br><b>Rating: </b>0.0<br><b>Popularity: </b><br>0",,,PRK
27,41.8989449,12.4730937,58,0,"<a href=""http://www.stadiodomiziano.com/""target=""_blank""> Area Archeologica Stadio di Domiziano </a><br><b>Rating: </b>0.0<br><b>Popularity: </b><br>0",,,MUSE
28,41.8989673,12.4730872,59,2,"<a href=""http://www.060608.it/it/cultura-e-svago/beni-culturali/beni-architettonici-e-storici/fontana-dei-fiumi.html""target=""_blank""> Fiumi Fountain </a><br><b>Rating: </b>4.8<br><b>Popularity: </b><br>4538","[]<b>Author: </b>Marcos Chavarria; <br><b>Rating: </b>5<br><b>When: </b>a month ago<br>All comments agree in one thing. This is a beautiful square, the 4 rivers fountain is a great sight. The details and the history behind it are just marvelous. You can have a coffee. Lunch or dinner at the surrounding restaurants, have a look at the daily life at the Piazza Navona is just delightful. Recommended for all parties<br><br><b>Author: </b>Shelby Elkins; <br><b>Rating: </b>5<br><b>When: </b>a month ago<br>Always a pretty sight to see! Of course, Piazza Navona is free to visit. There are plenty of food options in the square and so much to see. The church is free to visit, and the three fountains are very nice. You can even talk to a psychic and learn your possible destiny!🤫<br><br><b>Author: </b>Mahammad Alizada; <br><b>Rating: </b>5<br><b>When: </b>7 months ago<br>Amazing<br><br><b>Author: </b>Regan; <br><b>Rating: </b>5<br><b>When: </b>4 months ago<br>The coolest back story for a fountain ever! The figures on the fountain are all covering their faces to save their eyes from the sight of a rival Architects Building adjacent. Brilliant! Incredible sculpture also and set an an impressive square.<br><br><b>Author: </b>Ivor Humphries; <br><b>Rating: </b>5<br><b>When: </b>2 months ago<br>This is one of many unique architectural fountains that can be found in Rome,nearly every corner you turn there are magnificent buildings fountains & historical ruins it’s one amazing place to visit....This particular Fountain was designed by Gian Lorenzo in 1651,it was unveiled to the people of Rome on the 12th of June 1651...I can highly recommend a tour of this magnificent City<br><br>",,PRK
29,41.8989673,12.4730872,29,0,"<a href=""http://www.060608.it/it/cultura-e-svago/beni-culturali/beni-architettonici-e-storici/fontana-dei-fiumi.html""target=""_blank""> Fiumi Fountain </a><br><b>Rating: </b>4.8<br><b>Popularity: </b><br>4538","[]<b>Author: </b>Marcos Chavarria; <br><b>Rating: </b>5<br><b>When: </b>a month ago<br>All comments agree in one thing. This is a beautiful square, the 4 rivers fountain is a great sight. The details and the history behind it are just marvelous. You can have a coffee. Lunch or dinner at the surrounding restaurants, have a look at the daily life at the Piazza Navona is just delightful. Recommended for all parties<br><br><b>Author: </b>Shelby Elkins; <br><b>Rating: </b>5<br><b>When: </b>a month ago<br>Always a pretty sight to see! Of course, Piazza Navona is free to visit. There are plenty of food options in the square and so much to see. The church is free to visit, and the three fountains are very nice. You can even talk to a psychic and learn your possible destiny!🤫<br><br><b>Author: </b>Mahammad Alizada; <br><b>Rating: </b>5<br><b>When: </b>7 months ago<br>Amazing<br><br><b>Author: </b>Regan; <br><b>Rating: </b>5<br><b>When: </b>4 months ago<br>The coolest back story for a fountain ever! The figures on the fountain are all covering their faces to save their eyes from the sight of a rival Architects Building adjacent. Brilliant! Incredible sculpture also and set an an impressive square.<br><br><b>Author: </b>Ivor Humphries; <br><b>Rating: </b>5<br><b>When: </b>2 months ago<br>This is one of many unique architectural fountains that can be found in Rome,nearly every corner you turn there are magnificent buildings fountains & historical ruins it’s one amazing place to visit....This particular Fountain was designed by Gian Lorenzo in 1651,it was unveiled to the people of Rome on the 12th of June 1651...I can highly recommend a tour of this magnificent City<br><br>",,TOUR
30,41.8991633,12.4730742,20,21,Piazza Navona,"<b>742</b><br> 
Dead center of Piazza Navona, outside the church of St",742.0,LIB
31,41.9002133,12.4725301,46,125,"<a href=""http://www.stadiodomiziano.com/""target=""_blank""> Stadium of Domitian </a><br><b>Rating: </b>4.2<br><b>Popularity: </b><br>720","[]<b>Author: </b>Zoe Walker; <br><b>Rating: </b>5<br><b>When: </b>7 months ago<br>Great hidden historical gem beneath Piazza Navona. Entry includes an smart audio guide pen. A lot of extra information relating to the period is also available. In depth information about the stadium and games held here, many videos playing on loop too.
Recommended!<br><br><b>Author: </b>Etty Villanueva; <br><b>Rating: </b>5<br><b>When: </b>7 months ago<br>Nice archeological museum with fun details and comprehensive audio guide. Recommended!<br><br><b>Author: </b>Rui Oliveira; <br><b>Rating: </b>5<br><b>When: </b>7 months ago<br>An amazing view of one of the greatest places of antic Rome<br><br><b>Author: </b>Rachel Ridler; <br><b>Rating: </b>4<br><b>When: </b>a year ago<br>Really interesting little museum.  Audio guide is essential to get the most out of this, and there isn't lots of the stadium left, but they have done a great job in showing how it was found and what it would have looked like.
Included in our turbo pass tickets and glad we got to visit it.<br><br><b>Author: </b>Tobi; <br><b>Rating: </b>1<br><b>When: </b>2 years ago<br>Audio Guides are without earpods and in my Example I Bought one bottle of iced tea and its Date of expiry was over...in the end i could Not feel Good if i said it was nice...Not very well<br><br>",,MUSE
32,41.899677,12.470511,35,177,"<a href=""http://www.etabli.it/""target=""_blank""> Etablì </a><br><b>Rating: </b>4.4<br><b>Popularity: </b><br>1068","[]<b>Author: </b>Marcos M; <br><b>Rating: </b>5<br><b>When: </b>5 months ago<br>Amazing food, great wine. This is Rome. Waitress recommended all of our food and I couldn’t be happier!<br><br><b>Author: </b>George Kolios; <br><b>Rating: </b>5<br><b>When: </b>a year ago<br>A warm place for every hour of the day in the center of Rome. Tasty food and a nice atmospheric bar. The waiters were very friendly and the service perfect. We will be back again…<br><br><b>Author: </b>Jeremy Holifield; <br><b>Rating: </b>5<br><b>When: </b>a year ago<br>exceptional cheese flavors and cooked perfectly.  The waiter recommended two pizzas, but one sufficed.  Highly recommend.<br><br><b>Author: </b>Alfonso Irnan; <br><b>Rating: </b>5<br><b>When: </b>a year ago<br>Great ambience for a few drinks or even for a dinner. The meals are good in quality, the selection of drinks is also excellent, with some cocktails to delight. Very advisable.<br><br><b>Author: </b>Benedict Hince; <br><b>Rating: </b>4<br><b>When: </b>a year ago<br>A really comfortable and warm place with good coffee. The comfy chairs really won me over, as did the interior design. I can't vouch for the food as I did not try anything.

But I'd be happy to recommend this place as a good meeting point to grab a coffee.<br><br>",,CLUB
33,41.899581,12.4745405,30,333,"<a href=""http://saintlouis-rome.net/""target=""_blank""> Church of St. Louis of the French </a><br><b>Rating: </b>4.8<br><b>Popularity: </b><br>4375","[]<b>Author: </b>Father Kenny Ang; <br><b>Rating: </b>5<br><b>When: </b>6 months ago<br>This is one of my favorite churches in Rome, since I especially love Caravaggio and his works. Every time I come here, I almost always head directly to the Contarelli chapel just to delight in his three paintings of St. Matthew. My favorite one is the Calling of St. Matthew on the left-side wall of the chapel (which is the darker side of the wall, unfortunately). When I went there yesterday, some ladies already put some euros into the machine so the entire chapel was brightly illuminated. I was a lucky pilgrim and photographer!<br><br><b>Author: </b>Veranika Tsybulskaya; <br><b>Rating: </b>5<br><b>When: </b>7 months ago<br>Spectacular! Definitely worth to visit not only for a Caravaggio works, but for an ambience itself. Rich and spaced. Were lucky to end up there during the organ mass - truly recommend!<br><br><b>Author: </b>Iman Traveler; <br><b>Rating: </b>5<br><b>When: </b>2 months ago<br>3 Caravaggio paintings!!! What could you expect more?

Short explain:
is a Roman Catholic church in Rome, not far from Piazza Navona. The church is dedicated to the Virgin Mary, to St. Denis the Areopagite and St. Louis IX, king of France. The church was designed by Giacomo della Porta and built by Domenico Fontana between 1518 and 1589, and completed through the personal intervention of Catherine de' Medici, who donated to it some property in the area. It is the national church in Rome of France.<br><br><b>Author: </b>George; <br><b>Rating: </b>5<br><b>When: </b>8 months ago<br>The ceiling is covered in beautiful art. If you are in the area you must pop in for a look. It is free and marvelous.<br><br><b>Author: </b>Ron Nederpelt; <br><b>Rating: </b>5<br><b>When: </b>5 months ago<br>I Caravaggi. I CARAVAGGI! A day without seeing a painting by Caravaggio is a day not lived.<br><br>",,TOUR
34,41.8997351,12.4746038,12,17,Sant’Eustachio,"<b>391</b><br>Cars
to Piazza della Rotunda, Via delgi Orfani, Piazza Sant’Ignacio, and Sant’Eustachio",391.0,LIB
35,41.8993212,12.4767522,64,183,"<a href=""http://www.sovraintendenzaroma.it/i_luoghi/roma_medioevale_e_moderna/fontane/fontana_di_piazza_della_rotonda""target=""_blank""> Obelisco del Pantheon </a><br><b>Rating: </b>4.7<br><b>Popularity: </b><br>824","[]<b>Author: </b>Michael Pilgrom; <br><b>Rating: </b>5<br><b>When: </b>a month ago<br>Definitely visit. It's free and very interesting<br><br><b>Author: </b>Michael Ibukun; <br><b>Rating: </b>5<br><b>When: </b>a month ago<br>Pantheon, temporarily closed due to Covid19 restrictions. It looks cool on the outside, and I think that's enough to see.<br><br><b>Author: </b>Muhammad Hamza; <br><b>Rating: </b>5<br><b>When: </b>2 months ago<br>A Great place to enjoy your time and have some quality food as well.<br><br><b>Author: </b>Lorenzo Falorni; <br><b>Rating: </b>5<br><b>When: </b>10 months ago<br>Next to the Brazilian Embassy and if you take a right you end up in the Senate of the Republic.There's plenty of space, and the fountain may be looked upon from all angles too.<br><br><b>Author: </b>Nancy Aiello Tours; <br><b>Rating: </b>5<br><b>When: </b>10 months ago<br>Apart from the Pantheon itself, the most distinguishing landmark on the Piazza della Rotonda is the Fountain of the Pantheon, crowned by an Egyptian obelisk which dates back to the 12th century BC.<br><br>",,PRK
36,41.8992619,12.4768866,11,12,Piazza della Rotunda,"<b>408</b><br>.”
As they rounded the corner into Piazza della Rotunda, the Pantheon rose before them<br><b>390</b><br>Cars
to Piazza della Rotunda, Via delgi Orfani, Piazza Sant’Ignacio, and Sant’Eustachio",390.0,LIB
37,41.9016542,12.4749434,71,310,"<a href=""http://www.comune.roma.it""target=""_blank""> Fontana Vasca della Scrofa </a><br><b>Rating: </b>4.0<br><b>Popularity: </b><br>9","[]<b>Author: </b>Stefano Bucciarelli; <br><b>Rating: </b>4<br><b>When: </b>5 months ago<br>I would have liked...

I would have paid to watch the spectacle of the carriages, wagons and carts passing through the old narrow streets without pavement of vanished Rome.
As their number increased dramatically, many of the fountains the city had equipped itself with, which reduced the carriageway, began to create problems.
Moving them for traffic reasons was a widespread practice and via della Scrofa follows exactly the layout of an ancient Roman road and the fountain of the same name has not escaped the rule.
But the memory of it remains in a bas-relief left in its original position, along the facade of the building that was the convent of the Augustinians.
While not far away, right at the corner with via dei Portoghesi, there is now the small hanging tub with the superimposition of a simple cinnamon, from which a jet of fresh water comes out.
It is protected by three small columns connected to each other by two iron bars.<br><br><b>Author: </b>Stefano Manzo; <br><b>Rating: </b>5<br><b>When: </b>2 years ago<br>The Fontana della Scrofa (located in the street of the same name) is located in the VIII Eustachio district, once it was in the position, where today there is a bas-relief depicting a sow.

In the fifteenth century the bas-relief was walled up and at the end of the sixteenth century it was transformed into a fountain with the addition of a small basin.

In 1874 with Rome became the capital of Italy, the traffic in the area increased dramatically and therefore was a hindrance, so the bas-relief remained at its original point, while the fountain itself was moved a short distance to the corner of the street with Via dei Pellegrini .

The above is indicated in an inscription placed below the bas-relief:

IN THIS PLACE
IT WAS PLACED
FOUNTAIN
MOVED TO THE CORNER OF THE VIA DEI PORTOGHESI
IN THE YEAR 1874

The fountain then placed at the aforementioned corner is made up of a small nozzle, from which the water that flows onto the cup-shaped basin comes out, from which in turn the water arrives in a collection basin on the ground.

Three columns connected by bars that serve as an area of ​​protection are placed as protection.<br><br><b>Author: </b>Alessandro Romanella; <br><b>Rating: </b>4<br><b>When: </b>3 years ago<br>The ""real"" fountain of the Scrofa existed in the same street that takes its name, and was built in 1580 at the behest of Pope Gregory XIII. In 1873 it was moved because it caused considerable obstruction to traffic. The bas-relief was left in its original position, and instead the small cup-shaped hanging basin was moved a little further on, just at the corner with Via dei Portoghesi.<br><br><b>Author: </b>Paolo Emilio Capaldi; <br><b>Rating: </b>2<br><b>When: </b>3 years ago<br>Small pool that was in Via della Scrofa, where is the small sculpture depicting a sow.
Today, for convenience, it has been moved a few meters to the corner of Via della Stellette.<br><br><b>Author: </b>Roberto Michetti; <br><b>Rating: </b>3<br><b>When: </b>3 years ago<br>Very small fountain of little artistic value ... it is however one of the oldest in this district.<br><br>",,PRK
38,41.9031315,12.4747449,70,165,"<a href=""http://www.sovraintendenzaroma.it/i_luoghi/roma_medioevale_e_moderna/fontane/fontana_in_piazza_nicosia""target=""_blank""> Fontana di Piazza Nicosia </a><br><b>Rating: </b>4.0<br><b>Popularity: </b><br>11","[]<b>Author: </b>KH Wong; <br><b>Rating: </b>2<br><b>When: </b>a year ago<br>Just a small square with a fountain. Not much really.<br><br><b>Author: </b>Stefano Bucciarelli; <br><b>Rating: </b>4<br><b>When: </b>5 months ago<br>It characterizes the square

Every time I try the history books, I rub my eyes to reread the events of this city.
In Piazza Nicosia, suffocated by parked cars, there is the beautiful fountain designed by Giacomo Della Porta.
Not just any one, because in Rome there are many works that bear his signature. But this one is not like the others and it was not as we see it today, because it was originally located in Piazza del Popolo, long before Valadier dedicated himself to it heart and soul with his genius.
What we see remains: the elevated octagonal basin, the elegant balustrade in cipollino marble and a basin decorated with heraldic emblems.
Only three small columns connected by two iron bars protect it from modernity.<br><br><b>Author: </b>Maria Tanasa; <br><b>Rating: </b>5<br><b>When: </b>8 months ago<br>The fountain in Piazza Nicosia was originally located in Piazza del Popolo, was built in 1572 by Giacomo della Porta for Pope Gregory XIII Boncompagni, whose dragon we note on the basin, to inaugurate the restoration of the Virgin Aqueduct.
When Giuseppe Valadier carried out the current restyling of the Piazza del Popolo in 1823, it was demolished to be relocated to Piazza Nicosia in 1950, when renovation work was carried out on the area coordinated by the architect Marcello Piacentini.<br><br><b>Author: </b>vincenzo marsella; <br><b>Rating: </b>4<br><b>When: </b>4 months ago<br>Beautiful fountain<br><br><b>Author: </b>Stefano Manzo; <br><b>Rating: </b>3<br><b>When: </b>2 years ago<br>The Fontana del Trullo was designed by Giacomo Della Porta in 1572.

Today it is located in Piazza Nicosia, it was placed here in 1950 (after having been dismantled for several years in the warehouses of the municipality).

Very beautiful is the octagonal basin, raised by two steps of the same shape, is the only original part left, the rest are reconstructions.

Fortunately it is protected by an area of ​​respect delimited by columns, connected with iron bars.

Unfortunately, the vehicles parked around and the small size of the Piazza, do not give the right emphasis to the work.<br><br>",,PRK
39,41.90984279999999,12.4728453,18,762,Ponte Margherita,"<b>543</b><br> 73
G unther Glick floored the BBC van’s accelerator and swerved through traffic as he e 
tailed the four speeding Alpha Rom os across the Tiber River on Ponte Margherita",543.0,LIB
40,41.9108187,12.4706845,55,209,"<a href=""http://archeologialazio.beniculturali.it/""target=""_blank""> Soprintendenza Archeologica del Lazio e dell'Etruria meridionale </a><br><b>Rating: </b>4.0<br><b>Popularity: </b><br>3",[]<b>Author: </b>Paolo Emilio Capaldi; <br><b>Rating: </b>4<br><b>When: </b>4 years ago<br>Kindness and competence<br><br><b>Author: </b>Gianluca Carroccia; <br><b>Rating: </b>3<br><b>When: </b>5 years ago<br><br><br><b>Author: </b>Santino Palomba; <br><b>Rating: </b>5<br><b>When: </b>4 years ago<br><br><br>,,MUSE
41,41.9115413,12.4760243,15,449,Porta del Popolo,<b>448</b><br>.” Langdon pointed to the imposing Porta del Popolo-the high stone archway at the far end of the piazza,448.0,LIB
