,LAT,LON,order,Distance [m],lugares,quotes,Position_book,Type
0,41.89881949999999,12.4544592,0,0,"<a href=""http://www.starhotels.com/en/our-hotels/michelangelo-rome/""target=""_blank""> Starhotels Michelangelo </a><br><b>Rating: </b>4.4<br><b>Popularity: </b>947","[]<b>Author: </b>David St; <br><b>Rating: </b>5<br><b>When: </b>4 months ago<br>Great hotel near the Vatican. The hotel was close to public transport and where the locals ate. So getting an authentic Local experience and food was  simple.<br><br><b>Author: </b>Amanda Rose; <br><b>Rating: </b>4<br><b>When: </b>a year ago<br>Overall we enjoyed our experience. Rooms were clean and nice. Staff met accommodations. We only ate there for morning breakfast which was the same each morning. Not many additional amenities to the hotel. Very close to Vatican but far from other tourists stops<br><br><b>Author: </b>M G; <br><b>Rating: </b>4<br><b>When: </b>a year ago<br>Elegant hotel located on a 5 minute walk from St. Peter's square. We received a room upgrade upon arrival, which was a nice gesture. If possible get a room with balcony as you can see the Dome from there. The hotel is spotlessly clean and the room was spacious and well-equipped as compared to other Rome hotels we have visited.  The hotel's staff was courteous and welcoming (apart for some of the waitresses at the restaurant, who were not very attentive - e.g. they would not ask if you need anything like espresso). The hotel is in a very convenient and quiet location. One thing that could be improved is the breakfast - while the variety was satisfactory, it was one and the same each morning. The New Year's buffet dinner was a bit of a disappointment - the mood was not particularly festive and it closed before the start of the new year. Food was also a bit on the bland side.<br><br><b>Author: </b>Bob P.; <br><b>Rating: </b>4<br><b>When: </b>a year ago<br>Great location near everything! Friendly staff with good english. That's important to me since I'm totally ignorant of other languages. I might have been "" put on the elevator"" a bit due to a ""reservation foul-up"" that wouldn't make the room price I had reserved available for 2 days. They gave me an ""upgraded"" room for the first 2 days for the original price but said I would either have to move to the cheaper room after that or pay the upgraded price to stay in the original room. I decided to stay put. Who wants to pack up and move? Long story short it might have been a simple bait and switch type of thing, but I'm not sure. Oh, the room is nice but I don't know what the ""upgrade might be"". Recommend none the less.<br><br><b>Author: </b>Kate Heltemes; <br><b>Rating: </b>5<br><b>When: </b>a year ago<br>This was our favorite hotel of our European vacation. Very clean and spacious, although I think we had one of the better rooms. Bathroom was great. We had a balcony in the room and a balcony in the bathroom. We did some sink laundry and let it dry in the balcony. This was our plan so we wouldn't have to pack as much clothing.

It was easy to catch an uber or taco from this hotel. Walking distance to the subway which was easy to use. We were able to travel to many destinations by walking it taking the subway. I recommend getting a subway ticket that includes unlimited rides for x amount of time. I think we did 48 hours.

Breakfast had many options and was very good. While Rome itself was very dirty with trash pretty much all over this hotel was very clean inside and out. I would definitely return to this hotel.<br><br>",,HOTEL
1,41.9017028,12.4540728,48,322,"<a href=""http://www.vatican.va/roman_curia/institutions_connected/uffscavi/documents/rc_ic_uffscavi_doc_gen-information_20090216_it.html""target=""_blank""> Vatican Necropolis </a><br><b>Rating: </b>4.7<br><b>Popularity: </b><br>553","[]<b>Author: </b>Kim Koch Rasmussen; <br><b>Rating: </b>5<br><b>When: </b>9 months ago<br>Very interesting place to visit - you will see a lot, and end the tour in the Vatican Grotto with easy access to Saint Peter's Basilica.

Highly recommended<br><br><b>Author: </b>Oliver Stothert; <br><b>Rating: </b>1<br><b>When: </b>5 months ago<br>Nice place, just a shame the pope is a nonce<br><br><b>Author: </b>Eva; <br><b>Rating: </b>5<br><b>When: </b>a year ago<br>A very special place with a fascinating history. Outside off the beaten tourist paths. But don't think it's cold 12 meters under the ground! It is very humid and warm to preserve the original conditions (according to the archeologist). With outside 33 degrees it had approximately the same here, better bring something to drink.<br><br><b>Author: </b>Hagop Araklian; <br><b>Rating: </b>5<br><b>When: </b>a year ago<br>Being in Rome, Vatican is must visited, beautiful Cathedral and astonishing museum. Plz consider a long day due to queue and absolutely many spot to be discovered.<br><br><b>Author: </b>Damien Gill; <br><b>Rating: </b>5<br><b>When: </b>a year ago<br>Unique way to visit and see areas of the vatican that you will not be able to see from the normal ""public"" access to the basilica above.

Guide is very knowledgeable and you need to book couple of months in advance of your trip. Highly recommend it as it is very inexpensive but also very , very unique.<br><br>",,MUSE
2,41.90216669999999,12.4539367,24,52,"<a href=""http://www.vatican.va/various/basiliche/san_pietro/index_it.htm""target=""_blank""> St. Peter's Basilica </a><br><b>Rating: </b>4.8<br><b>Popularity: </b><br>118824","[]<b>Author: </b>Thomas Sallermann; <br><b>Rating: </b>4<br><b>When: </b>6 months ago<br>This is the most important place in Roman Catholicism. The building in itself is quite impressive. You can discover lots of beautiful art. Fortunately not all the money💶 made by the church is given to the poor. It seems that comparatively few people come here to pray (I discovered some nuns in a small chapel doing this). Please wear the mask😷. Protect the Vatican.<br><br><b>Author: </b>Vedat Odacı; <br><b>Rating: </b>4<br><b>When: </b>2 months ago<br>We can call St. Peter's Basilica as the most important Catholic House of Worship in the world. Just as the Kaaba is important for Muslims, St. Peter's Basilica is of similar importance to Christians. The only difference is that in addition to its religious importance, this place is also interesting in terms of art and tourism.

The basilica, one of the 12 apostles of Christ and built on the tomb of St. Peter's (or at least the tomb of the person thought to be St. It is also one of the most important stops of travel.

Being the largest church in the world in terms of its area of ​​coverage, St. In addition to being a religious building, Peter’s Basilica is an exquisite example of Renaissance architecture and perhaps the most expensive artworks in the world.

Located in the heart of the Vatican, in St. Peter's Square (St. Peter's Square or St. Peter's Square), St. Peter's Basilica is an important and striking structure with its interior, exterior, underground part, in short, with every centimeter.<br><br><b>Author: </b>Al Dhalla; <br><b>Rating: </b>5<br><b>When: </b>2 months ago<br>It was an incredible experience. We joined a tour group. They picked us up from the hotel and they assisted us through the security and had preferred seating for us. We attended a mass. We had a great view of the Pope as he entered the area and took some great photos. After the mass, we walked around, visited the gift shop, got some lunch and went back to our hotel. Overall great visit and highly recommended. Thank you.<br><br><b>Author: </b>Philip Kearns; <br><b>Rating: </b>5<br><b>When: </b>8 months ago<br>Really needs to be seen to be appreciated. No church in the world comes close to its grandeur, history and magnificence, and visiting is completely free! Regardless of your religion do not visit Rome without taking the time to visit St Peters. I recommend getting either a tour or an audio guide to really get an appreciation of the various art works and historical artefacts. One of the lesser appreciated pieces that I found interesting and beautiful was the massive porphyry baptism font. Of course climbing the cupola is definitely worth the time and effort as well.<br><br><b>Author: </b>Sachin Vats; <br><b>Rating: </b>5<br><b>When: </b>in the last week<br>What a wonderful Architecture. It is so magnificent and has wow effect. The whole area make you wonder how it was planned and built so beautifully. A great demonstration of art and very religious place of worship for catholics around the world. People travel here from around the world to see Rome and see the St Peter's Bassilica. A must visit place in Rome, Italy.<br><br>",,TOUR
3,41.9021667,12.4539367,4,0,St. Peter’s Basilica,"<b>581</b><br>However,ter assessing the situation, I am confident the antimatter canister is located in one of our white zones-those Vatican sectors accessible to public tours-the museums and StPeter’s Basilica, for example<br><b>513</b><br>StPeter’s Basilica<br><b>662</b><br> 
Thirty second 
, Vittoria was standing before a corpse when
s later, in the Vatican Grottoes 
the electronic squawk of a walkie-talkie broke the silence<br><b>835</b><br>when Langdon stepped with the others from StPeter’s Basilica<br><b>149</b><br>Like a mountain parting the morning fog, the colossal dome rose out of the haze before them: StPeter’s Basilica<br><b>657</b><br> 85
T he Holy Vatican Grottoes are located beneath the main floor of StPeter’s Basilica<br><b>1015</b><br>And had he not ascended miraculously into a pillar of fire, he would now be buried in the Vatican Grottoes along with the other Popes<br><b>179</b><br> 
After parking the cart on the wide lawn directly behind StPeter’s Basilica, the guard escorted Langdon and Vittoria up a stone escarpment to a ma 
k of the
rble plaza off the bac 
basilica<br><b>911</b><br>Is this really happening?
Camerlegno Carlo Ventresca stood on the rooftop terrace of StPeter’s Basilica and looked down over the m 
ople stari 
ultitudes of pe 
ng up at him<br><b>912</b><br>alighting like a silent angel on the deserted lawns, his black parachute shrouded from the madness by the towering shadow of StPeter’s Basilica<br><b>897</b><br>Everyone was pointing behind him 
toward the front of StPeter’s Basilica<br><b>844</b><br> 
With a final joyous exultation, the camerlegno turned and dashed back into StPeter’s Basilica<br><b>170</b><br> 35
T he Vatican’s helipad, for reasons of safety and noise control, is located in the northwest tip of Vatican City, as far from StPeter’s Basilica as possible<br><b>656</b><br> 85
T he Holy Vatican Grottoes are located beneath the main floor of St<br><b>585</b><br>We must rememb 
u 
er that the cardinals spent m ch of today in the
Vatican museums and StPeter’s Basilica, enjo 
reas without the crowds<br><b>879</b><br> 121
T he camerlegno erupted through the doors of StPeter’s Basilica at exactly 11:56 P<br><b>674</b><br> 
Only a hundred yards away, inside the thick walls of StPeter’s Basilica, the world was serene<br><b>183</b><br> 
The Office of the Swiss Guard is housed adjacent to Il Corpo di Vigilanza, directly northeast of StPeter’s Basilica<br><b>845</b><br> 
The main aisle of StPeter’s Basilica, Lieutenant Chartrand had once figured out, was longer than an Olympic soccer field<br><b>995</b><br> 
Deep in the Vatican Grottoes 
s<br><b>550</b><br>The springtime sun was setting behind StPeter’s Basilica, and a massive shadow spread, engulfing the piazza<br><b>851</b><br>On this very location, Langdon realized-Vatican Hill-Peter had been crucified and buried<br><b>980</b><br> 
The camerlegno staggered now through the dark 
e 
ness of StPeter’s Basilica<br><b>637</b><br> 83
F lashlights were no match for the voluminous blackness of StPeter’s Basilica",149.0,LIB
