,LAT,LON,order,Distance [m],lugares,quotes,Position_book,Type
0,41.9073982,12.4517011,0,0,"<a href=""http://www.hotelspringhouse.com/""target=""_blank""> Best Western Plus Hotel Spring House </a><br><b>Rating: </b>4.4<br><b>Popularity: </b>849","[]<b>Author: </b>Adam Gyökhegyi; <br><b>Rating: </b>5<br><b>When: </b>9 months ago<br>Staff was extremely helpful and attentive! :) Payed great attention to cleanliness throughout the hotel at every step, sanitizing even the pen I signed in with. The location is superb, especially if you have tickets to the Vatican Museum which is just around the corner. Shops, metro, etc. all within walking distance, major downtown sights about 20 minutes by public transport. The room was impressive, comfortable, well air conditioned. Breakfast seemed a bit chaotic at first, but was eventually handled really well with the possibility for open air seating.<br><br><b>Author: </b>Islam Faress; <br><b>Rating: </b>1<br><b>When: </b>8 months ago<br>Terrible Experience.

Extremely noisy rooms and 45 minutes waiting in the queue for breakfast!!

The WiFi signal is non-existent. The water in the shower in annoyingly weak!

It doesn't look anything like a 2 star hotel even.<br><br><b>Author: </b>David Connell; <br><b>Rating: </b>5<br><b>When: </b>a year ago<br>Great staff.  Very helpful.  Extremely professional.   Room spotless.  3 minutes from Cipro Metro Station and the same from Vatican Museum entrance .  I would highly recommend.   Breakfast is free and great choice.<br><br><b>Author: </b>ElysonGavin Lebig; <br><b>Rating: </b>4<br><b>When: </b>a year ago<br>Overall, my experience with this hotel was fantastic! I almost want to rate it 5 stars, but it was not perfect.  First, the service staff was extremely friendly and helpful.  In this hotel, the elevator is extremely small, a common hotel feature throughout Europe, so I got worried because my family brought a lot of luggage.  Yet, I think the staff is aware of this, so they offer to bring your luggage to your room, which created a good, initial impression on me.  In addition to the staff, I  liked the room my family got.  The room was very clean and modern-looking; furthermore, it also came with a nice, spacious patio!  After seeing my room, I still could not believe I was in a best western hotel.  The only reason why I can't give this hotel 5 stars is the room tends to get hot very easily.  The room has AC, but it is very weak.  Besides a few problems, I would most definitely recommend this hotel to anyone traveling to Rome!<br><br><b>Author: </b>Sandy Kelver; <br><b>Rating: </b>5<br><b>When: </b>a year ago<br>We stayed 4 nights at this Best Western Plus hotel in Rome.  All the staff are friendly, helpful and make you feel welcomed from the minute you walk in the front door.  Rooms are a good size and very clean.  Bedding and towels are a nice quality.  The hotel is located within a 5 minute walk from the subway station and Vatican museum.  The bar and restaurant, located inside the hotel, offers a small menu but the variety of food offered is likely to appeal to most everyone.  The food is yummy!  If we were to return to Rome we would definitely stay here.<br><br>",,HOTEL
1,41.8932529,12.484504,3,3137,Vatican Prison,"<b>209</b><br>.”
’s a pretty big 
“What’s he going to do, shoot me for using the phone?”
“Who the hell knows! This is a pretty strange place, and the wa going-”
y things are 
“Either that,” Vittoria said, “or we can spend the next five hours and forty-eight minutes in Vatican Prison",209.0,LIB
2,41.8902102,12.4922309,2,723,the Roman Coliseum,<b>145</b><br>His eyes found the crumbling ruins of the Roman Coliseum,145.0,LIB
3,41.90278350000001,12.4963655,1,1439,Rome,"<b>416</b><br>“It is my job to make your visit to Rome more interesting<br><b>113</b><br> 
“Rome? But <br><b>415</b><br>The sarcophagus, like many in Rome, was askew with the wall, positioned awkwardly<br><b>112</b><br>“The antimatter is in Rome? Who called?”
Kohler’s face was twisted, his gray eyes watering<br><b>492</b><br>.”
“Who other than a famous Vatican artist would have had the clout to put his artwork in 
specific Catholic chapels around Rome and create the Path of Illumination?notCertainly 
an unknown<br><b>505</b><br>“And I
don’t know Rome’s churches well enou-” He stopped<br><b>244</b><br>What else do I know? That this whole situation is insanity, that’s what I know! “After the brandings, the scientists were murdered, and their bodies were dropped in public locations around Rome as a warning to other scientists not to join the Illuminati<br><b>565</b><br>apparently one of Rome’s homeless<br><b>726</b><br>There was
knew, of course, the spear was pointing far beyond the wall, into the night, somewhere across Rome<br><b>11</b><br>To my dear friend Irv Sittler, for facilitating my audience with the Pope, secreting me into parts of Vatican City few ever see, and making my time in Rome unforgettable<br><b>803</b><br>Angelo, staring out across Rome, her eyes moist with tears<br><b>528</b><br> 
“Besides, the poem says the elements are spread across Rome <br><b>417</b><br>.”More interesting?
s certain this part Langdon wa 
icular visit to Rome was plenty 
interesting<br><b>736</b><br>When he leaned in to examine where he had placed the final mark, Langdon was surprised to find that the fourth point lay dead center of Rome’s famed Piazza Navona<br><b>140</b><br> 
Langdon knew that with Rome’s maniacal drivers, flying was probably safer anyway<br><b>424</b><br>In Rome<br><b>425</b><br>“This was Raphael’s only tomb in Rome<br><b>554</b><br>It seemed Rome was suddenly filled with ellipses, pyramids, and startling geometry<br><b>64</b><br> 
“Then the scientists were brutally murdered, their dead bodies dropped in the streets of Rome as a warning to others thinking of joining the Illuminati<br><b>672</b><br>He pictured the Vatican Curator collapsing in spasms of outrage at the thought of this priceless artifact being packed around Rome like some tourist ma 
thought of the m 
p<br><b>282</b><br>“What’s the angle?”
“Do you have a TV reporter in Rome covering the election?”
“I believe so<br><b>309</b><br>“The pieces blended into the sea of religious artwork all over Rome<br><b>732</b><br>Somehow he had imagined the churches would be scattered randomly across Rome<br><b>310</b><br>By donating the artwork anonymously to specific churches and then using their political influence, the brotherhood facilitated placement of these four pieces in carefully chosen churches in Rome<br><b>741</b><br>A cross!’Cross Rome the mystic elements unfold!
It was cunning wordplay<br><b>510</b><br>There are hundreds of churches in Rome , he thought<br><b>61</b><br>The scientists met regularly in Rome at an ultrasecret lair they called the Church of Illumination <br><b>507</b><br>Like an o 
i 
cean on f re, the red-tiled rooftops of Rome spread
out before him, glowing in the scarlet sunset<br><b>401</b><br>Like every man there, Chartrand was Swiss Arm 
d tw 
y trained and had endure 
o
years of additional ausbildingin Bern before qualifying for the grueling Vatican pròvaheld in a secret barracks outside of Rome<br><b>664</b><br>Where are we going?”88
E ven with its siren now affixed and blaring, Olivetti’s Alpha Romeo seemed to go unnoticed as it rocketed across the bridge into the heart of old Rome<br><b>574</b><br>.”
At that exact instant, somewhere in Rome, the Hassassin enjoyed a fleeting moment of repose in a comfortable chair<br><b>762</b><br>Four markers, he thought, spread across Rome in a giant cross<br><b>302</b><br>First, the sculptures had to look like the rest of the artwork in Rome <br><b>686</b><br>Rome sat riveted, as did the rest of the world<br><b>465</b><br>Gunther Glick was checking his map of Rome, apparen t<br><b>1018</b><br>there was no more fitting hotel in all of Rome<br><b>559</b><br>Not in his art books, not in his numerous trips to Rome, not everhad West Ponente ’s significance jumped out at him<br><b>411</b><br>Others sat enjoying Rome’s best iced coffee at La Tazza di Oro’soutdoor cafe<br><b>518</b><br>Unfortunately, Rome’s major churches were also Rome 
s <br><b>361</b><br> Show yourself, damn it! Show yourself!53
S omewhere beneath Rome the dark figure prowled down a stone ramp into the underground tunnel<br><b>266</b><br>.”
“You suggest we cancel conclave right now?”
“Do I have a choice?”
“What about your charge to bring a new Pope?”
The young chamberlain sighed and turned to the window, his eyes drifting out onto the sprawl of Rome 
ld m below<br><b>382</b><br>“But do you really think the first cardinal could be killed at the Pantheon? That’s got to be one of the busiest tourist spots in Rome<br><b>426</b><br>If Raphael’s tomb wasn’t in Rome in 1655, then what was the poem referring to? Santi’s earthly tomb with demon’s hole? What the hell is it? Think!
“Was there another artist called Santi?” Vittoria asked<br><b>141</b><br>Then with a roar, the craft shot up and banked sharply north toward Rome<br><b>512</b><br>In the distance, on the very edge of Rome, Michelangelo’s massive dome blotted the setting sun<br><b>759</b><br>His work in Rome was done<br><b>142</b><br> Rome<br><b>730</b><br>Finally, Langdon’s finger th 
ran out of churches and trailed off intoe suburbs of Rome<br><b>740</b><br> ’Cross Rome <br><b>491</b><br>Could it be that here in this tiny Chigi Chapel, the worldrenowned Bernini had placed a sculpture that pointed across Rome toward the next altar of science?
“Bernini,” he said<br><b>446</b><br>Spoils of Rome’s imperial 
elisks were scattered acrossplundering, ob 
Rome and referred to by symbologists as “Lofty Pyramids”-skyward extensions of the sacred pyramidal form<br><b>557</b><br>Today had been a day of phone tips, corpses, unmarked cars racing through Rome, and men in tweed jackets climbing scaffolding in search of God only knew what<br><b>116</b><br>.”31 
T he X-33 space plane roared into the sky and arched south toward Rome<br><b>147</b><br> 
As the chopper headed north, Langdon spied the Roman Forum-the heart of pre-Christian Rome<br><b>298</b><br>Unfortunately, though, because of the Illuminati’s secrecy, scientists arriving in Rome never knew where to go for the meetings or to whom they could safely speak<br><b>508</b><br>From that spot, for the first time in his life, Langdon saw beyond the pollution and traffic of Rome to its ancient roots-Città di DioThe city of God<br><b>590</b><br>Peter’s Square ac 
ross the Tiber River and up into the heart of 
old Rome<br><b>57</b><br>But in the 1500s, a group of men in Rome fought back against the church<br><b>595</b><br> 
“It’s a long shot,” Langdon said, “but I know that many of Rome’s obelisks were erected or moved during Bernini’s reign<br><b>380</b><br>Even in the 1600s, the Pantheon, with its tremendous, holed dome, was one of the best known sites in Rome<br><b>403</b><br>Nap time was eternal in the Eternal City-the ubiquitous public dozing a perfected extension of the afternoon siestas born of ancient Spain<br><b>915</b><br> American? Roma joked that Am 
ns often 
ericans had gotten so abundant in Rome that
hamburgers should become the official Italian food<br><b>376</b><br> 
p, a clue unveiling the four a 
the four markers that
blazed a secret path across Rome<br><b>270</b><br>Some of surrounding 
Rome may be in danger<br><b>604</b><br>All Catholic churches in Rome are property of the Vatican<br><b>898</b><br>Beyond the open door, the lights of Rome looked farther away with every passing second<br><b>504</b><br>One that shows all the churches in Rome<br><b>447</b><br>Spoils of Rome’s imperial 
elisks were scattered acrossplundering, ob 
Rome and referred to by symbologists as “Lofty Pyramids”-skyward extensions of the sacred pyramidal form<br><b>752</b><br> 
Nights in Rome, like those in the desert, can be surprisingly cool, even after a warm day<br><b>153</b><br>Peter’s Square was a staggering open space in the congestion of Rome, like a classical Central Park<br><b>511</b><br>Not to mention, Rome had changed dramatically since the 1600s when churches were by law the tallest buildings allowed<br><b>301</b><br>They created ma that
rkers 
faded into the backdrop of ancient Rome<br><b>666</b><br>All the traffic was moving in the other direction, toward the Vatican, as if the Holy See had suddenly become the hottest entertainment in Rome<br><b>591</b><br>“As you can see, the line passes through almost all of Rome<br><b>904</b><br>The sky above Rome had been filled with sights tonight <br><b>111</b><br>.”
“Rome?” Vittoria demanded<br><b>68</b><br> 
re survivors,” he explained 
“When they fled Rome, they traveled across Europe looking for a safe place to regroup<br><b>497</b><br>It was getting dark now, the springtime sun setting late in southern Rome 
<br><b>685</b><br>satanic
urde 
presence in Rome <br><b>729</b><br>He immediately realized he had asked the right people; the fire department’s map of Rome was as detailed as any Langdon had ever seen<br><b>517</b><br>The line missed, by a substantial margin, the cluster of black squares indicating Rome’s major churches<br><b>295</b><br>Galileo’s Illuminati needed to protect themselves from the Vatican, so they founded an ultrasecret Illuminati meeting place here in Rome<br><b>359</b><br> “Merda, as we say in Rome<br><b>369</b><br>Not only had Milton made a well-documented 1638
pilgrimage to Rome to “commune with enlightened men,” but he had held meetings with Galileo during the scientist’s house arrest, meetings portrayed a in m ny Renaissance
paintings, including Annibale Gatti’s famous Gal which hung even nowileo and Milton,
in the IMSS Museum in Florence<br><b>731</b><br> 
Surveying the whole of Rome, Langdon’s eyes touched down on the three churches where the first three cardinals had been killed<br><b>906</b><br>For this reason, the island had later become the site for Rome’s Hospital Tiberina<br><b>519</b><br>Unfortunately, Rome’s major churches were also Rome 
s <br><b>506</b><br>His view of Rome, however, got better with every step<br><b>957</b><br>In addition to these, the camerlegno had found the Illuminati Collection-all the secrets the church had uncovered after banishing the group from Rome <br><b>19</b><br>One question looms: Will this highly volatile substance save the world, or will it be used o 
to create the m st deadly weapon ever made?
AUTHOR’S NOTE
R eferences to all works of art, tombs, tunnels, and architecture in Rome are entirely factual (as are their exact locations)<br><b>753</b><br> A cross , Langdon thought, still amazed by the arrangement of the markers across Rome<br><b>651</b><br>Langdon hoped they could c 
the killer before he had to consider Water -Bernini had carved dozens of fountains in Rome, most of them in front of churches<br><b>531</b><br>Not Rome<br><b>992</b><br> 135
D awn came late to Rome<br><b>609</b><br>We have reports that two members of the College of Cardinals have been brutally murdered in Rome<br><b>764</b><br>All of Rome spread out before him was
<br><b>268</b><br>“Marching one hundred sixty-five cardinals unprepared and unprotected into Rome would be reckless<br><b>900</b><br>He raced 
in theto the open doorway of the chopper and stood
raging wind, gazing down at the lights of Rome below<br><b>385</b><br>“Earthly? Actually, there’s probably no more earthly place in Rome than the Pantheon<br><b>12</b><br>Nadeau, NuvoMedia andRocket E-books, Frank and Sylvia Kennedy, Rome Board of Tourism, Maestro GregoryBrown, Val Brown, Werner Brandes, Paul Krupin at Direct Contact, Paul Stark, Tom King at Computalk Network, Sandy and Jerry Nolan, Web guru Linda George, the National Academy of Art in Rome, physicist and fellow scribe Steve Howe, Robert Weston, the Water Street Bookstore in Exeter, New Hampshire, and the Vatican Observatory<br><b>594</b><br>four towering beacons rising over Rome to mark the altars of science<br><b>901</b><br> 
Beneath him, the lights of Rome spread out in all directions<br><b>245</b><br>Have you not counted lately? There are over four hundred Catholic churches in Rome<br><b>428</b><br>Half of the sculpting done
in Renaissance and Baroque Rome was for the funeraries<br><b>381</b><br> 
“Oldest Catholic church in Rome<br><b>423</b><br>“The Illuminati altars of science were here in Rome<br><b>534</b><br>Peter’s Square as part of Vatican City, but because it’s outside 
a the walled city, Rom n officials for centuries have claimed
it as part of Rome<br><b>739</b><br> ’Cross Rome the mystic elements unfold <br><b>744</b><br>Everyone who came to Rome went to see it<br><b>297</b><br>Word of Galileo’s brotherhood started to spread in the 1630s, and scien ts
tis 
from 
a around the world m de secret pilgrimages to Rome hoping to join the Illuminati <br><b>890</b><br>For that instant, a perfect and silent sphere of light glowed over Rome<br><b>127</b><br>.”32
L angdon held his breath as the X-33 spiraled into Rome’s Leonardo da Vinci International Airport<br><b>338</b><br>Like some of
Galileo’s previous manuscripts, Diagrammawas smuggled out of Rome ndby a friend a 
quietly published in Holland<br><b>738</b><br>sprawled across Rome in an enormous, city-wide cross<br><b>378</b><br>From there, across Rome, the markers blazed the trail<br><b>232</b><br>The IF signature suggests he’s somewhere in Rome 
, but there’s really no way to 
trace him<br><b>763</b><br>The bird’s deceptively dark color was the result of Rome’s pollution tarnishing the original bronze<br><b>110</b><br>“Rome",11.0,LIB
4,41.9047008,12.4943693,4,269,Santa Maria della Vittoria,"<b>766</b><br>To his right, the smoking cupola of Santa Maria della Vittoria<br><b>689</b><br> 91
L angdon and Vittoria dashed to the main entrance of the church of Santa Maria della Vittoria and found the wooden door locked<br><b>715</b><br>.”98
T he six pompierifiremen who responded to the fire at the Church of Santa Maria Della Vittoria extinguished the bonfire with blasts of Halon gas",689.0,LIB
5,41.9073982,12.4517011,0,0,"<a href=""http://www.hotelspringhouse.com/""target=""_blank""> Best Western Plus Hotel Spring House </a><br><b>Rating: </b>4.4<br><b>Popularity: </b>849","[]<b>Author: </b>Adam Gyökhegyi; <br><b>Rating: </b>5<br><b>When: </b>9 months ago<br>Staff was extremely helpful and attentive! :) Payed great attention to cleanliness throughout the hotel at every step, sanitizing even the pen I signed in with. The location is superb, especially if you have tickets to the Vatican Museum which is just around the corner. Shops, metro, etc. all within walking distance, major downtown sights about 20 minutes by public transport. The room was impressive, comfortable, well air conditioned. Breakfast seemed a bit chaotic at first, but was eventually handled really well with the possibility for open air seating.<br><br><b>Author: </b>Islam Faress; <br><b>Rating: </b>1<br><b>When: </b>8 months ago<br>Terrible Experience.

Extremely noisy rooms and 45 minutes waiting in the queue for breakfast!!

The WiFi signal is non-existent. The water in the shower in annoyingly weak!

It doesn't look anything like a 2 star hotel even.<br><br><b>Author: </b>David Connell; <br><b>Rating: </b>5<br><b>When: </b>a year ago<br>Great staff.  Very helpful.  Extremely professional.   Room spotless.  3 minutes from Cipro Metro Station and the same from Vatican Museum entrance .  I would highly recommend.   Breakfast is free and great choice.<br><br><b>Author: </b>ElysonGavin Lebig; <br><b>Rating: </b>4<br><b>When: </b>a year ago<br>Overall, my experience with this hotel was fantastic! I almost want to rate it 5 stars, but it was not perfect.  First, the service staff was extremely friendly and helpful.  In this hotel, the elevator is extremely small, a common hotel feature throughout Europe, so I got worried because my family brought a lot of luggage.  Yet, I think the staff is aware of this, so they offer to bring your luggage to your room, which created a good, initial impression on me.  In addition to the staff, I  liked the room my family got.  The room was very clean and modern-looking; furthermore, it also came with a nice, spacious patio!  After seeing my room, I still could not believe I was in a best western hotel.  The only reason why I can't give this hotel 5 stars is the room tends to get hot very easily.  The room has AC, but it is very weak.  Besides a few problems, I would most definitely recommend this hotel to anyone traveling to Rome!<br><br><b>Author: </b>Sandy Kelver; <br><b>Rating: </b>5<br><b>When: </b>a year ago<br>We stayed 4 nights at this Best Western Plus hotel in Rome.  All the staff are friendly, helpful and make you feel welcomed from the minute you walk in the front door.  Rooms are a good size and very clean.  Bedding and towels are a nice quality.  The hotel is located within a 5 minute walk from the subway station and Vatican museum.  The bar and restaurant, located inside the hotel, offers a small menu but the variety of food offered is likely to appeal to most everyone.  The food is yummy!  If we were to return to Rome we would definitely stay here.<br><br>",,HOTEL
