,LAT,LON,order,Distance [m],lugares,quotes,Position_book,Type
87,41.89564130000001,12.4862481,53,239,"<a href=""http://www.mercatiditraiano.it/""target=""_blank""> Trajan's Market </a><br><b>Rating: </b>4.6<br><b>Popularity: </b><br>6718","[]<b>Author: </b>JUZER KAPADIA; <br><b>Rating: </b>5<br><b>When: </b>a month ago<br>Originally considered among the wonders of the Classical world, Trajan’s Markets now display only a hint of their former splendor.
Emperor Trajan and his architect, Apollodorus of Damascus, built this visionary complex of 150 offices and shops in the early 2nd century AD. In their heyday, the markets sold everything from Middle Eastern silks and spices to fresh fish, fruit, and flowers.
Shops opened early and closed about noon. Almost all the shopping was done by men and the traders were almost exclusively male.
The Forum of Trajan (AD 107–13) was built in front of the market complex. It was a vast colonnaded open space with a huge basilica, and included two libraries. Dominating the ruins today is Trajan’s Column. Spiralling up its 98 ft (30 m) high stem are minutely detailed scenes depicting episodes from Trajan’s successful military campaigns in Dacia (present-day Romania)<br><br><b>Author: </b>Shelby Elkins; <br><b>Rating: </b>5<br><b>When: </b>7 months ago<br>Highly recommend! This museum had some nice artifacts and it is a unique experience to be able to walk in the old market. You can imagine what it used to be like in Roman times and walk through the original corridors and tunnels of Trajan’s Market. This museum is included on the MIC card. The bathrooms were nice and clean, just missing anything to dry your hands with. The staff was helpful. Thumbs up!<br><br><b>Author: </b>Iman Traveler; <br><b>Rating: </b>5<br><b>When: </b>2 months ago<br>Oldest shopping mall in the world exist today. With 1900 years history and wonderful view to the VIA FORI IMPERIALI, is a must to do in Rome after famous highlights. Check out the book shop they have very good collection about Rome, Art and history.<br><br><b>Author: </b>Nimrod Pinto; <br><b>Rating: </b>5<br><b>When: </b>7 months ago<br>Impressive ancient roman ruins of the markets. The museum is intriguing and has (also) many impressive models of roman structures through the ancient empire, with their stories and history.<br><br><b>Author: </b>COR ANIMOSUS; <br><b>Rating: </b>5<br><b>When: </b>a year ago<br>Must see checklist  member,
Trajan's Market (Latin: Mercatus Traiani, Italian: Mercati di Traiano) is a large complex of ruins in the city of Rome, Italy, located on the Via dei Fori Imperiali, at the opposite end to the Colosseum. The surviving buildings and structures, built as an integral part of Trajan's Forum and nestled against the excavated flank of the Quirinal Hill, present a living model of life in the Roman capital and a glimpse at the restoration in the city, which reveals new treasures and insights about Ancient Roman architecture.

Thought to be the world's oldest shopping mall, the arcades in Trajan's Market are now believed by many to be administrative offices for Emperor Trajan. The shops and apartments were built in a multi-level structure and it is still possible to visit several of the levels. Highlights include delicate marble floors and the remains of a library.

Construction

Trajan's Market was probably built in 100-110 AD by Apollodorus of Damascus,an architect who always followed Trajan in his adventures and to whom Trajan entrusted the planning of his Forum,[and inaugurated in 113 AD.During the Middle Ages the complex was transformed by adding floor levels, still visible today, and defensive elements such as the Torre delle Milizie, the ""militia tower"" built in 1200. A convent, which was built in this area in the 16th century was acquired by the state in 1885 and became the Goffredo Mameli barracks.This was demolished at the beginning of the twentieth century to restore Trajan's Markets to the city of Rome.

Source Wikipedia<br><br>",,MUSE
88,41.8945976,12.4831269,31,283,"<a href=""https://vittoriano.beniculturali.it/it/luoghi/altare-della-patria-e-tomba-del-milite-ignoto""target=""_blank""> Altar of the Fatherland </a><br><b>Rating: </b>4.7<br><b>Popularity: </b><br>30638","[]<b>Author: </b>John Willemsen; <br><b>Rating: </b>4<br><b>When: </b>8 months ago<br>Beautiful and REALLY big. Not-so-old building with lots of dead people's statues. Best place in Rome for people who like The Sixth Sense (lots of dead people to see!) and climbing stairs (because there's a butt load of 'em!)

Seriously though: go see, because it's impressive.<br><br><b>Author: </b>Julie Russell; <br><b>Rating: </b>5<br><b>When: </b>7 months ago<br>Stunning and it has a hidden gem of an elevator round the back which takes you to the top of the monument and you get 360 view of the city. I found it totally by accident well worth a visit<br><br><b>Author: </b>Manny Alonzo; <br><b>Rating: </b>5<br><b>When: </b>3 weeks ago<br>A beautiful monument in Rome honoring the first king of unified Italy-Victor Emmanuel II of Savoy. A big statue of him is erected in the center of the building. The building is situated in the center of the city. A nice place to visit when you're in Rome.<br><br><b>Author: </b>Filip Galiza; <br><b>Rating: </b>5<br><b>When: </b>9 months ago<br>A truly magnificent piece of Roman architecture that allows you to walk in it, through it and on top of it.  You will need to pay a few Euros to take the elevator to the roof the structure and its worth it!  Some tips for all visitors 1) do not take photos where not allowed 2) bring sunglasses (you will be walking on light colored marble with the sun shining and reflecting off of it) 3) bring lots of extra water 4) read up on it in wikipedia before visiting.<br><br><b>Author: </b>Rodya Raskolnikov; <br><b>Rating: </b>5<br><b>When: </b>2 months ago<br>This building is awe inducing and beautiful from the outside (I did not go in). However, tthe area is a bit of tourist trap and difficult to get out of. Plan your itinerary accordingly and you will have a great time.<br><br>",,TOUR
89,41.89335920000001,12.4828018,33,140,"<a href=""https://www.turismoroma.it/it/campidoglio""target=""_blank""> Campidoglio </a><br><b>Rating: </b>4.7<br><b>Popularity: </b><br>15627","[]<b>Author: </b>Tom Malling; <br><b>Rating: </b>5<br><b>When: </b>5 months ago<br>The beautiful old town hall. We did not go to the museums yet. We spent 3 hours walking around the Capitol. Great view from  2 places to the Forum. Eventually we found a cafe opposite a small park. The cafe is high up and the terrace has 180 degree views of Rome.<br><br><b>Author: </b>Andrew Machado; <br><b>Rating: </b>3<br><b>When: </b>9 months ago<br>The view from the top is incredible but the place itself is fairly normal (by the standards of Rome, at least).

Most interesting is, of course, the fact that the whole square was designed by Michaelangelo with the blessings of the Pope at the time; do not miss the little placards hidden between the walls that tell its story.<br><br><b>Author: </b>Teklai Ezghihaye; <br><b>Rating: </b>5<br><b>When: </b>3 months ago<br>I loved Marcus Aurelius on his Meditations!!! To visit his statue in person is something else, as if living in his era!!! A great art of the sculpture!!!<br><br><b>Author: </b>Vinay Kulkarni; <br><b>Rating: </b>5<br><b>When: </b>2 months ago<br>Lovely place. Big open area. Nice construction. Right in front of main road. Loved the sight.<br><br><b>Author: </b>P vdh; <br><b>Rating: </b>5<br><b>When: </b>8 months ago<br>Perfect place to make some pictures for the gram.<br><br>",,TOUR
90,41.8929428,12.4825577,52,50,"<a href=""http://www.museicapitolini.org/""target=""_blank""> Capitoline Museums </a><br><b>Rating: </b>4.6<br><b>Popularity: </b><br>10112","[]<b>Author: </b>Kevin R.; <br><b>Rating: </b>1<br><b>When: </b>2 months ago<br>There's lots to see here and it should be a really educational experience.  The problem is the very poor descriptions on the exhibits and the lack of guided tours.

The exhibits are badly labelled with complicated, overly technical English , which assumes the  reader is already an expert in Roman history.  They don't have any guided tours, but obviously should.

Despite Covid, and very few visitors, the ticketing staff still manage to make you feel unwelcome. Also, at 15 euro per ticket,  this isn't a cheap experience.

It's a real pity that Rome can't do a better job of explaining the fascinating history that's in front of your face.<br><br><b>Author: </b>kekkino71; <br><b>Rating: </b>4<br><b>When: </b>7 months ago<br>Excellent collection, ""services"" not so much.<br><br><b>Author: </b>Loes Heerkens; <br><b>Rating: </b>4<br><b>When: </b>7 months ago<br>Beautiful collection. Some personnel was friendly, while others where very unwelcoming<br><br><b>Author: </b>Jan Verbeeren; <br><b>Rating: </b>5<br><b>When: </b>7 months ago<br>Wonderfull. Take three hours...<br><br><b>Author: </b>Phoebe Jones; <br><b>Rating: </b>5<br><b>When: </b>2 months ago<br>Beautiful museum with a vast collection of artifacts. Excellent place to spend time and learn about Rome. Book tickets online in advance. Excellent hygiene practices.<br><br>",,MUSE
91,41.8929428,12.4825577,35,0,"<a href=""http://www.museicapitolini.org/""target=""_blank""> Capitoline Museums </a><br><b>Rating: </b>4.6<br><b>Popularity: </b><br>10112","[]<b>Author: </b>Kevin R.; <br><b>Rating: </b>1<br><b>When: </b>2 months ago<br>There's lots to see here and it should be a really educational experience.  The problem is the very poor descriptions on the exhibits and the lack of guided tours.

The exhibits are badly labelled with complicated, overly technical English , which assumes the  reader is already an expert in Roman history.  They don't have any guided tours, but obviously should.

Despite Covid, and very few visitors, the ticketing staff still manage to make you feel unwelcome. Also, at 15 euro per ticket,  this isn't a cheap experience.

It's a real pity that Rome can't do a better job of explaining the fascinating history that's in front of your face.<br><br><b>Author: </b>kekkino71; <br><b>Rating: </b>4<br><b>When: </b>7 months ago<br>Excellent collection, ""services"" not so much.<br><br><b>Author: </b>Loes Heerkens; <br><b>Rating: </b>4<br><b>When: </b>7 months ago<br>Beautiful collection. Some personnel was friendly, while others where very unwelcoming<br><br><b>Author: </b>Jan Verbeeren; <br><b>Rating: </b>5<br><b>When: </b>7 months ago<br>Wonderfull. Take three hours...<br><br><b>Author: </b>Phoebe Jones; <br><b>Rating: </b>5<br><b>When: </b>2 months ago<br>Beautiful museum with a vast collection of artifacts. Excellent place to spend time and learn about Rome. Book tickets online in advance. Excellent hygiene practices.<br><br>",,TOUR
92,41.89325289999999,12.484504,74,164,"<a href=""http://www.archeoroma.beniculturali.it/""target=""_blank""> Mamertine Prison </a><br><b>Rating: </b>3.8<br><b>Popularity: </b><br>148","[]<b>Author: </b>Janos Kosa; <br><b>Rating: </b>5<br><b>When: </b>6 months ago<br>It touched my heart & my purse too...<br><br><b>Author: </b>NS Goho; <br><b>Rating: </b>5<br><b>When: </b>a year ago<br>Not many people comes here so it's a bit less crowded. But it was great to see where Peter and Paul had been in prison. Probably will take less than an hour. Easy stroll from Colosseum.<br><br><b>Author: </b>Jenny Trump; <br><b>Rating: </b>2<br><b>When: </b>2 years ago<br>This museum take 30min and the cost 10.€ If you wanted to read every plaque it might take you an hour, but that’s really pushing it. It was neat to see were Peter and Paul had been in prison. There is nothing other than a cell left. I think the cost should be close to $5 and then I would have given it a 4 star. I’m happy to be sort of the preservation but if your pushed for time, you might weigh the cost and experience. location is between the Forum and Palestine Hill.<br><br><b>Author: </b>Marvin N; <br><b>Rating: </b>3<br><b>When: </b>a year ago<br>The ticket office is incredibly slow when printing out tickets. Still faster than buying tickets directly at the colosseum as there is a pretty long queue.<br><br><b>Author: </b>E. Michael Brezina, III; <br><b>Rating: </b>5<br><b>When: </b>2 years ago<br>Haunting and riveting.  An absolute must go if you are in Rome.  You can see this small place very quickly and is relatively close to other important places.<br><br>",,MUSE
93,41.8932529,12.484504,8,0,Vatican Prison,"<b>209</b><br>.”
’s a pretty big 
“What’s he going to do, shoot me for using the phone?”
“Who the hell knows! This is a pretty strange place, and the wa going-”
y things are 
“Either that,” Vittoria said, “or we can spend the next five hours and forty-eight minutes in Vatican Prison",209.0,LIB
94,41.8902102,12.4922309,3,723,the Roman Coliseum,<b>145</b><br>His eyes found the crumbling ruins of the Roman Coliseum,145.0,LIB
