,LAT,LON,order,Distance [m],lugares,quotes,Position_book,Type
42,41.9114511,12.4764951,13,40,the Chigi Chapel,"<b>626</b><br>my videographer got the footage of the cardinal being removed from the Chigi Chapel<br><b>485</b><br>The Chigi Chapel was packed with Swiss Guards<br><b>461</b><br>Finished entirely in chestnut marble, the Chigi Chapel was breathtaking<br><b>468</b><br>deeper and deeper beneath the floor of the Chigi Chapel<br><b>434</b><br>“Wrong? What do you mean?”
“The first altar of science is at the Chigi Chapel!”
“Where?” Now Olivetti sounded angry<br><b>430</b><br>“It’s called the Chigi Chapel<br><b>460</b><br>They would have to traverse the length of the cathedral, passing three other chapels, each of them, like the Chigi Chapel, covered with translucent plastic shrouds<br><b>459</b><br> 
It seemed the Chigi Chapel was located in the third of four recessed alcoves to their right<br><b>455</b><br>“Where is this Chigi Chapel?”
Langdon gazed through the dusky ghostliness toward the back of the cathedral and studied the outer walls<br><b>431</b><br>“Signore, whereis this Chigi Chapel?”
“About a mile north",430.0,LIB
43,41.91070379999999,12.4763579,14,83,the Piazza del Popolo,"<b>767</b><br>In front of him in the distance, Piazza del Popolo<br><b>540</b><br>Peter’s Squarewas designed by Bernini!”
As the caravan of Alpha Romeos tore out of Piazza del Popolo, everyone was in too much of a hurry to notice the BBC van pulling out behind them<br><b>496</b><br>“Well I’ll be damned!”70
G unther Glick and Chinita Macri sat parked in the BBC van in the shadows at the far end of Piazza del Popolo<br><b>443</b><br>They skidded to a stop on the south side of the Piazza del Popolo just before eight",443.0,LIB
44,41.9079743,12.465208,16,971,Via Cola di Riezo,"<b>521</b><br>The path intersected the Margherita Bridge, Via Cola di Riezo, and passed through Piazza del Risorgimento, hitting no churches at all until it dead-ended abruptly at the center of St",521.0,LIB
45,41.9058118,12.4607831,38,438,"<a href=""http://www.emeraldsbar.com/""target=""_blank""> Emerald's Independent Bar </a><br><b>Rating: </b>4.1<br><b>Popularity: </b><br>202","[]<b>Author: </b>Sebastian Sanchez; <br><b>Rating: </b>4<br><b>When: </b>5 months ago<br>Quaint place. Excelent decor. The service of the waitress could be better but the guy at the bar is very friendly.<br><br><b>Author: </b>Jacquie Orphanopoulos; <br><b>Rating: </b>5<br><b>When: </b>5 months ago<br>Very cozy, nice atmosphere....cool people!! Cocktail barman super cool, Giuglio!!!<br><br><b>Author: </b>OLGA Bluesoul; <br><b>Rating: </b>5<br><b>When: </b>8 months ago<br>It's a eally nice place.If you like nice design,something special.It's a right place to have a drink.
The service is excellent and the people are very nice.Good quality of wine,too.
Thanks.<br><br><b>Author: </b>Pei-Hsuen Liao; <br><b>Rating: </b>5<br><b>When: </b>a year ago<br>Gorgeous bar, with phenomenal drinks and the nicest staff. Having experienced speakeasy style bars in New York, San Francisco, Shanghai, Taipei and Tokyo, I would put Emerald's up against the best. Not only were the drinks stellar, the staff was beyond nice. On a crowded night with no seats available, they noticed one person in my party had a mobility issue and immediately found a spare seat for him. Such hospitality and talent made for a truly wonderful night.<br><br><b>Author: </b>Erik Marco Norberg Schulz; <br><b>Rating: </b>2<br><b>When: </b>4 months ago<br>Not my style. A place for drunken yuppies.<br><br>",,CLUB
46,41.90633370000001,12.4580356,17,234,Piazza del Risorgimento,"<b>522</b><br>The path intersected the Margherita Bridge, Via Cola di Riezo, and passed through Piazza del Risorgimento, hitting no churches at all until it dead-ended abruptly at the center of St",522.0,LIB
47,41.9064878,12.4536413,39,364,"<a href=""http://www.museivaticani.va/content/museivaticani/it.html""target=""_blank""> Vatican Museums </a><br><b>Rating: </b>4.6<br><b>Popularity: </b><br>109048","[]<b>Author: </b>Claudia Andrea C; <br><b>Rating: </b>5<br><b>When: </b>8 months ago<br>A must! I would highly recommend to assign half a day to the museums, in order to see everything inside. It is really big and it could take a while to finish it. Take comfy shoes because you will walk a lot. Also don't forget your water.<br><br><b>Author: </b>James Blassingame; <br><b>Rating: </b>5<br><b>When: </b>7 months ago<br>If you find yourself in Rome, do what the Romans do.........check out The Vatican!!!  The earlier in the day that you can get there the better off you will be. This place gets PACKED!!!  Not really an issue right now, but when school is in session the school groups swamp the place, and that's not even mentioning regular tourist.  The setting is immaculate, absolutely beautiful.  One thing that I noticed, there was a legit military/law enforcement presence at the Vatican.  If someone is going there with the intention of breaking bad, I pray for their soul.  The armed guards aren't playing, and looked legit as any military operation I can think of.  The Sistine Chapel is a sight to behold, worth the churning herd of people to see it in person.  Don't pull your cameras out, they don't take too kindly to that either.  This isn't from personal experience, but I didn't see some people who encountered issues.<br><br><b>Author: </b>Angelos Odyseakis; <br><b>Rating: </b>5<br><b>When: </b>7 months ago<br>Amazing experience, but very crowded.<br><br><b>Author: </b>Mrs Mrs; <br><b>Rating: </b>5<br><b>When: </b>6 months ago<br>A fantastic museum that is like a time capsule. There are displays that go back as far as Constantine, all the way up to the present day. We were lucky enough to have come on an evening tour and the museum was not crowded. Our tour guide was able to give fantastic insight into the pieces of art and relics on display. The artwork on the ceiling is amazing, it looks like 3D plaster but it's not it's actually all hand painted!<br><br><b>Author: </b>akshay timmalapur; <br><b>Rating: </b>5<br><b>When: </b>6 months ago<br>One of the best kept museums. Vatican is smallest country but it never stopped them from building one of the world's largest museum. Buy tickets online and avoid large crowds at the queues<br><br>",,MUSE
48,41.9064878,12.4536413,25,0,"<a href=""http://www.museivaticani.va/content/museivaticani/it.html""target=""_blank""> Vatican Museums </a><br><b>Rating: </b>4.6<br><b>Popularity: </b><br>109048","[]<b>Author: </b>Claudia Andrea C; <br><b>Rating: </b>5<br><b>When: </b>8 months ago<br>A must! I would highly recommend to assign half a day to the museums, in order to see everything inside. It is really big and it could take a while to finish it. Take comfy shoes because you will walk a lot. Also don't forget your water.<br><br><b>Author: </b>James Blassingame; <br><b>Rating: </b>5<br><b>When: </b>7 months ago<br>If you find yourself in Rome, do what the Romans do.........check out The Vatican!!!  The earlier in the day that you can get there the better off you will be. This place gets PACKED!!!  Not really an issue right now, but when school is in session the school groups swamp the place, and that's not even mentioning regular tourist.  The setting is immaculate, absolutely beautiful.  One thing that I noticed, there was a legit military/law enforcement presence at the Vatican.  If someone is going there with the intention of breaking bad, I pray for their soul.  The armed guards aren't playing, and looked legit as any military operation I can think of.  The Sistine Chapel is a sight to behold, worth the churning herd of people to see it in person.  Don't pull your cameras out, they don't take too kindly to that either.  This isn't from personal experience, but I didn't see some people who encountered issues.<br><br><b>Author: </b>Angelos Odyseakis; <br><b>Rating: </b>5<br><b>When: </b>7 months ago<br>Amazing experience, but very crowded.<br><br><b>Author: </b>Mrs Mrs; <br><b>Rating: </b>5<br><b>When: </b>6 months ago<br>A fantastic museum that is like a time capsule. There are displays that go back as far as Constantine, all the way up to the present day. We were lucky enough to have come on an evening tour and the museum was not crowded. Our tour guide was able to give fantastic insight into the pieces of art and relics on display. The artwork on the ceiling is amazing, it looks like 3D plaster but it's not it's actually all hand painted!<br><br><b>Author: </b>akshay timmalapur; <br><b>Rating: </b>5<br><b>When: </b>6 months ago<br>One of the best kept museums. Vatican is smallest country but it never stopped them from building one of the world's largest museum. Buy tickets online and avoid large crowds at the queues<br><br>",,TOUR
49,41.9064878,12.4536413,7,0,the Vatican Museum,"<b>176</b><br>And up ahead on the left, the massive rectangular edifice of the Vatican Museum",176.0,LIB
50,41.90519099999999,12.453807,49,144,"<a href=""http://www.vaticanstate.va/content/vaticanstate/en/monumenti/musei-vaticani/museo-storico---padiglione-delle-carrozze.paginate.1.html""target=""_blank""> Museo Storico - Padiglione delle Carrozze </a><br><b>Rating: </b>4.6<br><b>Popularity: </b><br>95","[]<b>Author: </b>Jaydeep Ravani; <br><b>Rating: </b>5<br><b>When: </b>8 months ago<br>The museum consists of two large sections: - the Historical Museum proper, which is located in the Lateran Palace; it preserves an iconographic series of the Popes from the sixteenth century to today; the most significant finds from the papal military corps, the Chapel and the Papal Family, and the various papal ceremonials no longer in use; - the Carriage Pavilion, located in the Vatican Museums, where the testimonies concerning papal mobility (the popemobiles) are preserved, that is saddles, sedan chairs, carriages, cars, all accompanied by paintings and photographs. The entrance ticket to the Vatican Museums entitles you to visit the Vatican Museums and Sistine Chapel for the day of issue only and allows you to visit, within the following 5 days (including the day of issue), the Historical Museum and the Noble Apartment of the Lateran Apostolic Palace in Piazza S. Giovanni in Laterano.<br><br><b>Author: </b>Vitali Lobanov; <br><b>Rating: </b>5<br><b>When: </b>3 years ago<br>A hidden gem of the Vatican museum dedicated to popes. Zero people, interesting collection, great presentation, very worth a visit.<br><br><b>Author: </b>Nilesh Dodiyar; <br><b>Rating: </b>5<br><b>When: </b>2 years ago<br>A beautiful museum to see, how means of transportation has changed over the history and specially of different Popes of the Catholic church.<br><br><b>Author: </b>Jason Hall; <br><b>Rating: </b>5<br><b>When: </b>2 years ago<br>DO NOT MISS!!! Best museum in Rome.  Popemobile from carriages from the world renowned Casalini Brothers to the famous Fiat Pope John Paul II was shot in.  A one of a kind museum.<br><br><b>Author: </b>Trevor Willett; <br><b>Rating: </b>5<br><b>When: </b>3 years ago<br>Great and very good service, the masters were too attentive and kind to us, excellent attention.<br><br>",,MUSE
51,41.903611,12.450278,23,340,Vatican Hill,"<b>870</b><br>He was running up the original Vatican Hill! Langdon had heard Vatican scholars claim that St<br><b>873</b><br>Peter’s tomb was near the topof Vatican Hill, and he had always wondered how they knew<br><b>841</b><br>Peter’s Square at this very instant exceeded anything Vatican Hill had ever witnessed",841.0,LIB
52,41.9036267,12.4502458,31,3,"<a href=""http://www.museivaticani.va/""target=""_blank""> Gardens of Vatican City </a><br><b>Rating: </b>4.7<br><b>Popularity: </b><br>1770","[]<b>Author: </b>Jasper Verbeke; <br><b>Rating: </b>3<br><b>When: </b>7 months ago<br>Nice but not as spectacular as you would think, go to the top of the basilica first.<br><br><b>Author: </b>Maja Wis; <br><b>Rating: </b>3<br><b>When: </b>7 months ago<br>I guess the best part is restricted. The accessible bit is ok, you can see the wealth of Vatican poured into maintenance while keeping it ""simple"" at the same time<br><br><b>Author: </b>Call Me M.; <br><b>Rating: </b>5<br><b>When: </b>5 months ago<br>Probably one of the most beautiful spots in Rome.
It's a quiet, relaxing place that is filled with exquisite art from all over the world.
foreign trees and parrots (that were gifts to the Popes) also make up most of the fauna and flora. interestingly there are also some greek gods portraied in there!
I highly suggest you take time to visit the Vatican Gardens, its worth every penny and second spent in there!<br><br><b>Author: </b>Dan (DV); <br><b>Rating: </b>5<br><b>When: </b>a year ago<br>The bus tour was great, especially for the end of December when it can get cold. The bus had a plastic cover so you don't face any wind. There was practically no queue. You're allowed in with ~45 minutes before the time on the ticket and in no time you're past the scanners. There are separate counters from where you can get the tickets insinde the building (almost no line). When the tour is done, you can visit the rest of the museum; no other waiting involved.<br><br><b>Author: </b>Janos Kosa; <br><b>Rating: </b>5<br><b>When: </b>6 months ago<br>Gorgeous place: a bit of silence & slow down in a busy city.<br><br>",,TOUR
53,41.9036267,12.4502458,61,0,"<a href=""http://www.museivaticani.va/""target=""_blank""> Gardens of Vatican City </a><br><b>Rating: </b>4.7<br><b>Popularity: </b><br>1770","[]<b>Author: </b>Jasper Verbeke; <br><b>Rating: </b>3<br><b>When: </b>7 months ago<br>Nice but not as spectacular as you would think, go to the top of the basilica first.<br><br><b>Author: </b>Maja Wis; <br><b>Rating: </b>3<br><b>When: </b>7 months ago<br>I guess the best part is restricted. The accessible bit is ok, you can see the wealth of Vatican poured into maintenance while keeping it ""simple"" at the same time<br><br><b>Author: </b>Call Me M.; <br><b>Rating: </b>5<br><b>When: </b>5 months ago<br>Probably one of the most beautiful spots in Rome.
It's a quiet, relaxing place that is filled with exquisite art from all over the world.
foreign trees and parrots (that were gifts to the Popes) also make up most of the fauna and flora. interestingly there are also some greek gods portraied in there!
I highly suggest you take time to visit the Vatican Gardens, its worth every penny and second spent in there!<br><br><b>Author: </b>Dan (DV); <br><b>Rating: </b>5<br><b>When: </b>a year ago<br>The bus tour was great, especially for the end of December when it can get cold. The bus had a plastic cover so you don't face any wind. There was practically no queue. You're allowed in with ~45 minutes before the time on the ticket and in no time you're past the scanners. There are separate counters from where you can get the tickets insinde the building (almost no line). When the tour is done, you can visit the rest of the museum; no other waiting involved.<br><br><b>Author: </b>Janos Kosa; <br><b>Rating: </b>5<br><b>When: </b>6 months ago<br>Gorgeous place: a bit of silence & slow down in a busy city.<br><br>",,PRK
54,41.90221409999999,12.451155900000002,6,174,Governatorato,"<b>174</b><br>The severe-looking Governatorato build d
ing was now behin 
them, housing Vatican City’s administration",174.0,LIB
55,41.908718,12.4521902,56,728,"<a href=""http://sacerdotiregalita.it/""target=""_blank""> Archivio ISSMRC </a><br><b>Rating: </b>4.0<br><b>Popularity: </b><br>3",[]<b>Author: </b>claudio borghese; <br><b>Rating: </b>4<br><b>When: </b>2 years ago<br><br><br><b>Author: </b>emanuele coletti; <br><b>Rating: </b>5<br><b>When: </b>a year ago<br><br><br><b>Author: </b>Slavica Mihelić; <br><b>Rating: </b>3<br><b>When: </b>3 years ago<br><br><br>,,MUSE
56,41.909107,12.453644,36,127,"<a href=""http://www.alexanderplatzjazz.com/""target=""_blank""> Alexanderplatz Jazz Club </a><br><b>Rating: </b>4.3<br><b>Popularity: </b><br>312","[]<b>Author: </b>Divan Hattingh; <br><b>Rating: </b>5<br><b>When: </b>6 months ago<br>Beautiful place full of History. Good food great Jazz. (Making a booking is absolutely necessary)<br><br><b>Author: </b>Levent Parman; <br><b>Rating: </b>4<br><b>When: </b>10 months ago<br>Jazz is a music genre that originated in the African-American communities of New Orleans, United States, in the late 19th and early 20th centuries, with its roots in blues and ragtime. Since the 1920s Jazz Age, it has been recognized as a major form of musical expression in traditional and popular music, linked by the common bonds of African-American and European-American musical parentage. Jazz is characterized by swing and blue notes, call and response vocals, polyrhythms and improvisation. Jazz has roots in West African cultural and musical expression, and in African-American music traditions.As jazz spread around the world, it drew on national, regional, and local musical cultures, which gave rise to different styles. New Orleans jazz began in the early 1910s, combining earlier brass-band marches, French quadrilles, biguine, ragtime and blues with collective polyphonic improvisation.
In the 1930s, heavily arranged dance-oriented swing big bands, Kansas City jazz, a hard-swinging, bluesy, improvisational style and Gypsy jazz (a style that emphasized musette waltzes) were the prominent styles. Bebop emerged in the 1940s, shifting jazz from danceable popular music toward a more challenging ""musician's music"" which was played at faster tempos and used more chord-based improvisation. Cool jazz developed near the end of the 1940s, introducing calmer, smoother sounds and long, linear melodic lines.
The mid-1950s saw the emergence of hard bop, which introduced influences from rhythm and blues, gospel, and blues, especially in the saxophone and piano playing. Modal jazz developed in the late 1950s, using the mode, or musical scale, as the basis of musical structure and improvisation, as did free jazz, which explored playing without regular meter, beat and formal structures. Jazz-rock fusion appeared in the late 1960s and early 1970s, combining jazz improvisation with rock music's rhythms, electric instruments, and highly amplified stage sound. In the early 1980s, a commercial form of jazz fusion called smooth jazz became successful, garnering significant radio airplay. Other styles and genres abound in the 2000s, such as Latin and Afro-Cuban jazz.<br><br><b>Author: </b>Cary Ota; <br><b>Rating: </b>4<br><b>When: </b>a year ago<br>Good music, but be ready to pay for the rest.<br><br><b>Author: </b>Paul Painter; <br><b>Rating: </b>1<br><b>When: </b>a year ago<br>Jazz Club with no Jazz.  We came here tonight and paid €20 entrance each expecting a night of jazz and dinner.  Instead we got some kind of jazz performers talking on a microphone all night assumably about jazz.....but no jazz. We don't speak Italian....but that wasn't the point.  We had dinner that was very average....very salty and nothing special.  So we spent €114 for.... nothing.  If you are a jazz club and you are not going to play any music please warn people before they come!!<br><br><b>Author: </b>Giorgio Bruschini; <br><b>Rating: </b>5<br><b>When: </b>a year ago<br>If you are searching for some live jazz music, this is one of the most famous place in Roma for this purpose. You can find live music every night and listen to very good musicians here.<br><br>",,CLUB
57,41.9104259,12.4570471,69,317,"<a href=""""target=""_blank""> EletrikBike Roma </a><br><b>Rating: </b>4.9<br><b>Popularity: </b><br>14","[]<b>Author: </b>Chiara Visenzi; <br><b>Rating: </b>5<br><b>When: </b>3 years ago<br>Friendliness, availability and more than fair prices! Bicycles in excellent condition ... in short, I highly recommend it !!<br><br><b>Author: </b>Francesca Piersanti; <br><b>Rating: </b>4<br><b>When: </b>3 years ago<br>Good bikes compared to the average, the owner seems competent. Maybe it closes a little too early ...<br><br><b>Author: </b>Francesco Cardone; <br><b>Rating: </b>5<br><b>When: </b>4 years ago<br>Finally in Rome in the Prati area rental and sale of bicycles and more, electric. Try the various models available in the store and soon also the tours to Rome. Good luck guys<br><br><b>Author: </b>Filippo Goi; <br><b>Rating: </b>5<br><b>When: </b>3 years ago<br>Getting around Rome with those bikes is really nice! Especially after 4 days of walking for 20 km a day ... closed if it rains;)<br><br><b>Author: </b>Paolo Donarini; <br><b>Rating: </b>5<br><b>When: </b>3 years ago<br>Great bike rental! Prepared guys who can advise you, very helpful on all aspects. Recommended!<br><br>",,PRK
58,41.9088486,12.4484915,68,729,"<a href=""http://www.sovraintendenzaroma.it/i_luoghi/roma_medioevale_e_moderna/fontane/mostra_dell_acquedotto_del_peschiera_in_piazzale_degli_eroi""target=""_blank""> Fontana del Peschiera </a><br><b>Rating: </b>4.1<br><b>Popularity: </b><br>18","[]<b>Author: </b>Rue Jer; <br><b>Rating: </b>4<br><b>When: </b>a month ago<br>Modern but beautiful<br><br><b>Author: </b>Cesare Roncacci; <br><b>Rating: </b>5<br><b>When: </b>7 months ago<br>Fountain recently restored very simple but functional

The fountain in Piazzale degli Eroi is the final exhibition of the Peschiera Aqueduct, considered one of the largest aqueducts in Europe, whose entry into service in 1949 was celebrated with a solemn ceremony in the presence of the President of the Republic Luigi Einaudi.<br><br><b>Author: </b>the little sailor; <br><b>Rating: </b>5<br><b>When: </b>11 months ago<br>Fountain recently restored by FENDI, very beautiful in its simplicity. The jet should be enhanced. the surrounding area is very lively and close to the CYPRUS metro.<br><br><b>Author: </b>Marco Veronesi; <br><b>Rating: </b>4<br><b>When: </b>8 months ago<br>Very beautiful<br><br><b>Author: </b>giuseppe micheli; <br><b>Rating: </b>5<br><b>When: </b>a year ago<br>4 jets + 1 central piu 'high and also from 4 semicircles other fountains with more' water + 4 jets not funzione.Una fountain risorgimento.Del Peschiera and its lands even an inscription.<br><br>",,PRK
59,41.9063831,12.4370795,62,983,"<a href=""""target=""_blank""> Monte Ciocci </a><br><b>Rating: </b>4.2<br><b>Popularity: </b><br>911","[]<b>Author: </b>Ilaria Mazzetti; <br><b>Rating: </b>5<br><b>When: </b>8 months ago<br>One of the many viewpoints of Rome! I suggest to go at night, you can get an incredible view of Saint Peter's cathedral.<br><br><b>Author: </b>Joseph Benny; <br><b>Rating: </b>5<br><b>When: </b>a year ago<br>Alternative view of St Peter's basilica. Nice view during the twilight.<br><br><b>Author: </b>Big Mike Wise; <br><b>Rating: </b>5<br><b>When: </b>a year ago<br>A great place to get away from the hustle and bustle of the city.<br><br><b>Author: </b>Marie Sheer; <br><b>Rating: </b>5<br><b>When: </b>a year ago<br>It's Rome and it's beautiful everywhere...<br><br><b>Author: </b>sheto ahmed; <br><b>Rating: </b>4<br><b>When: </b>9 months ago<br>Suitable place for everyone<br><br>",,PRK
60,41.8887744,12.443646,77,2032,"<a href=""""target=""_blank""> Casali Dei Cedrati </a><br><b>Rating: </b>5.0<br><b>Popularity: </b><br>1","[]<b>Author: </b>Ekaterina Smirnova; <br><b>Rating: </b>5<br><b>When: </b>a year ago<br>A very nice place! In December, green grass, picturesque trees. Highly recommend<br><br>",,PRK
61,41.88817969999999,12.4574043,67,1140,"<a href=""""target=""_blank""> Villa Abamelek </a><br><b>Rating: </b>4.6<br><b>Popularity: </b><br>44","[]<b>Author: </b>Antonio Vescio; <br><b>Rating: </b>4<br><b>When: </b>5 months ago<br>Unfortunately I could not visit it because I was out of hours, but from the outside it was very beautiful. I will definitely come back for a visit<br><br><b>Author: </b>Stefano Sabuzi; <br><b>Rating: </b>5<br><b>When: </b>7 months ago<br>Wonderful. Too bad it is not possible to visit it because it is owned by the Russian Federation.<br><br><b>Author: </b>Romeo Charlie; <br><b>Rating: </b>4<br><b>When: </b>8 months ago<br>Wonderful location, historical and rich. Unfortunately, I don't think there are days in which it can be visited by the public, being an embassy. Russia in the heart of the heart of Rome.
Thanks if you would like to click like below.<br><br><b>Author: </b>Ala Fazz; <br><b>Rating: </b>1<br><b>When: </b>in the last week<br>Big<br><br><b>Author: </b>Fpixile P; <br><b>Rating: </b>5<br><b>When: </b>a year ago<br>The Russians in Italy want us very well<br><br>",,PRK
