,Name,Website,Phone Number,LON,LAT,Rating,Popularity,Last 5 Reviews,type
31,Le Petit Casino,http://diner-spectacle-lepetitcasino.com/,+33 1 42 78 36 50,2.355854,48.863357,4.7,110,"[]<b>Author: </b>Teng Xi; <br><b>Rating: </b>5<br><b>When: </b>5 years ago<br>This has to be the most authentic experience for anybody who wants to live a very French evening. It is so cosy you have to speak to the people next to your table and with such great comedians, you fell like you've been to school for years with the whole audience by the end of the evening. Speaking French fluently and letting your hair down are a must to really enjoy the night.<br><br><b>Author: </b>bea bookingstories; <br><b>Rating: </b>5<br><b>When: </b>5 years ago<br>Top<br><br><b>Author: </b>Mario Falcone; <br><b>Rating: </b>5<br><b>When: </b>a year ago<br>If you want to spend a good evening in Paris ... I recommend this place ""LE PETIT CASINO"" the atmosphere is assured with two superb shows, the meal (cold buffet) at will and excellent, and above all ... the boss and staff are really very friendly !!!
So above all, do not hesitate !!! 👍😉<br><br><b>Author: </b>Cathy THIBAUDEAU; <br><b>Rating: </b>5<br><b>When: </b>a year ago<br>An exceptional place in Paris. Authentic Parisian cabaret where the selection of comedians is at the top! In addition the meal is as always excellent and made on site. Hėlène, who has been in charge for several decades, is always as welcoming with the clientele and her masterful smile still there. As long as we can enjoy it for a long time. Thanks to the whole team.<br><br><b>Author: </b>Loic Issartel; <br><b>Rating: </b>5<br><b>When: </b>a year ago<br>A big thank you for this wonderful evening we spent. The show, the atmosphere and the buffet allowed us to enjoy an authentic Parisian experience. I highly recommend this restaurant with a very welcoming staff and a family room.<br><br>",CLUB
39,O Mantra,,+33 1 43 54 50 59,2.3380078,48.8533445,3.6,109,"[]<b>Author: </b>Francine Maboke; <br><b>Rating: </b>5<br><b>When: </b>2 years ago<br>Great venue friendly staff, customers and the first-time customers as my friends and myself were warmly welcomed by the gentleman (door man)  after checking out our invitation professionally kindly indicated us where to find our host Julien.... first time but once inside it felt like we were in our usual club...  we had a very good night out in Paris.... my friends and myself find the O Mantra great and can't wait to back again...
Thanks Julien for the Halloween private party and making us discover and new venue.... from London we felt like we were there!❤❤❤🤘🤘🤘<br><br><b>Author: </b>Der Zeppel; <br><b>Rating: </b>2<br><b>When: </b>2 years ago<br>Quite expensive, staff was kind but understaffed, food wasn't good. (Only tried the restaurant upstairs)<br><br><b>Author: </b>Karolina Symonides; <br><b>Rating: </b>2<br><b>When: </b>3 years ago<br>+/ location, lot of space, not too crowded
-/ unpleasant staff, bad music, expensive drinks (payment by card from 15€)<br><br><b>Author: </b>Sageer Suleiman; <br><b>Rating: </b>1<br><b>When: </b>7 years ago<br>Rubbish place. Abrasive owner and bouncers. Be warned<br><br><b>Author: </b>Jean Cayenne; <br><b>Rating: </b>3<br><b>When: </b>11 months ago<br>A pretty nice bar but with a decor and Playlist to review.
The service is top, the prices unbeatable. Do not expect a beer with taste on the other hand for this price but understandable.<br><br>",CLUB
30,Dandy : Art - Cocktail - Club,http://www.dandyclub.fr/,+33 6 84 08 44 53,2.336716999999999,48.85520679999999,3.1,104,"[]<b>Author: </b>BURNING SAAB; <br><b>Rating: </b>5<br><b>When: </b>a year ago<br>Perfect night, with a photo booth, big area, nice decoration and the  smoking area is also big. The staff is very friendly and speaks English !<br><br><b>Author: </b>Mariana R.; <br><b>Rating: </b>1<br><b>When: </b>2 years ago<br>I was very disappointed to arrive at this club with two friends and be refused to enter. We were waiting outside under the rain for nothing. Look, if you cannot receive people at 3am CHANGE THE OPEN HOURS ON GOOGLE! Open 24 hours? What a joke!<br><br><b>Author: </b>Nadia Rodriguez; <br><b>Rating: </b>3<br><b>When: </b>4 years ago<br>The bartenders are extremely slow and the place has a weird smell.
On the other hand, it's still not too crowded so there is space for you to dance; the decoration is really nice; the smoking area is big enough and really comfortable; and the staff is friendly and speaks english.<br><br><b>Author: </b>Pierre Juteau; <br><b>Rating: </b>5<br><b>When: </b>2 years ago<br>Good ambiance !<br><br><b>Author: </b>Alexandrine HILL; <br><b>Rating: </b>5<br><b>When: </b>a year ago<br>Certainly I have never been to this place. But the manager's honesty was so beneficial that I would come to celebrate my 55th birthday but not my son's 20th birthday. Thank you very much for your sincerity. See you soon<br><br>",CLUB
36,Le Klub,http://www.leklub-paris.com/,+33 1 42 71 49 30,2.3479023,48.859106,4.0,98,"[]<b>Author: </b>Edoardo Floriani; <br><b>Rating: </b>1<br><b>When: </b>a year ago<br>I was with some Indian friends and they didnt let me in. Everybody before and after me could go inside but not us. And we are in 2020. Don't go there its a racist place<br><br><b>Author: </b>Mohshina Bholah; <br><b>Rating: </b>4<br><b>When: </b>2 years ago<br>Superb very nice music excellent place atmosphere great<br><br><b>Author: </b>Corentin Ritou; <br><b>Rating: </b>4<br><b>When: </b>a year ago<br>Very small concert hall (about 250 people max) but the atmosphere is very nice. The whole staff is very friendly. The programming is centered around the extreme metal scene and in particular many French groups. During and after the concerts, a small area is reserved for the sale of merch groups that play the same day. The prices at the bar are a little expensive but as the place itself is very inexpensive (around 10 €) everyone finds his account.<br><br><b>Author: </b>BRIS Coline; <br><b>Rating: </b>5<br><b>When: </b>2 years ago<br>Excellent Music and Excellent Atmosphere for dancing until the end of the night!<br><br><b>Author: </b>GGREGG; <br><b>Rating: </b>2<br><b>When: </b>3 years ago<br>Toilet still too small. Not cleaned not maintained for a whole 8 hour long evening. It’s deg<br><br>",CLUB
7,Overside,http://www.overside.fr/,+33 1 42 84 10 20,2.322378,48.847443,4.0,90,"[]<b>Author: </b>Scott Hassman; <br><b>Rating: </b>5<br><b>When: </b>2 years ago<br>Wonderful club with excellent service.  Great evening of dancing in a fantastic atmosphere!  We reccomend this club in a heartbeat. Guests were appropriate for the setting and I would not read to much into the negative feedback as our experience was top notch. Thank you for a great night out from 2 Canadians.  Cheers<br><br><b>Author: </b>Kendall Seifert; <br><b>Rating: </b>5<br><b>When: </b>3 years ago<br>Nothing on website stated they would not allow my wife and I to bring our girlfriend with us. It was our error, but after a quick call (with translator), the owner was wonderful and allowed to visit her club. We have been in the past and the place is fun and a good size for a Paris club. Please remember to dress well (no jeans) and call ahead of time if you have a situation such as ours.

Overall, a very good group of people and a wonderful experience!<br><br><b>Author: </b>Eric Martial; <br><b>Rating: </b>5<br><b>When: </b>3 years ago<br>I have been there 4 years ago, it was very class. There was even a parking driver service. I did appreciate. The quality of people inside was good<br><br><b>Author: </b>Brian Joubert; <br><b>Rating: </b>5<br><b>When: </b>a month ago<br>Beautiful place to visit in early 2020 hoping to return soon for the pleasure of Madame<br><br><b>Author: </b>alberto giacomuzzi; <br><b>Rating: </b>4<br><b>When: </b>6 months ago<br>When do you think you'll cover up. With my friend Aldo we must have come to spend a nice evening<br><br>",CLUB
18,Le Magnifique,http://www.lemagnifique.fr/,+33 6 68 81 35 34,2.336318700000001,48.86482350000001,2.6,48,"[]<b>Author: </b>Valerie Aftimos; <br><b>Rating: </b>1<br><b>When: </b>4 years ago<br>Very unmagnificient!<br><br><b>Author: </b>Imane Ouhalou; <br><b>Rating: </b>5<br><b>When: </b>5 years ago<br>Formidable<br><br><b>Author: </b>Elise P.; <br><b>Rating: </b>1<br><b>When: </b>8 months ago<br>TO AVOID THE GIRLS !!!
Box with an outrageous environment, very small and very creepy.
Girls on the outside are treated like merchandise by the promoters. A shame and a place that I do not recommend at all in Paris.<br><br><b>Author: </b>Nassima Hamdaoui; <br><b>Rating: </b>1<br><b>When: </b>10 months ago<br>We were 7 girls and a boy all in heels, we were uncomfortably denied access. A trip for nothing I really recommend not the address.<br><br><b>Author: </b>Lea Mothe; <br><b>Rating: </b>1<br><b>When: </b>a year ago<br>Unpleasant staff who refuse people who are ""too small"" yet dressed in dresses and heels, make-up etc. Furthermore, the comments on their Facebook page are false and posted by people working for the company or in partnership with (promoters ) including the physiognomist who allows himself to discriminate people on their physique. To avoid absolutely!<br><br>",CLUB
53,Le Next Club,https://www.lenext.fr/,+33 6 81 95 05 87,2.3435478,48.8612283,4.6,32,"[]<b>Author: </b>Michel Divoux; <br><b>Rating: </b>5<br><b>When: </b>2 years ago<br>The Checkpoint if Pleasur and
THE NEXT IS NOW 😜👍<br><br><b>Author: </b>DIDIER MOREAU; <br><b>Rating: </b>5<br><b>When: </b>2 years ago<br>After Q gay du week-end...<br><br><b>Author: </b>M. L.; <br><b>Rating: </b>1<br><b>When: </b>2 years ago<br>16euro to get in...seriously.<br><br><b>Author: </b>Jimmy B; <br><b>Rating: </b>5<br><b>When: </b>2 years ago<br>Very friendly place in the evening as in after. There are nice meetings. Privatized place (already tested and the price is very accessible). The bartenders like the boss are really nice and you feel the party.<br><br><b>Author: </b>Jérôme Vervaeke; <br><b>Rating: </b>1<br><b>When: </b>a year ago<br>Mojito fill with water that can rums and moldy mint leaf !!!!!! And moldy lemon<br><br>",CLUB
46,Le Quarante-Trois Cocktail Bar,,+33 1 81 69 00 60,2.3422916,48.8528481,4.1,32,"[]<b>Author: </b>Jorgelina Guandalini; <br><b>Rating: </b>1<br><b>When: </b>5 years ago<br>I was really disappointed! I made the reservation and I have to wait a month ago to have a place. Then the same day I wrote to say we were going to be 4 instead of 5. When we arrived  the waitress was like ""surprised"" to see us and said ""oh sorry we don´t have a good table for you, mmm I don´t know what to say, ok can you seat here ? and she gave us an uncomfortable table

The menu said pizza and frites but when we ordered they just said they only had cheese and jam plates! (Planches)

We waited more than half an hour to get the food. We ask her what was the problem, and the waitress answered ""the problem is that all people ask for the planches"" (of course if there is the only thing available hahahha )

Not to mention that there were no music and no good ""ambiance"" , reservation system totally inefficient, etc.

I wrote to complain, they said all waiters are new and need training and that they are changing the catering supplier. And that they have problems of organization between hotel clients and non clients!!

A lot of other places with the same view are much better!!!<br><br><b>Author: </b>Nick Boss; <br><b>Rating: </b>2<br><b>When: </b>5 years ago<br>Need a reservation apparently...<br><br><b>Author: </b>Mario Rossi; <br><b>Rating: </b>2<br><b>When: </b>a year ago<br>I do not say anything .. Only that does not respect the. aspettattive<br><br><b>Author: </b>Clara Matignon; <br><b>Rating: </b>4<br><b>When: </b>3 years ago<br>One of the best rooftop in Paris. Ideally located by its central position, it is possible to see practically 360 °.
The cocktails are good, although a little expensive, but this is due to the fact that the hotel has several stars.
It is preferable to reserve your table, these are initially for hotel guests<br><br><b>Author: </b>Camille Béghin; <br><b>Rating: </b>5<br><b>When: </b>2 years ago<br>Rooftop with a magnificent view of Paris. Access is limited to the number of seats available which results in waiting, but is also the guarantee of a quiet experience with breathtaking views from his chair.<br><br>",CLUB
54,Les Princesses - Restaurant/Cabaret/Club,,+33 1 43 54 50 59,2.3380078,48.8533445,2.9,23,"[]<b>Author: </b>Carole Juge-Llewellyn; <br><b>Rating: </b>5<br><b>When: </b>4 years ago<br>J'adore !!!<br><br><b>Author: </b>Nono Nono; <br><b>Rating: </b>5<br><b>When: </b>3 years ago<br>I had one of the best evening, welcoming staff, friendly, smiling, good music.
Excellent festive place! Service and customer at the top! I liked the atmosphere too much and took advantage of my time.
A great moment, a room full to overflowing, good cocktails to offer and above all quality music: what is there to spend a beautiful evening right?
To redo absolutely<br><br><b>Author: </b>Marjorie L; <br><b>Rating: </b>1<br><b>When: </b>2 years ago<br>No. The waiters refuse a glass of water. A GLASS OF WATER. They dared to give a friend a cup and told him to go use the toilet. We had been placed on benches following a reservation, then they come to move us because there would have been an error.

Ok. We were set up chairs when we were a group of 30. After asking for a gesture as compensation we ended up offering us a bottle of sparkling wine, whereas at the beginning we had been told to agree to a bottle of vodka . Supposedly the group was not consuming enough. Uh, a minimum blue card of 15th and 30 people who have only consumed cocktails that are not cheap. They could have found another excuse. So a bottle of sparkling wine for 30 people ?! Great, thank you.

If we weren't so many, we would have left, but we had all made the trip for an anniversary.
Basically, you can get better, much better. Too bad we had to leave a star because it would have been zero.<br><br><b>Author: </b>Mathilde Torres; <br><b>Rating: </b>1<br><b>When: </b>2 years ago<br>Inadmissible !! We had booked to eat for 11 people when we arrived we were in the club on small tables or not enough chairs so we asked for the restaurant or we were put upstairs where it smelled of mildew, it didn There were only tapas (really not good) and extremely expensive, happy hour being until 23h we ordered our first drink at 22h, when we paid we were paid for the glass at cost and not in happy hour after discussion with the so-called boss she told us that we ordered after 23h while the reservation of the establishment was at 20:30 is inadmissible, they took us from high were on their phone we spoke very badly, spirits were laughing, they were offered us shots we refused! Staff incompetent, disrespectful, immature, I want to clarify that my toilet had no light the ceiling was falling apart we were all with the flash of our phones! Restaurant degeulasse lack of hygiene! Avoid really!<br><br><b>Author: </b>Franck Aubree; <br><b>Rating: </b>1<br><b>When: </b>2 years ago<br>Deplorable experience that I will not repeat: I booked by specifying that between 25 and 30 people were supposed to come on my birthday. With a monster nerve, a waitress shows me a poor little bench that can at best accommodate 7 people of average height, telling me that this will be more than enough, as a result, not being able to sit down, 2/3 of the guests stayed in front of the bar in prolonged cigarette exposure and have not consumed: well done.
Then, I ask to be served a glass of wine, while we were in the cellar, the waitress replies that there is no more wine, which her colleague confirms. I then ask if it is not possible to bring down wine from the bar above, the two waitresses answer me that it is impossible. I finally had to address myself to the lady at the reception, much more helpful, friendly, and professional than her two colleagues in the cellar, who agreed to bring down bottles of wine.
In addition, one of my guests ordered Nachos (not the most complicated dish, you will admit), which she only had herself served after an hour and after having insisted on several times. serve the dish she had paid for.
Finally, and this was the coup de grace, after drinking a shot, a friend started having a cough, and therefore asked for a glass of water (a common glass of tap water !!!), which the waitresses refused her, telling her that if she wanted to stop coughing she only had to buy a bottle of water ...
These two waitresses who took care of the bar in the cellar, not content to be professionally dismayed (one of them was unable to open a bottle of wine ...), also showed incredible disdain with my friends and myself. It's a shame, because until I ran into these two waitresses this place was lovely. Now I will not be going back.<br><br>",CLUB
43,Faust,http://www.faustparis.fr/,+33 1 42 36 66 89,2.350876,48.8689706,3.5,8,"[]<b>Author: </b>Grazia Maciel; <br><b>Rating: </b>1<br><b>When: </b>3 years ago<br>Um experiência horrível,comida requentada...um péssimo atendimento.... não voltamos nunca mais....<br><br><b>Author: </b>NINA KOMARNICKA; <br><b>Rating: </b>5<br><b>When: </b>5 years ago<br>if you need a super fancy evening dress only from FAUST.I bought 2 dresses for my son's wedding - it was my most beautiful outfit<br><br><b>Author: </b>Moheddine Djerad; <br><b>Rating: </b>5<br><b>When: </b>6 years ago<br>Faust is first is very classy young and classy. the models of the 90's are old-fashioned ĺ<br><br><b>Author: </b>Collignon- Paule-michelle@hotmail.fr Jean-Gilles; <br><b>Rating: </b>5<br><b>When: </b>4 years ago<br>Very kind ...<br><br><b>Author: </b>FATOUMATA FADIKA; <br><b>Rating: </b>1<br><b>When: </b>4 years ago<br>Exaltation shop paris show shop<br><br>",CLUB
47,Paris Paris,http://www.villa-paris.com/,+33 1 55 34 76 00,2.3522914,48.86649060000001,3.3,3,[]<b>Author: </b>Theodore Grebio; <br><b>Rating: </b>1<br><b>When: </b>4 years ago<br>cool<br><br><b>Author: </b>Ian Ziyaad; <br><b>Rating: </b>4<br><b>When: </b>a year ago<br><br><br><b>Author: </b>Angelo Leprinsse Samajeste; <br><b>Rating: </b>5<br><b>When: </b>3 years ago<br><br><br>,CLUB
48,Fashion VIP Groove's,,+33 1 42 21 41 17,2.3481669,48.86562050000001,0.0,0,,CLUB
58,The Some Like It Hot,http://certainslaimentchaud.com/,+33 1 42 86 01 36,2.3399862,48.86268860000001,0.0,0,,CLUB
