,Name,Website,Phone Number,LON,LAT,Rating,Popularity,Last 5 Reviews,type
11,Chez Papa Jazz Club,http://www.papajazzclub-paris.fr/,+33 1 42 86 99 63,2.3335089,48.85537959999999,4.6,515,"[]<b>Author: </b>Adam Carlson; <br><b>Rating: </b>5<br><b>When: </b>a week ago<br>Fantastic food, fantastic live 1950’s era jazz, incomparable ambiance. I will return every time I’m in Paris!<br><br><b>Author: </b>Harguitay Don; <br><b>Rating: </b>4<br><b>When: </b>9 months ago<br>Nice place with great decor. Very romantic a bit pricey though<br><br><b>Author: </b>Bilge Genis; <br><b>Rating: </b>5<br><b>When: </b>7 months ago<br>The atmosphere is great especially if you like jazz and the food is delicious.
A little expensive but worth for the experience.<br><br><b>Author: </b>Jhamal Rahman; <br><b>Rating: </b>5<br><b>When: </b>a year ago<br>I visited Chez Papa in January of this year. My wife and I loved it. The hospitality, food and entertainment was great. I will visit Chez Papa again.

Jhamal<br><br><b>Author: </b>david callaghan; <br><b>Rating: </b>5<br><b>When: </b>a year ago<br>We didn't have a reservation when we arrived at the club so we were offered a table near the street to have a drink. After a while, we were then given a table right near the musicians as someone hadn't turned up for their reservation. Brilliant musicianship and atmosphere. Book so you don't miss out.<br><br>",CLUB
12,Le Caveau des Oubliettes,https://www.instagram.com/lecaveaudesoubliettes/,+33 1 42 02 08 44,2.346729,48.85200799999999,4.5,501,"[]<b>Author: </b>ray combs; <br><b>Rating: </b>5<br><b>When: </b>4 months ago<br>It starts with the staff at the location,  David & Camela are amazing! As a newbie to Paris it was exciting to find a live music venue, and I could not have chosen a better location. Please, don't let the stairs frighten you, what awaits you downstairs is fantastic music, friendly staff and the warm people of Paris, France. The wine and mixed drinks are top notch. I HIGHLY recommend that if you're in Paris, that you visit. If you're not happy after leaving, send you're drink bill and I'll pay the tab. 😉<br><br><b>Author: </b>Jack; <br><b>Rating: </b>4<br><b>When: </b>a year ago<br>Cool place to listen to some quality live music, mostly blues/jazz/rock n roll genre. Don't let the empty upstairs fool you, the cavern downstairs gets very packed even on a Sunday night. Admission is free as long as you buy a drink, but you really feel that admission ticket price in the drinks cost because they're heavily marked up. The room downstairs is quite small and seating is limited.<br><br><b>Author: </b>Edilia Peña; <br><b>Rating: </b>5<br><b>When: </b>8 months ago<br>We went to a great free jazz concert. Really good quality.<br><br><b>Author: </b>Fergus Priddle; <br><b>Rating: </b>5<br><b>When: </b>a year ago<br>Great venue. The band was incredible and the sound was excellent. We went on a blues night but I’m sure the Jazz is as good. We got drinks via table service during the gig. The drinks are expensive but the entry was free when we went so it evens itself out in my opinion.<br><br><b>Author: </b>Cinthia Olveda; <br><b>Rating: </b>5<br><b>When: </b>a year ago<br>I LOVED this place. Full of locals and live band on Saturday night. The cave is super small so we where too 25 people watching the performance. We paid 24€ for the whole bottle of wine and no cover. The performance was in English which was Great!!!! We felt very welcomed here<br><br>",CLUB
41,Derya,https://www.restaurant-derya.com/,+33 1 47 70 87 84,2.3532677,48.8705819,4.3,473,"[]<b>Author: </b>Dominika Piecuch; <br><b>Rating: </b>5<br><b>When: </b>8 months ago<br>Great restaurant! Delicious food, really nice service, kind people. We took dish for 2 people, we couldn't finish it even in 3 😂. Really good starters. A lot of meat, but also some vege options. I regret just that I didn't have place for dessert, for sure it will be delicious. Next time I will try 😋<br><br><b>Author: </b>Mayenne Sebial; <br><b>Rating: </b>5<br><b>When: </b>8 months ago<br>Great service and food! Nice interior too.<br><br><b>Author: </b>Regis Denefle; <br><b>Rating: </b>3<br><b>When: </b>a year ago<br>My tartare of tomatoes was certainly emphatically, absolutely, distinctly garlicky! Not a bad thing if you are looking for something... resolutely garlicky. Garlic is good for you anyway, especially in France.<br><br><b>Author: </b>Anne O.; <br><b>Rating: </b>5<br><b>When: </b>a year ago<br>Really nice staff and good food! Lunch menu for 15 € approx<br><br><b>Author: </b>Osman Bakker; <br><b>Rating: </b>5<br><b>When: </b>a year ago<br>It was a nice experience, the stuf were friendly<br><br>",CLUB
38,Tennessee - Paris,https://www.facebook.com/tennesseeparis/,+33 6 01 07 06 09,2.3390576,48.8537732,4.3,455,"[]<b>Author: </b>Srikrishna Murali; <br><b>Rating: </b>5<br><b>When: </b>6 months ago<br>It was an amazing pub we visited. It had a good collection of liquor and also an underground performance arena. We were lucky to have a few shots of tequila and enjoy a live jazz band performance with a large cup of beer. It was a great place and definitely a must visit if you're going pub-crawling/hopping. Lots of great bars/pubs in the area and this one definitely makes quite an experience to remember.<br><br><b>Author: </b>Nicolas Maillols; <br><b>Rating: </b>5<br><b>When: </b>in the last week<br>Best Bar Ever !<br><br><b>Author: </b>Upendra Bagale; <br><b>Rating: </b>4<br><b>When: </b>10 months ago<br>Great place to hangout having drinks. Staffs are friendly and speaks English. They have karaoke on their basement. It's amazing atmosphere out there.<br><br><b>Author: </b>Elizabeth Bohner; <br><b>Rating: </b>5<br><b>When: </b>10 months ago<br>As a Tennesseean, this is home away from home. Excellent cocktails, kind staff, good vibes! They always have events too :)<br><br><b>Author: </b>Alex; <br><b>Rating: </b>5<br><b>When: </b>8 months ago<br>Has to be the best bar in Paris! The happy hour offers very good prices and the staff is incredibly friendly!<br><br>",CLUB
55,SUN CAFE,https://sun-cafe.fr/,+33 1 48 04 89 88,2.349055899999999,48.8596072,3.9,453,"[]<b>Author: </b>Gilles Scorp; <br><b>Rating: </b>5<br><b>When: </b>6 months ago<br>Great place. Love the sushis and the drinks. Very pleasant staff.<br><br><b>Author: </b>Erica Caty; <br><b>Rating: </b>5<br><b>When: </b>9 months ago<br>Good, they're nice and the food is good !<br><br><b>Author: </b>Joel Mytty; <br><b>Rating: </b>4<br><b>When: </b>a year ago<br>Good service, decent food, friendly staff, open late.<br><br><b>Author: </b>Tiffany Chi; <br><b>Rating: </b>3<br><b>When: </b>a year ago<br>This looked like a relatively popular place for happy hour. Order the drinks but skip out on the food. We ordered a dragon roll and the rice was overcooked and mushy.<br><br><b>Author: </b>Ekaterina Ivleva; <br><b>Rating: </b>5<br><b>When: </b>2 years ago<br>I liked the place for it's lovely terrace with a view on the boulevard. The menu has rolls without fresh salmon (with cooked tuna and cooked eel), which is important for me at the moment. My husband enjoyed his fresh salmon roll with avocado, and the team even accepted to add Philadelphia into the roll, though it was not initially in the menu.
If we are around in this part of Paris, will gladly come again.<br><br>",CLUB
10,Paradis Latin,http://www.paradislatin.com/,+33 1 43 25 28 28,2.3528656,48.8479926,4.0,394,"[]<b>Author: </b>Vishwa Nath Purohit; <br><b>Rating: </b>5<br><b>When: </b>8 months ago<br>We had gone to this place in 2012 in a group organized by Kesari Tours and many of our friends specially ladies were to uncomfortable to join felling obscene moves . But it was a most enjoyable night of tour and all members enjoyed it fully. We recommend it as a must see attraction of Paris! Go for the full Dinner + champagne + Dance package. Try to get a table facing the stage  to enjoy the show fully. The girls were full of energy and movements were very graceful reflecting their full dedication for the art of Cabret . The costumes, lighting, sound & choreography were Superb and kept us fully engrossed. Would prefer  to revisit again if in Paris.<br><br><b>Author: </b>Onkar Pandhare; <br><b>Rating: </b>5<br><b>When: </b>a year ago<br>A must see attraction of Paris! Go for the full Dinner + champagne + Dance package. Try to get a table facing the stage & just enjoy the show!!! The girls were full of energy. The costumes, lighting, sound & choreography were top class. Would love to visit again!<br><br><b>Author: </b>Leslie Zippy Salmi; <br><b>Rating: </b>5<br><b>When: </b>2 years ago<br>Spectacular show! Mix of both French and English but even when you couldnt understand the language it was delivered in a way that was entertaining. The music and artistry was amazing. The Male lead sang the most beautiful rendition of Never Enough I have ever heard. By far the best part of our 3 city trip! Thank you!<br><br><b>Author: </b>Veanette Juarez; <br><b>Rating: </b>5<br><b>When: </b>2 years ago<br>Fun lively show. It catered to people who didn’t speak French so it helped me get a few laughs in. The performers are very talented and my husband and I were entertained the entire time. Definitely worth seeing if you want to do something a little different while in Paris.<br><br><b>Author: </b>Jeremy Bustillos; <br><b>Rating: </b>5<br><b>When: </b>a year ago<br>A fun night with cabaret, dinner, and drinks.  You can opt for the dinner and preshow or just the show and drinks.  The show is entertaining and interactive with the audience.  Cabaret knows all languages.  If you are not fluent in French you will still have  great time.<br><br>",CLUB
16,Le Pousse Au Crime,http://lepousseaucrime.fr/,+33 1 46 33 36 63,2.3343221,48.8518389,3.9,384,"[]<b>Author: </b>Nicolas LECLERCQ; <br><b>Rating: </b>1<br><b>When: </b>a year ago<br>Super bad. Place was so crowded we could barely move. I wish they would have refused us and spare our money.<br><br><b>Author: </b>Verity; <br><b>Rating: </b>2<br><b>When: </b>a year ago<br>Smelly and dirty. A real dive but maybe you're into that...<br><br><b>Author: </b>George Philip; <br><b>Rating: </b>5<br><b>When: </b>2 years ago<br>Great bar with delightful barkeeps and a naughty clientele!!<br><br><b>Author: </b>clive nolan; <br><b>Rating: </b>5<br><b>When: </b>2 years ago<br>Lots of locals, loved this late night Parisian vibe, mixed music so caters for all...<br><br><b>Author: </b>ANAVARDON MOOROOGEN; <br><b>Rating: </b>5<br><b>When: </b>a year ago<br>Super music<br><br>",CLUB
34,Au Port du Salut,http://www.auportdusalut.fr/,+33 6 58 44 30 58,2.343089599999999,48.8459786,4.3,379,"[]<b>Author: </b>Adam Ruskin; <br><b>Rating: </b>5<br><b>When: </b>7 months ago<br>Great restaurant! The atmosphere is super nice with the live music. The outdoor space is nice too. Good wine list. I am never disappointed with food and wine combo. I had the confit always great!<br><br><b>Author: </b>Tam Le; <br><b>Rating: </b>5<br><b>When: </b>8 months ago<br>Nice cozy restaurant in the center of Paris.
Classic French cuisine. Friendly staff.
Good price for money with 50% off a la carte dishes with La Fourchette reservation<br><br><b>Author: </b>Dave Givens; <br><b>Rating: </b>4<br><b>When: </b>a year ago<br>Lovely food, good wine, great service, but comes at a price.<br><br><b>Author: </b>Arnaud de Meulemeester; <br><b>Rating: </b>5<br><b>When: </b>a year ago<br>Extremely Parisian typical restaurant with live music. Very popular for decades, although intimist, floating in the air the soul of Brassens, Brel, Bear and many other french singers.
The food is good also, you may not come for it.<br><br><b>Author: </b>Valerio Laghi; <br><b>Rating: </b>5<br><b>When: </b>7 months ago<br>I arrived in Paris the 2nd of January 2019 and I searched for something French, yet something with an atmosphere like midnight in Paris. For more than 1 year nothing... The French cuisine, in a lot of places, was degradated; deprived of technicity and originality.... Here I finally found the sweet spot... Live jazz music, food of a certain level, that leave you satisfied and an atmosphere that entice you. Well, for me was perfect... For you... Well, visit it when you can. Ah, did I tell you that on the fork the menu is 50% off?<br><br>",CLUB
2,Hotel Atmospheres,http://www.hotelatmospheres.com/,+33 1 43 26 56 02,2.348054,48.848626,4.4,369,"[]<b>Author: </b>EzSnipes LT; <br><b>Rating: </b>5<br><b>When: </b>a month ago<br>i came here from mr nightmare<br><br><b>Author: </b>Panos Panagiotopoulos; <br><b>Rating: </b>4<br><b>When: </b>a year ago<br>Excellent location in a nice, compact hotel with well equipped rooms. Some of them are tiny and not possible to fit two people with suitcases. Nice facilities at the basement and great breakfast! Better not to book directly from the hotel website as our reservation was lost! They did not seem to think it was really an issue and did not offer flexibility in the payment. I would stay again at a reasonable price.<br><br><b>Author: </b>Tim Smith; <br><b>Rating: </b>5<br><b>When: </b>a year ago<br>This is a lovely quaint hotel in a wonderful part of Paris.  The rooms are comfortable and we'll sized.  The staff is very friendly and helpful.  They have a nice honor bar where you may serve yourself and breakfast every morning.  I would recommend to anyone looking for a place to stay while visiting the city.<br><br><b>Author: </b>Robert Losee; <br><b>Rating: </b>5<br><b>When: </b>a year ago<br>Nice location, well appointed rooms, friendly staff. I'd certainly consider it on a future stay in Paris, especially since I love the Latin Quarter.<br><br><b>Author: </b>Renee Pierson; <br><b>Rating: </b>5<br><b>When: </b>2 years ago<br>Wonderful stay at Hotel Atmospheres. Traveling with family of 4 over winter holiday. Room was much larger than expected (especially for Paris). Plenty of room for 4 with large luggage. Hotel staff was very friendly and professional. Breakfast was good with many items to choose from. Hotel is in a great location. We walked to all major historical sights and museums. Found many ""local"" restaurants within a few blocks of hotel. Would definitely recommend.<br><br>",CLUB
59,Ballroom,,+33 1 49 27 92 08,2.3434028,48.8639248,4.2,347,"[]<b>Author: </b>Kevin Dam; <br><b>Rating: </b>4<br><b>When: </b>a year ago<br>nice for a Wednesday night drink. music was great and got busy around 11pm. had an old fashion and it was made well<br><br><b>Author: </b>Vojin Stanojevic; <br><b>Rating: </b>5<br><b>When: </b>2 years ago<br>Those outstanding underground bars with live DJ.
When you want to feel like in prohibition period of US.
Small and cozy place with thrilling atmosphere.
Good selection of whiskeys and rums.
Experienced bartenders.<br><br><b>Author: </b>Andréas Kalogéropoulos (Stenfaul); <br><b>Rating: </b>5<br><b>When: </b>2 years ago<br>Clearly one of the  best Cocktails in Paris! Just choose your alcohol and let the barman improvise, always a nice surprise!<br><br><b>Author: </b>Castera Huertas Millan; <br><b>Rating: </b>2<br><b>When: </b>2 years ago<br>Nice bar, staff pushy. We ended up paying more drinks that we ordered - the barman gave us tequila shots supposedly free and then made us pay for them. Pas sérieux.<br><br><b>Author: </b>Danielle Jaafar; <br><b>Rating: </b>5<br><b>When: </b>2 years ago<br>Very tasty cocktails. Friendly staff. Great music and atmosphere!<br><br>",CLUB
14,Aux Trois Mailletz,http://www.lestroismailletz.fr/,+33 1 43 25 96 86,2.346609,48.852174,4.0,337,"[]<b>Author: </b>Grizzly Actual; <br><b>Rating: </b>5<br><b>When: </b>7 months ago<br>I had a wonderful evening back in 2017 with an amazing assortment of cheeses while being serenaded by beautiful Parisian women. What's not to love about that?<br><br><b>Author: </b>Maylis Kouek; <br><b>Rating: </b>5<br><b>When: </b>a year ago<br>(+) beautiful tavern and courteous staff! Has by far the most talented singers/performers in Paris! The ambiance is incredibly thrilling!
(-) the wait to find a place<br><br><b>Author: </b>Mathew Lindley; <br><b>Rating: </b>5<br><b>When: </b>a year ago<br>If you aren't ready or willing to participate with the music after midnight here, this place (and really Paris as a whole) isn't for you. Save it for the rest of us. Please go to Nashville or whatever with your buddies and tell yourselves about the great time you had.<br><br><b>Author: </b>Alex Gomes; <br><b>Rating: </b>1<br><b>When: </b>a year ago<br>WORST “CABERET” IN PARIS!!!!
We took time researching several affordable Caberets around Paris and this place had great reviews. We viewed their website to which it had images of Caberet dancers in glamorous outfits doing all sorts. Where we arrived their we asked if there was Caberet to which the woman agreed and she told us it was a €20 price we would pay on the way out. We agreed and went in. When we arrived there was, to be fair, a sweet live band with good singers however after two hours we were waiting for the dancers/performers to come out. We went to question the host about when they’d be on to which she replied “we don’t do that anymore”, this obviously prompted an uncomfortable conversation as to why they were advertising Caberet when really it was just a live band and some karaoke. The woman began becoming confrontational begging us saying “plz be nice and just pay u didn’t even buy any drinks” (which were very expensive) we continued to argue the fact that their advertising was false and lured us in over false pretends to which she replied she’s not responsible for the websites mistakes. Clearly going nowhere  we gave up paid the amount and left even after offering to only pay half she was not having it and brought security down to intimidate us. This place is a strictly money motivated event to which insists on hiding your bill and secretly adding extra drinks to it in the hope ur drunken state won’t notice.<br><br><b>Author: </b>Sebastian Ranch; <br><b>Rating: </b>4<br><b>When: </b>a year ago<br>A gem in the old quarter. A time machine taking you back to ""old Paris."" Cosy atmosphere and lovely live music. Prices are a bit on the expensive side but entrance is free. Overall this place is really really nice. Treat yourself to a lovely evening.<br><br>",CLUB
40,Le Globo,https://www.leglobo.fr/,+33 1 42 41 55 70,2.354985,48.870069,2.7,323,"[]<b>Author: </b>Robert Saade; <br><b>Rating: </b>1<br><b>When: </b>a year ago<br>Worst night club I've ever been to! The drinks are ok but the music was very bad - 95% French music and 5% international - as if there are no tourists or people visiting from outside! and the type of music chenges from song to song so you cannot even set a vibe!<br><br><b>Author: </b>Anis Ayari; <br><b>Rating: </b>1<br><b>When: </b>a year ago<br>Please educate and change your staff. There is one skinny barman with strange haircut that was so HORRIBLE.<br><br><b>Author: </b>Achraf El Ayedi; <br><b>Rating: </b>4<br><b>When: </b>2 years ago<br>I am new in Paris and this place is amazing I go every friday, sometimes saturday also. The bouncers are respectful, service is cool, people are friendly... Even the music is not my type but it has it own style. I really appreciate the guest list thing ;) nice try.<br><br><b>Author: </b>ManisH; <br><b>Rating: </b>3<br><b>When: </b>2 years ago<br>I like the atmosphere but the music is not that much good<br><br><b>Author: </b>Nikolai Doinikov; <br><b>Rating: </b>3<br><b>When: </b>2 years ago<br>If you are young and wild, and just want to dance and enjoy your time with your friends on a dancefloor - Le Globo is a good choice! Sometimes, there is too much French music, though.<br><br>",CLUB
27,La Peña Saint Germain,,+33 1 46 33 19 89,2.3357615,48.8537371,3.5,315,"[]<b>Author: </b>Sofia; <br><b>Rating: </b>3<br><b>When: </b>3 years ago<br>La Peña is one of my favorite latin dance spots. The drinks are expensive, however I think it's nice that you don't have to pay a cover. Some people complain for the need to check your coat, but if it wasn't done this way, it would get too stuffy downstairs. The downstairs is nice on nights where it's not too crowded. However it can easily get too stuffy, and hot with hardly any room to dance. I have never had problems with the staff (but I am also a girl).<br><br><b>Author: </b>Spoorthi Gangadikar; <br><b>Rating: </b>1<br><b>When: </b>2 years ago<br>HORRIBLE HORRIBLE HORRIBLE PLACE!
STAY AWAY!
They made us pay for our own bags then harassed us into ordering something from the menu even before we could settle into the place.
When we decided to leave they didn't even refund our money.
Spoke so rudely! Unacceptable service... And exorbitant prices!<br><br><b>Author: </b>andres felipe amador bello; <br><b>Rating: </b>2<br><b>When: </b>2 years ago<br>It is a really small and warm night club, in spite of the good music and good ambiance you live there<br><br><b>Author: </b>J; <br><b>Rating: </b>2<br><b>When: </b>2 years ago<br>Coat check is €2 and they will charge separately for bag. I would rate more but there are several factors for my rating. 1st: it’s too small to dance comfortably. 2nd: the music choice was ok, not the greatest. 3rd: stairs get super slippery from all the drinks being spilled on the floor from being too crowded. 4th: overheard manager scolding the bartender in French while I was trying to order my drink. 5th: bartender was not in the greatest mood to serve. 6th: drinks are watered down and too pricey for what they are.<br><br><b>Author: </b>Loïc Poulain; <br><b>Rating: </b>4<br><b>When: </b>2 years ago<br>Lively but very crowded... Typical parisian basement club.<br><br>",CLUB
45,The 43- Roof Top,,+33 1 81 69 00 60,2.3422929,48.8528666,4.1,312,"[]<b>Author: </b>Aïcha Diagne; <br><b>Rating: </b>4<br><b>When: </b>11 months ago<br>The view was spectacular and the service was super nice (quite rare in Paris). The cocktails and cheese platter we ordered needed a little push, but overall we had a really nice time. I would definitely go back on a sunny day<br><br><b>Author: </b>Pia Romeo; <br><b>Rating: </b>1<br><b>When: </b>9 months ago<br>The rooftop only opens at 8 30 pm which makes no sense when the sunset is before. On top of this they arent even punctual since at 8 30 they were still cleaning up the place so we had to wait further. Awful customer service.<br><br><b>Author: </b>Yusuf Hawkins; <br><b>Rating: </b>1<br><b>When: </b>9 months ago<br>Rushed to get there. Only to be told it's clients/guests only.. Waste of time<br><br><b>Author: </b>Bob McClintic; <br><b>Rating: </b>5<br><b>When: </b>a year ago<br>One of the best views of Paris and you get to enjoy it with a nice beverage in hand. When you get there you’ll need to get a access card from the bartender in the main lobby. The staff is great and all speak English if needed. The cost is on the higher end but it pays for the views. Once there, sit back and enjoy.<br><br><b>Author: </b>valentina maspero; <br><b>Rating: </b>5<br><b>When: </b>a year ago<br>my favourite view of paris! so so so beautiful. such a wonderful atmosphere. reasonable prices too! i very much recommend this place.<br><br>",CLUB
37,Oh! Happy Paris,http://www.ohhappyparis.com/,+33 1 42 96 81 00,2.3398112,48.87038680000001,4.1,299,"[]<b>Author: </b>Ewa; <br><b>Rating: </b>4<br><b>When: </b>2 years ago<br>Top<br><br><b>Author: </b>Laurent Zambonini; <br><b>Rating: </b>5<br><b>When: </b>3 years ago<br>Cool<br><br><b>Author: </b>Ed Rc; <br><b>Rating: </b>4<br><b>When: </b>8 months ago<br>Warm places and where there is a good atmosphere. The musicians are talented and the staff welcoming. The dishes are good but not exceptional for the price which remains high. This is only the recovery following the covid crisis, but yet the restaurant has been able to rise to the occasion by offering entertainment all evening. However, we would have liked to dance a little more after the end of the show. Maybe it will be xas in the next few weeks.<br><br><b>Author: </b>Sylvie Lenoir; <br><b>Rating: </b>5<br><b>When: </b>a year ago<br>Warm welcome, beautiful surroundings, good food, good dancing, beautiful orchestra, Claire and Thomas on top, very nice atmosphere. I highly recommend it, you are going to have a wonderful evening. All the staff are at your disposal for a great evening. I will return because in Paris it is not always the case to find this welcome. And they are very professional.<br><br><b>Author: </b>Paolo Cotognini; <br><b>Rating: </b>5<br><b>When: </b>a year ago<br>Location: room located in a central area of ​​Paris, furnished as a modern cabaret. All very nice and certainly the music played live or recorded is a fundamental component. Rating 9
Service: excellent service, professional, cared for without smudging. Rating 9
Menu: you can choose between two menus, meat or fish. We have taken the meat menu that today foresaw; foie gras appetizer with cooked pears and croutons, chicken in sauce with rice and sweet cheese and coffee. A glass of champagne as an aperitif and excellent Bordeaux wine. Rating 9
Account: absolutely competitive, both for the quality of the food and for the quality of the musical and cabaret show we have seen. We spent about 85 euros each. Rating 9<br><br>",CLUB
