,Name,Website,Phone Number,LON,LAT,Rating,Popularity,Last 5 Reviews,type
9,Le Dépôt,http://www.ledepot-paris.com/,+33 1 44 54 96 96,2.3514979,48.863494,2.8,282,"[]<b>Author: </b>Dan Yell Burn-Hard; <br><b>Rating: </b>5<br><b>When: </b>6 months ago<br>Nice place to meet even if you're not gay<br><br><b>Author: </b>Charles Bouillon; <br><b>Rating: </b>3<br><b>When: </b>a year ago<br>Be aware that the French are always looking for the next best one.... So action can be a little slow. On the flip side if you come across some visitors you can be in for a nice load of protein. ;-) Worth a visit if you are the patient type, otherwise you're best off going to a sauna.<br><br><b>Author: </b>Jacques-daniel valmy; <br><b>Rating: </b>4<br><b>When: </b>2 years ago<br>good place to dance n have fun in paris staff are very friendly :)<br><br><b>Author: </b>Jesus Carrillo; <br><b>Rating: </b>2<br><b>When: </b>2 years ago<br>If you are looking for a fun time in a gay club such as dancing and drinks this is not the place to go. This is a sex club full of older men and dark corners.  The drinks are incredibly over price and the whole place had a pundgent smell of vomit sex and urine. The restroom is absolutely disgusting with urine everywhere. If your looking for a sketchy hook up or to get murdered this is your place.<br><br><b>Author: </b>Super Furry; <br><b>Rating: </b>5<br><b>When: </b>2 years ago<br>Hottest cruising club in Paris had the best time of my life for the last 12 years.<br><br>",CLUB
0,Hôtel Duo,http://www.duo-paris.com/,+33 1 42 72 72 22,2.3529277,48.8581126,4.2,281,"[]<b>Author: </b>Kevin Nicholas Gavit; <br><b>Rating: </b>4<br><b>When: </b>3 months ago<br>I've stayed here multiple times over the years. The location is perfection, some staff are friendly, the place is clean, but the rooms are not huge, so don't expect a lot of space to hang around in.<br><br><b>Author: </b>Matt Simpson; <br><b>Rating: </b>5<br><b>When: </b>a year ago<br>Stayed for three nights in late November 2019. Room was spotlessly clean, beds comfy, bathroom functional.

Staff were exceptional and went out of their way to assist. The location is excellent, close to everything.

The room was small, but that is to be expected in a euro hotel.

Highly recommended<br><br><b>Author: </b>Blundstone Osterberger; <br><b>Rating: </b>4<br><b>When: </b>a year ago<br>Good location. Really close to a lot of sights. Rooms are nothing special but clean and minimalist. Surrounding area is beautiful. This is not a place to spend much time in, but perfect for a weekend or short trip.<br><br><b>Author: </b>Rachel Whimpenny; <br><b>Rating: </b>3<br><b>When: </b>a year ago<br>I am giving this hotel 3 stars because I was very disappointed with the breakfast. We booked a suit and I was expecting good things from this hotel, however I was very disappointed.

I prefer to take breakfast in the room as I like to do my make up and wake up a little before I see other people. But when we order breakfast we were told that we could only have bread and coffee in the room, some fruit and yogurt.

I normally like some eggs and make some meat and cheese but we were told this was not possible. So my husband had to arrange for the chef to make it for us as a one off service, which meant he had to go talk to the chef to arrange it as this was not offered by the hotel.

Also the coffee in the room was instant powder coffee, which is fine but not at the price we were paying, I wish I had brought my cafetière but I would of thought that in Paris France a decent coffee would of been one of the basics in a hotel room but sadly not.

However the room was fine, the bed and the staff were very nice and helpful. If you in Paris for business and you are not interested in having a good breakfast and good coffee this is the place for you. But if your like me and like a good breakfast and good coffee maybe this is not the place for you.

My advice to Management, the staff were great. The room as fine, but please offer room service and a good breakfast, I was very disappointed that you didn’t.<br><br><b>Author: </b>Alexandre Steiner; <br><b>Rating: </b>4<br><b>When: </b>10 months ago<br>Clean and cosy but the rooms are small<br><br>",CLUB
57,La Mezzanine,https://facebook.com/La-mezzanine-246211799081305/,+33 1 71 50 78 90,2.344844,48.850552,4.4,228,"[]<b>Author: </b>christophe lubrano di ciccone; <br><b>Rating: </b>5<br><b>When: </b>a year ago<br>Cosy, cool. Great burger. The service is very nice and friendly.<br><br><b>Author: </b>sandy rodriguez; <br><b>Rating: </b>5<br><b>When: </b>2 years ago<br>After searching for a place to eat, we stumbled on La Mezzanine.   They were serving drinks, buy we found out food was not being served yet.  Despite this our served was amazing and agreed to served us food.  Boy, did we get lucky.  Everything was delicious!!!  Our server, Houari, was amazing.  He was accommodating and extremely helpful.  This was a super happy accident.  I would definitely come back.  The beer selection was not wide but all were quality  beers.  Overall, the food and drinks portions were generous.<br><br><b>Author: </b>Jonathan D.; <br><b>Rating: </b>5<br><b>When: </b>2 years ago<br>I celebrated my birthday in this bar and it was amazing! The owner was really nice and did the best for everyone to feel comfortable. Drinks and food were great and thumbs up for the cocktails! I definetly recommand this bar for any kind of event :)<br><br><b>Author: </b>Joel Richardson; <br><b>Rating: </b>4<br><b>When: </b>3 years ago<br>Nice little bar with a dark, mordern feel. Decent happy hour. Not a traditional french place, but very friendly staff.<br><br><b>Author: </b>Omri Leybo; <br><b>Rating: </b>5<br><b>When: </b>3 years ago<br>Delicious food and drinks, super nice service. visit this place at least once while in Paris.<br><br>",CLUB
3,Hôtel de JoBo,http://www.hoteldejobo.paris/,+33 1 48 04 70 48,2.3621384,48.8554875,4.7,224,"[]<b>Author: </b>Mirabelle Shih; <br><b>Rating: </b>5<br><b>When: </b>8 months ago<br>Elegant boutique with good taste of typical France culture.
The decoration in the room is amazing!
Clean, comfortable and stylish.
Friendly staffs. I enjoyed my stay there!<br><br><b>Author: </b>Jean-Baptiste Berchoteau; <br><b>Rating: </b>5<br><b>When: </b>8 months ago<br>Lovely boutique hotel in the heart of Paris. Clean and stylish room with comfy bed and full amenities. The black and white bathroom with the tub is super cool! Very friendly staff. I recommend!<br><br><b>Author: </b>Frank Jaeger; <br><b>Rating: </b>5<br><b>When: </b>a year ago<br>Decor like nowhere else, exceptional atmosphere and aesthetic. Incredibly stylish with music and fragrance everywhere you go. Truly beautiful place.<br><br><b>Author: </b>Adam Fineman; <br><b>Rating: </b>5<br><b>When: </b>a year ago<br>The people at the front desk are very helpful and kind.  Breakfast is nice. The rooms are beautiful, but small. (But not small for Paris.)

The location is perfect. One short block to the metro. Surrounded by nice shops and great restaurants. Walking distance to a few small museums, and maybe a 15 minute walk to the Louvre.<br><br><b>Author: </b>Jeff Weldon; <br><b>Rating: </b>5<br><b>When: </b>a year ago<br>My wife and I had an absolutely lovely time at this unique boutique hotel right in the heart of Paris. This hotel is situated in the amazingly hip and fun area of Le Marais— Tons of amazing cafes, bars, shopping, art. The staff at the hotel were incredible. The feel of the hotel was Parisian all the way and rooms were brilliant. The price of the hotel is far lower than what this property could demand. It was a 5 star hotel experience and we couldn’t recommend this property any more!<br><br>",CLUB
19,freedj,http://www.freedj.fr/,+33 1 48 04 95 14,2.354895,48.858573,3.2,218,"[]<b>Author: </b>Kevin Nicholas Gavit; <br><b>Rating: </b>5<br><b>When: </b>a month ago<br>I love FreeDJ, it's a great place to grab drinks with friends during happy hour, and dancing downstairs when you're in a clubbing mood. The staff are fantastic, the music is great and the drinks are delicious.<br><br><b>Author: </b>Maikka Rustia; <br><b>Rating: </b>2<br><b>When: </b>11 months ago<br>Prepare to be insulted by the bouncer at the entrance before you can come in. He is bully and makes inappropriate remarks that you should not take personally cause he must probably be just sick in the head. Other than that, inside is perfect and has a nice atmosphere. Shame to enter an LGBT establishment with a persona right at the entrance that is the opposite of what the community is standing for.<br><br><b>Author: </b>Unger Unger; <br><b>Rating: </b>5<br><b>When: </b>a year ago<br>We loved this bar. Played primarily American music. Fun even though drinks are pretty expensive, but being that tips aren't necessary it is probably pretty average. It gets really crowded around 11pm and downstairs on Saturday night is the most nightclub feel we've found. Big dance floor full of people.<br><br><b>Author: </b>Dustin Carter; <br><b>Rating: </b>5<br><b>When: </b>a year ago<br>Busy bar, dance floor downstairs, buy one get one happy hour. Friendly staff. Free coat check.<br><br><b>Author: </b>Alex Langston; <br><b>Rating: </b>5<br><b>When: </b>2 years ago<br>Liked the vibe of this gay bar! Football table was cool. Went there around 10pm on a Wednesday so didn't have a hard time getting in, can't give input about complaints about bouncers. Beers were €7.<br><br>",CLUB
21,La Boîte à Frissons,http://www.boite-a-frissons.fr/,+33 1 42 72 17 78,2.356791,48.864509,2.8,196,"[]<b>Author: </b>Arthur Bossuet; <br><b>Rating: </b>5<br><b>When: </b>a year ago<br>Definitely my favourite nightclub in Paris. Love the atmosphere and the music. Dancefloor is full of people enjoying the evening. When tired, you can switch to a ""bar"" side with tables and less noise, so you'll be able to talk to others.

I've never had any troubles getting inside, but I know their policies. Their worst clients are hetero girls coming for an anniversary. Definitely not a place for that.<br><br><b>Author: </b>Oskar Holmer; <br><b>Rating: </b>1<br><b>When: </b>a year ago<br>This just wasn't any fun. Paris can do better!<br><br><b>Author: </b>Rob Villacres; <br><b>Rating: </b>5<br><b>When: </b>2 years ago<br>Fun, non pretentious dance club with lots of kitschy French songs, ABBA, etc.  If you’re looking for a night out dancing with friends, it’s a great choice. Around midnight gets busy.<br><br><b>Author: </b>Alberto Pimentel; <br><b>Rating: </b>1<br><b>When: </b>3 years ago<br>This place was nice before. Today they select their clients on the queue according to some weird questions, appearance or just by flavor. Further, the guy who selects the ""ideal client"" is quite rude. Paris is full of nice places to go, don't waste your time going to this place.<br><br><b>Author: </b>Syndic Copro; <br><b>Rating: </b>1<br><b>When: </b>2 years ago<br>This place is literally a trip back to the 70s ! It hasn't been renewed during last 40 years, the service is bad you have to queue all night...in the entrance, in the toilet, in the bar, to leave your coat. The gintonic is really small and bad quality for 10 eur. On the top of that the whole place smell like dead bodies are cumulated downstairs. Guys please invest a bit and respect your customer...<br><br>",CLUB
25,Castel,http://www.castel.paris/,+33 1 40 51 52 80,2.3346246,48.85204419999999,4.2,173,"[]<b>Author: </b>Boon Poon; <br><b>Rating: </b>1<br><b>When: </b>a year ago<br>I got the recommendation from the restaurant to come here and I already tell the taxi  to drop us here and then they don’t let us in . So for me I don’t care but very disappointed Anyway I got the very bed disappointed they don’t let us in. Anyway I don’t care because I’m just come here for holidays and I don’t care how much I gonna pay anyway so they prove me and my husband wrong I recommend don’t come here if you a tourist be safe<br><br><b>Author: </b>Yi Zhang; <br><b>Rating: </b>5<br><b>When: </b>2 years ago<br>You have to go to downstairs to experience the night club of this place. Just amazing! The decorations are exquisite while the lighting is perfectly adjusted. The bar, the stage are so artistic. If you have time to drop by the road here. This place is a must visit.<br><br><b>Author: </b>Leandro V.; <br><b>Rating: </b>1<br><b>When: </b>a year ago<br>Awful coffee. Hyper expensive. The refuse to give you some tap water (carafe d’Eau) in a rude manner. Plus, they charge an extra of 1 Euro for all the drinks after 8pm. Never ever will be back.<br><br><b>Author: </b>Luis Sangiovanni; <br><b>Rating: </b>4<br><b>When: </b>a year ago<br>Really great little place.<br><br><b>Author: </b>Michela Mastrocola; <br><b>Rating: </b>4<br><b>When: </b>a year ago<br>Do (not) look at the floor :P<br><br>",CLUB
49,La Cave St Germain,,+33 6 42 88 08 52,2.333761,48.8519395,4.0,160,"[]<b>Author: </b>Hugo Stalla-Bourdillon; <br><b>Rating: </b>1<br><b>When: </b>3 years ago<br>My worst night in Paris: the bouncer used tear gas on one of my friend without any reason. Just to make him get out quicker (which he was willingly doing). There are far better nightclubs close to this one: Chez Georges, Chez Antoine or The Frog.<br><br><b>Author: </b>Matteo Gentili; <br><b>Rating: </b>3<br><b>When: </b>4 years ago<br>Nice place, but not so good and expensive cocktails. Beer is expensive too. In line with the area. It has a pole in the room downstairs.<br><br><b>Author: </b>H Kam (Hkam); <br><b>Rating: </b>5<br><b>When: </b>4 years ago<br>Nice place with cheap beer!<br><br><b>Author: </b>clemzolo; <br><b>Rating: </b>5<br><b>When: </b>2 years ago<br>Cool<br><br><b>Author: </b>Nicolas Pouffet; <br><b>Rating: </b>1<br><b>When: </b>a year ago<br>I booked through YouShould, the bar canceled my reservation without notice, or even informed me directly. I learned about it through the booking site.
I had however paid well the requested deposit of 70 euros !!
A scandal less than a month from the event !!!
Reliability, and friendliness 0!<br><br>",CLUB
26,Le Petit Journal Saint-Michel,https://www.lepetitjournalsaintmichel.com/,+33 1 43 26 28 59,2.340604599999999,48.8463845,4.2,151,"[]<b>Author: </b>Nicole Gonichon; <br><b>Rating: </b>5<br><b>When: </b>5 months ago<br>I knew that place since I was a student some 50 years ago. For the last 5, 6 years we tried to go at lest every 2 weeks when we are in Paris.
Great place, excellent food, fantastic music. Extremely friendly atmosphere.
Hope to be able to enjoy it again when it will be allowed to re-open and when we will be able to go back to France.
All the best to the staff of the Petit Journal.<br><br><b>Author: </b>Ned Newitt; <br><b>Rating: </b>5<br><b>When: </b>a year ago<br>Excellent jazz and food in convivial surroundings. A must for every jazz fan and lover of live music. The band started at eight after most people had got their starters and the band was still way after midnight. A great evening!<br><br><b>Author: </b>Hilary Briegal; <br><b>Rating: </b>4<br><b>When: </b>2 years ago<br>Great little place, bar upstairs & jazz downstairs. We were lucky to catch a terrific American saxophonist.  1st drink includes cover charge.<br><br><b>Author: </b>Stilianos Vidalis; <br><b>Rating: </b>3<br><b>When: </b>2 years ago<br>Jazz club. Good music, nice people. Convinient for us location. The wine was not to my liking. The ambience could have been better. I did have fun but no oumf factor.<br><br><b>Author: </b>Kat Thomas; <br><b>Rating: </b>5<br><b>When: </b>3 years ago<br>Fantastic traditional jazz bar. If you are looking for the old Latin quarter this is its beating heart. Total dive and average food, crowded, dark but with absolutely fabulous music and nice drinks. You really feel transported to another era. Cover charge includes entry to a concert and a drink- 20 to 25 Euro.
You pay for the musicians and the experience, and these are good musicians. Check the programme to make sure it is the style you like. The perfect digestif<br><br>",CLUB
44,Alégria,http://www.alegria-bar.com,+33 893 02 53 51,2.3342286,48.851834,3.9,142,"[]<b>Author: </b>Ahmed Abulhassan; <br><b>Rating: </b>5<br><b>When: </b>2 years ago<br>Great Sicilian food in a lively Thursday night neighborhood.  Be sure to try their veal cuts with tonnato sauce, absolutely delicious.  Their seafood plate of cuttlefish and prawn is also delicious.<br><br><b>Author: </b>Majdi Oukacha; <br><b>Rating: </b>4<br><b>When: </b>a year ago<br>Great music and mood, suitable for afterworks, coworkers and mature people<br><br><b>Author: </b>Karl Vaopa; <br><b>Rating: </b>5<br><b>When: </b>a year ago<br>Great place to have a drink with friends !<br><br><b>Author: </b>anna leymonie; <br><b>Rating: </b>5<br><b>When: </b>a year ago<br>Great bar!
We even come across dolphin breeders 🐬
The only thing that rivals the quality of the customers is the quality of the cocktails made by the bartender 🍸
🤙🏻😚<br><br><b>Author: </b>Astrid P.; <br><b>Rating: </b>5<br><b>When: </b>a year ago<br>We came for my sister's birthday and it was top 😱
The cocktails were delicious, the happy hour until 23h appreciated by friends and well calibrated boards !!
The staff was super cool and attentive to our needs.
The music was good, I recommend +++<br><br>",CLUB
33,Le Rive Gauche,http://rive-gauche.paris/,+33 1 42 71 40 79,2.331478,48.8530971,3.6,127,"[]<b>Author: </b>Matthew Usdin; <br><b>Rating: </b>3<br><b>When: </b>2 years ago<br>Good vibes but they charge 3€ / pers for the clothes. Music was nice, good for students parties. But someone stole our drinks when we were dancing<br><br><b>Author: </b>Emmanuel Roussille; <br><b>Rating: </b>4<br><b>When: </b>a year ago<br>Top !<br><br><b>Author: </b>Marc Bouchard; <br><b>Rating: </b>5<br><b>When: </b>4 years ago<br>General good vibes, great places to meet cool Parisians .<br><br><b>Author: </b>Rachid Erou; <br><b>Rating: </b>3<br><b>When: </b>3 years ago<br>Not bad, but small !<br><br><b>Author: </b>Marta Elbay; <br><b>Rating: </b>1<br><b>When: </b>a year ago<br>Horrible<br><br>",CLUB
6,Hôtel de l'Abbaye Saint-Germain,https://www.hotelabbayeparis.com/,+33 1 45 44 38 11,2.330763499999999,48.85005539999999,4.6,123,"[]<b>Author: </b>Michael Benedum; <br><b>Rating: </b>4<br><b>When: </b>a year ago<br>This is an older upscale hotel in Paris. I would recommend it if you are willing to pay for a larger room than the standard size. The basic rooms are quite small by American standards. Service is very good. Prices are high, but you are in Paris so that is to be expected. The decor is great with a beautiful courtyard. The hotel is on a relatively quiet street, but near many restaurants and shops.

Again, I would recommend this small hotel if you are willing to spend the money. We had a great time in a beautiful city.<br><br><b>Author: </b>Francesca Coe; <br><b>Rating: </b>5<br><b>When: </b>a year ago<br>Hôtel de l'Abbaye Saint Germain is a beautiful, incredibly run hotel! Everyone here is so accommodating and kind to their guests. It is only a 4 star hotel, but I don't see why they are not a 5 star hotel. The rooms are all unique and beautifully decorated. I stayed there when I first arrived in France and again when I left. The rooms I stayed in were different and each uniquely beautiful. Additionally, they have a a great front and back patio where you can sit and enjoy snacks and drinks. For a hotel in the middle of the city, I thought both the rooms and hotel as a whole was pretty spacious. Everything was also very clean and my room was impeccably clean every evening! The service here was remarkable and I would not stay anywhere else in Paris!<br><br><b>Author: </b>Wesley Oliver; <br><b>Rating: </b>5<br><b>When: </b>a year ago<br>Had the pleasure of staying here for our honeymoon. Small quiet hotel. Staff and accomodations were excellent.  Short walk to Luxembourg Gardens and close to mass transit. Would stay here again when we visit Paris in the future.<br><br><b>Author: </b>Bears Transport; <br><b>Rating: </b>5<br><b>When: </b>2 years ago<br>I cannot say how much we loved this Hotel , I almost don't want to write a review to keep it to myself.
Frederick and the entire staff were so hospitable to us. Although we only stayed about 4  days the accommodations and decor were exactly as imagined my Paris experience would be !! So thank you!!
So grateful for everyone who made it so memorable.
A special thanks to Frederick!!!

Frank Cuomo  August 2018<br><br><b>Author: </b>Forlani Benjamin; <br><b>Rating: </b>5<br><b>When: </b>a year ago<br>Amazing place for a drink or to do some work quietly<br><br>",CLUB
1,Hôtel Molière,http://www.hotel-moliere.fr/,+33 1 42 96 22 01,2.3362184,48.8654574,4.7,121,"[]<b>Author: </b>Kabita Ray; <br><b>Rating: </b>4<br><b>When: </b>5 months ago<br>Excellent location, very helpful staff, special mention for Thomas. Good breakfast. Room facilities are quite nice too. Only minor issue is one very small lift and a very narrow staircase, which I guess is a Paris problem. We had a very comfortable stay.<br><br><b>Author: </b>Matt Fisher; <br><b>Rating: </b>5<br><b>When: </b>a month ago<br>The hotel is small but VERY comfortable! Location is very close to major attractions in the center of Paris - the Louvre, Musee d'Orsay, Musee de l'Orangerie, Sainte Chappelle, Notre Dame. Daily breakfast served by the hotel offers a wide range of foods. The staff are incredibly helpful! I have difficulty going up and down stairs, and so we used the elevator to get to our room on the 5th floor. One morning the elevator was out of service for a few hours, and the staff offered to bring breakfast to our room...which they brought up a number of flights of steps! When we return to Paris, Hotel Moliere will be our first choice to stay.<br><br><b>Author: </b>Hans Laursen; <br><b>Rating: </b>5<br><b>When: </b>a year ago<br>Superb location for business or pleasure. Comfy rooms, great breakfast and a very helpful, professional staff. Stayed there twice doing business, next up is a weekend trip with my wife :-)<br><br><b>Author: </b>Ricardo Carrero; <br><b>Rating: </b>5<br><b>When: </b>a year ago<br>A very well set up hotel in a great location. Super friendly and helpful staff. Loved it and I plan on staying there again in the future.<br><br><b>Author: </b>Hollee Carpi; <br><b>Rating: </b>5<br><b>When: </b>a year ago<br>The staff were so friendly and helpful. The breakfast was amazing! Would definitely stay here again next time we visit Paris<br><br>",CLUB
56,El Hombre,,+33 1 48 87 84 45,2.349458,48.859861,4.3,112,"[]<b>Author: </b>Dave R; <br><b>Rating: </b>5<br><b>When: </b>a year ago<br>A small bar which turns out to be Alladins Cave.  A super special barman who gets 15 of 10.  If he not the owner, then the owner should pay him double.  Other half went down stairs to find the dance floor.  Lots of great music and everyone happy dancing the night away.<br><br><b>Author: </b>Ben Wilkins; <br><b>Rating: </b>5<br><b>When: </b>4 years ago<br>Such a friendly and fun place. Giovanni behind the bar is the sweetest guy! We came after awful service at another LGBT bar so were feeling deflated by the Paris scene but El Hombre was marvellous. Go if you fancy having a fun night out rather than a reservation at a meat market.<br><br><b>Author: </b>Geovanni Calderon; <br><b>Rating: </b>5<br><b>When: </b>2 years ago<br>People are very friendly, great music love this place.<br><br><b>Author: </b>Jacob Casselden; <br><b>Rating: </b>2<br><b>When: </b>2 years ago<br>Bar is alright, quite quiet in terms of music but understandable due to the sound restrictions (neighbourhood). Didn’t expect to buy two small drinks for 24€ though... there were a stripper in a shower show which was great but the loyal customers with a drink tend to get shoved about by non-loyal customers who had arrived to see the show and leave. Absolutely and extremely squashed.<br><br><b>Author: </b>Austin Perkins; <br><b>Rating: </b>5<br><b>When: </b>2 years ago<br>Great place to meet new people from all over the work.  Very friendly bartenders and patrons.  We spent every night there after exploring the city during the day.<br><br>",CLUB
