,Name,Website,Phone Number,LON,LAT,Rating,Popularity,Last 5 Reviews,type
3,Luxembourg Gardens,http://www.senat.fr/visite/jardin/index.html,+33 1 42 34 20 00,2.3371605,48.8462217,4.7,77274,"[]<b>Author: </b>hafs Abdelwaheb; <br><b>Rating: </b>5<br><b>When: </b>8 months ago<br>This will be my place to pass the weekend 👌🏻<br><br><b>Author: </b>Halim Hamdan; <br><b>Rating: </b>5<br><b>When: </b>in the last week<br>Such a lovely place truly. There is banks, chairs and so many space to sit down and just enjoy a peaceful day with a partner, friend or family or your child/children. You will find people who play multiple activities and sports and you will find a great spots for taking pictures. Enjoy!<br><br><b>Author: </b>Claudio Tavares; <br><b>Rating: </b>5<br><b>When: </b>a month ago<br>A bit crowded, as usual, but very well kept and clean. One of my favorite parks in Paris. And props to the gardeners, the flowers are always bright, healthy and in excellent shape!<br><br><b>Author: </b>Diku 2627; <br><b>Rating: </b>5<br><b>When: </b>10 months ago<br>It was one of the best place to spend summer time. Surrounded by trees and spacious place and moreover you will get needful thing to eat. Must visit and enjoy the atmosphere.<br><br><b>Author: </b>Véronique Robin; <br><b>Rating: </b>4<br><b>When: </b>8 months ago<br>Beautiful and peaceful garden, very pretty statues and elegant building for the Senate. You can play chess and there is a safe place for young children.
Two reservations: crowded and no toilets.<br><br>",PRK
4,Tuileries Garden,https://www.parisinfo.com/musee-monument-paris/71304/Jardin-des-Tuileries,,2.327494299999999,48.8634916,4.6,72225,"[]<b>Author: </b>Joe N; <br><b>Rating: </b>5<br><b>When: </b>11 months ago<br>This place is gorgeous! Even though there aren't green leafy trees because of the season, it's still amazing to walk around and enjoy the scenery and marvel at all the buildings around the park. You can enjoy seeing family and tourists gathered and just enjoying the same space as you and make you just want to enjoy the moment even longer. It's a nice area to go for a run with the ground mostly heavy sand and not very rocky.<br><br><b>Author: </b>Luca Doria; <br><b>Rating: </b>2<br><b>When: </b>8 months ago<br>Impressive in the historical context and beautiful architecture that surrounds it but the swathes of grit and very little green make them quite soulless as many other gardens in central Paris. The great space occupied by grit and sand in hot days make you feel almost like you are in a desert. With impending climate change there should be more grass, bushes and somewhat a turn towards an English landscaped garden...it would be much better. I hope that Paris local authorities are gonna adapt these Gardens as overall they're not welcoming places.<br><br><b>Author: </b>Elena; <br><b>Rating: </b>4<br><b>When: </b>10 months ago<br>very beautiful! you can walk around, sit on one of the cute green chairs and watch. one of the water fountains, or relax in a nice café! beautiful roman statues you can see everywhere! sadly the floor is full of sand/dust and because it's a little windy the dust gets everywhere on your clothes and shoes...<br><br><b>Author: </b>Solyi H; <br><b>Rating: </b>5<br><b>When: </b>7 months ago<br>What a beautiful place.  The flower garden was exceptionally well designed taken cared of.  It’s lovely to go when there are very few people around.<br><br><b>Author: </b>Abigail Cai; <br><b>Rating: </b>5<br><b>When: </b>7 months ago<br>It’s my favorite vibe in Paris. I spent time sitting on the chair with my friends under the shade of the tree. There are always beautiful flowers there and the Ferris wheel.<br><br>",PRK
7,Jardin des Plantes,https://www.jardindesplantesdeparis.fr/fr,+33 1 40 79 56 01,2.3609587,48.84332870000001,4.5,31599,"[]<b>Author: </b>세상을 보는눈; <br><b>Rating: </b>4<br><b>When: </b>a month ago<br>I've been visited this place first time.
I adore that place.
You can go three places when you go there. Zoo, plants and museum.
But not now because of covid 19.
There are a lot if benches.
You can use them conveniently.<br><br><b>Author: </b>Strolls Paris; <br><b>Rating: </b>5<br><b>When: </b>3 months ago<br>Great place to make a pause and enjoy sitting under a tree. Fun for kids and adults as there is a small zoo as well as the National natural history museum.<br><br><b>Author: </b>Daniela Telehuz; <br><b>Rating: </b>5<br><b>When: </b>a month ago<br>Such a lovely place, it has a greenhouse and a small botanical section with didactical pictures and information. There are also some cherry trees that are absolutely amazing in spring<br><br><b>Author: </b>Jack SIMON; <br><b>Rating: </b>5<br><b>When: </b>3 months ago<br>Strolling in the Jardin des Plantes is a Must and Admiring the Beauty of Historical buildings Massive Buildings is a Good way to start the day. I love the part of the Cedar's and to clmb to the top of the hill<br><br><b>Author: </b>Nicolas Oliveros; <br><b>Rating: </b>5<br><b>When: </b>7 months ago<br>A very precious place in Paris. A bit of Kew gardens (the green houses), a bit of the Physics garden, a bit of Regent park (the little zoo), a bit of the museum of natural history museum, and a nice park experience.<br><br>",PRK
5,Place des Vosges,http://www.parisinfo.com/transports/73189/Place-des-Vosges,,2.3655266,48.85561140000001,4.6,18236,"[]<b>Author: </b>Deppie Dam; <br><b>Rating: </b>5<br><b>When: </b>8 months ago<br>Special place. Victor Hugo's house is located there.<br><br><b>Author: </b>Laura Ponzoni; <br><b>Rating: </b>5<br><b>When: </b>in the last week<br>Most beautiful place in Paris. Houses date back from 1600, the garden with fountains is wonderful and you can sit on the grass.
Under the arcades there are many art galleries.
Renzo Piano lives here when in Paris.<br><br><b>Author: </b>valentino dardengo; <br><b>Rating: </b>4<br><b>When: </b>5 months ago<br>A little park where you can enjoy the rares sunny days.
No matter if it is for the workout or for a book, this park is ''cozy'' and the area around the park is absolutely nice.<br><br><b>Author: </b>Léo Liénard; <br><b>Rating: </b>4<br><b>When: </b>in the last week<br>Nice spot. Somewhat crowdy for a strolling area. I also like the buildings that surround the plaza, they kind of brand the place in their own right.<br><br><b>Author: </b>Chantelle Y; <br><b>Rating: </b>3<br><b>When: </b>8 months ago<br>There are nicer parks in Paris, but it's okay.<br><br>",PRK
18,Square Jean XXIII,,+33 1 44 54 75 04,2.350971,48.8525736,4.5,15699,[]<b>Author: </b>Honey Dominguez; <br><b>Rating: </b>4<br><b>When: </b>9 months ago<br>Regret didn't had a chance to see inside. It's crazy looong lines<br><br><b>Author: </b>Pete Kay; <br><b>Rating: </b>5<br><b>When: </b>2 months ago<br>Notre dame is absolutely beautiful I was fortunate enough to visit this wonderful building before it had the fire such a really sad thing to hear about such a very beautiful and exciting place<br><br><b>Author: </b>Saumya Bhargava; <br><b>Rating: </b>3<br><b>When: </b>a year ago<br>This is so pretty. It was like one of those structures coming out of the books I have read. I was in awe. Totally took so many pictures.<br><br><b>Author: </b>good juju; <br><b>Rating: </b>5<br><b>When: </b>a month ago<br>The square is closed due to the reconstruction work on Notre Dame Cathedral.<br><br><b>Author: </b>Rowan Hunter; <br><b>Rating: </b>5<br><b>When: </b>5 months ago<br>Once was a beautiful addition to this city<br><br>,PRK
8,Square of Saint-Jacques Tower,https://www.paris.fr/equipements/square-de-la-tour-saint-jacques-33,+33 1 42 72 64 01,2.349140500000001,48.85769550000001,4.3,3011,"[]<b>Author: </b>Nean Derthall; <br><b>Rating: </b>3<br><b>When: </b>8 months ago<br>... purpose? you can't go under it<br><br><b>Author: </b>Ika d'Amonds; <br><b>Rating: </b>5<br><b>When: </b>2 months ago<br>Nice garden, with Narcissus and Pansies. A lot of sitting spots too.
Didn't get to see the actual tower though.<br><br><b>Author: </b>Alice; <br><b>Rating: </b>5<br><b>When: </b>2 months ago<br>Such a nice, cozy park in the middle of Paris. The tower is so nice in his gothic style<br><br><b>Author: </b>Zdeněk Novák; <br><b>Rating: </b>5<br><b>When: </b>in the last week<br>Nice supermarket. Wide selection of products.<br><br><b>Author: </b>Aurélien André; <br><b>Rating: </b>5<br><b>When: </b>9 months ago<br>This is the place you want to relax when having a day in Le Marais ! The trees give you shade, the grass is perfect to sit on, and there are a number of benches. A lovely square, especially in a super busy and polluted city such as Paris !<br><br>",PRK
10,Square du Temple - Elie Wiesel,https://www.parisinfo.com/musee-monument-paris/71331/Square-du-Temple-Elie-Wiesel,,2.3608011,48.8644895,4.3,2318,"[]<b>Author: </b>Tim S; <br><b>Rating: </b>5<br><b>When: </b>2 months ago<br>It gets extremely busy on sunny days but has a fantastic play equipment for kids and some ugly but cool looking ducks the kids will enjoy seeing.<br><br><b>Author: </b>Marc Roos; <br><b>Rating: </b>5<br><b>When: </b>2 months ago<br>Trees, ducks, sun and greenery. A true oasis in the city. Kiddy playground, table tennis, early in the morning is the Tai Chi group. Sit and eat your lunch, or just breathe for a few minutes.<br><br><b>Author: </b>Nitin Malla; <br><b>Rating: </b>5<br><b>When: </b>6 months ago<br>I love getting a sandwich and eating it in this park. There is plenty of benches and it's fun watching people enjoy activities here like table tennis<br><br><b>Author: </b>ellec apaga; <br><b>Rating: </b>5<br><b>When: </b>2 months ago<br>my kids just love the pond abd the duck<br><br><b>Author: </b>Redouane El Honsali; <br><b>Rating: </b>4<br><b>When: </b>2 months ago<br>Nice cosy park. It's small though and can be overcrowded when it's sunny.<br><br>",PRK
11,Square René Viviani,https://www.paris.fr/equipements/square-rene-viviani-2441,,2.3478242,48.8522208,4.4,1851,"[]<b>Author: </b>Simon Nobes; <br><b>Rating: </b>5<br><b>When: </b>a month ago<br>Huge underground car park within walking distance of Notre Dame. The charges are very reasonable. Exit barriers accept cards for payment - there are no signs to inform new users!<br><br><b>Author: </b>guillot jeanpierre; <br><b>Rating: </b>5<br><b>When: </b>in the last week<br>A pleasant flowery place for a rest and a view over Notre Dame<br><br><b>Author: </b>Strolls Paris; <br><b>Rating: </b>5<br><b>When: </b>2 months ago<br>Lovely little square just steps away from the Cathedral of Notre-Dame. Most of the year the flowers decorate the place, our favorite are the roses that have an exquisite parfum! Perfect place to make a break and rest under a tree. The oldest tree of the city is here and a pretty old church as well, don't miss the misterious hidden water well and Saint Julien le Pauvre's fountain in the center.<br><br><b>Author: </b>DAnica Mracevic Jurisic; <br><b>Rating: </b>5<br><b>When: </b>3 months ago<br>Really nice and right in from of Shakespeare&co, on the one side and Notre Dame on other...<br><br><b>Author: </b>Francesco Pisanu; <br><b>Rating: </b>4<br><b>When: </b>3 weeks ago<br>Nice place, not always quite<br><br>",PRK
56,Fontaine des Innocents,https://www.parisinfo.com/transports/73158/Fontaine-des-Innocents,,2.348032700000001,48.860647,4.1,1372,"[]<b>Author: </b>Gahee Filet; <br><b>Rating: </b>4<br><b>When: </b>a month ago<br>A nice spot to sit while grabbing a quick lunch. It's extra nice because there is a homeless man who help you fight off the hungry pigeons herding and stalking you for the next crumb you drop.<br><br><b>Author: </b>FasTer FasTer; <br><b>Rating: </b>3<br><b>When: </b>5 months ago<br>Beautiful monument. But fully with drunky people<br><br><b>Author: </b>Dunhill An; <br><b>Rating: </b>4<br><b>When: </b>4 months ago<br>Good place to sit on for a while<br><br><b>Author: </b>David Frew; <br><b>Rating: </b>4<br><b>When: </b>a year ago<br>Sadly there was no water in the fountain, so it lost a lot of the potential appeal.  A nice little square with very limited traffic (although motorcycles seem to think they can cut across the pavements.)
It has a few bars/bistros which really benefit from the limited traffic so they are quiet and you can people-watch without the constant noise of car horns which is my abiding memory of Paris.<br><br><b>Author: </b>SW L; <br><b>Rating: </b>3<br><b>When: </b>11 months ago<br>The place is becoming livelier as the deconfinement happens.<br><br>",PRK
9,Fontaine du Châtelet,,,2.3472993,48.85749759999999,4.2,970,"[]<b>Author: </b>Alex Sierra; <br><b>Rating: </b>5<br><b>When: </b>8 months ago<br>Nice fountain! If you are in the area you should visit!<br><br><b>Author: </b>Minod dilakshan; <br><b>Rating: </b>5<br><b>When: </b>a month ago<br>👍<br><br><b>Author: </b>Mahmoud Turki; <br><b>Rating: </b>5<br><b>When: </b>3 months ago<br>nice golden statue<br><br><b>Author: </b>Grant Goldman; <br><b>Rating: </b>5<br><b>When: </b>a year ago<br>Attractive city park with big fountain<br><br><b>Author: </b>Moutaz Elkaissi; <br><b>Rating: </b>3<br><b>When: </b>2 years ago<br>Not maintained well, beautiful though. Not running no water when we visited. There were pictures and flowers of someone that passed there so not sure what that is about<br><br>",PRK
41,Square du Vert-Galant,https://www.parisinfo.com/musee-monument-paris/71519/Square-du-Vert-Galant,,2.3402998,48.8573719,4.4,875,"[]<b>Author: </b>Olivier Brunelat; <br><b>Rating: </b>5<br><b>When: </b>a week ago<br>Very quiet, so cute, in the center of Paris. It's very surprising<br><br><b>Author: </b>David de Marcos Ortega; <br><b>Rating: </b>4<br><b>When: </b>2 months ago<br>If there's a place in Paris, near the river, which form remains a ship, is this one.
Very very beautiful everything, and nearby the most famous cathedral of France.<br><br><b>Author: </b>Keet; <br><b>Rating: </b>5<br><b>When: </b>2 months ago<br>Beautiful spot to take a break and relax in the sun<br><br><b>Author: </b>Lisa; <br><b>Rating: </b>5<br><b>When: </b>4 months ago<br>Beautiful little park!!😊 I went here in autumn and tree was changing colors. Calm and nice place.<br><br><b>Author: </b>Kemal DİNÇ; <br><b>Rating: </b>5<br><b>When: </b>2 months ago<br>Perfect to get away from city in the center of the city.<br><br>",PRK
31,Jardin Catherine-Labouré,https://www.paris.fr/equipements/jardin-catherine-laboure-2465,+33 1 49 52 42 63,2.3205957,48.851091,4.6,804,"[]<b>Author: </b>Jean-Mathieu Saponaro; <br><b>Rating: </b>4<br><b>When: </b>8 months ago<br>Pretty small park<br><br><b>Author: </b>Vince Maret; <br><b>Rating: </b>5<br><b>When: </b>a week ago<br>A great and secluded garden just off the back of the French Prime Minister's residence. Carefully pruned beautiful flowers<br><br><b>Author: </b>Philippe Elia; <br><b>Rating: </b>5<br><b>When: </b>2 months ago<br>A small yet cosy garden next to notre dame du bac church<br><br><b>Author: </b>Andrew Graydon; <br><b>Rating: </b>5<br><b>When: </b>a year ago<br>Walking down a back street we saw a sign and a gate in the wall. Entering this oasis in the middle of the city was amazing.

I realise that it's not on many lists but I would recommend any intrepid walker to take a water bottle (with pastis) a sandwich and a book.

In the centre of the city, it's a great place to unwind for an hour in between sites.<br><br><b>Author: </b>P S; <br><b>Rating: </b>5<br><b>When: </b>a year ago<br>One of the most beautiful gardens in Paris. Subtle, peaceful, sublime.<br><br>",PRK
35,Anne-Frank Garden,,+33 1 53 01 75 03,2.3550044,48.8615969,4.4,679,"[]<b>Author: </b>Dora Bobanovic; <br><b>Rating: </b>5<br><b>When: </b>6 months ago<br>This is definitely a new favourite spot. Hidden place in le Marais and its a great spot to sit to eat your lunch. When I went, there wasn't that many people which is nice because it was a nice way to escape from the crowds. Would definitely recommend as a spot to go for a break<br><br><b>Author: </b>Kemal DİNÇ; <br><b>Rating: </b>5<br><b>When: </b>2 months ago<br>A great park to never forget Anne Frank. Rest in peace...<br><br><b>Author: </b>Reetesh Sharma; <br><b>Rating: </b>5<br><b>When: </b>2 months ago<br>Cute little Park in the middle of central Paris!<br><br><b>Author: </b>Carlos “Made” Pardo; <br><b>Rating: </b>5<br><b>When: </b>8 months ago<br>Great hidden spot, full of locals and kids.<br><br><b>Author: </b>Josh Silverstein; <br><b>Rating: </b>5<br><b>When: </b>a year ago<br>Really beautiful garden and playground, a tranquil spot relatively hidden in a very busy part of Paris<br><br>",PRK
28,Tino Rossi Garden,https://www.paris.fr/equipements/jardin-tino-rossi-1786,,2.3606886,48.8475663,4.4,676,"[]<b>Author: </b>Rayan Bitar; <br><b>Rating: </b>3<br><b>When: </b>10 months ago<br>Great view of the seine from an open air spot, a great place full of life but it's not safe late night on Saturdays.<br><br><b>Author: </b>Victor Charle Pedro; <br><b>Rating: </b>5<br><b>When: </b>11 months ago<br>It’s nice to be with a beautiful view of the Seine. A friendly environment. Suitable for a pic nic with friends<br><br><b>Author: </b>alex GOON; <br><b>Rating: </b>5<br><b>When: </b>2 months ago<br>Better than sitting at a café<br><br><b>Author: </b>damarys castillo; <br><b>Rating: </b>5<br><b>When: </b>10 months ago<br>Cool place to dance tango, salsa, merengue and reggaeton, next to the seine ! Best urban mood you'll get in a fancy city like this Paris !<br><br><b>Author: </b>Kashif Khan; <br><b>Rating: </b>5<br><b>When: </b>9 months ago<br>Family park  & Amazing environment there<br><br>",PRK
30,Jardin des Grands Explorateurs,,,2.3368324,48.8418443,4.5,651,"[]<b>Author: </b>Morgan Walesh; <br><b>Rating: </b>5<br><b>When: </b>7 months ago<br>Forget about the nearby Luxembourg gardens, this park is the best! Two different children's play areas, three ping pong tables, and an outdoor gym. There are also free toilets (if you are feeling courageous) and lots of grassy spots to picnic or sit down, unlike at the more uptight Luxembourg gardens.<br><br><b>Author: </b>Fatin Al; <br><b>Rating: </b>5<br><b>When: </b>2 months ago<br>Beautiful area, I loved the fountain, it can be very refreshing when the weather is too hot!<br><br><b>Author: </b>faucon pluton; <br><b>Rating: </b>5<br><b>When: </b>a year ago<br>Beautiful garden where you'll find the place to play ping pong or any outdoor game. It has a place for children. Overall a good place for everyone, from those who like mild peace to those who want to play with friends<br><br><b>Author: </b>Ronaldo Emerick; <br><b>Rating: </b>4<br><b>When: </b>a year ago<br>Really nice, it's a pity I was here during a time leaves are dead<br><br><b>Author: </b>Kalliopi; <br><b>Rating: </b>5<br><b>When: </b>a year ago<br>What a great place to visit! Paris atmosphere..<br><br>",PRK
21,Rech à la Maison de l'Amérique latine,https://www.restaurant-rech.fr/,+33 1 49 54 75 10,2.3236947,48.8574028,4.4,645,"[]<b>Author: </b>Suzanne Frey; <br><b>Rating: </b>5<br><b>When: </b>a year ago<br>Lovely spot for a serene/professional group event in the best neighborhood in Paris. Service was outstanding despite very tight quarters. I'd personally prefer a bit of A/C in the summer indoors, but c'est la vie ...<br><br><b>Author: </b>Charlie P.; <br><b>Rating: </b>4<br><b>When: </b>2 years ago<br>Nice institute. Also has a very good looking / average food restaurant inside. Not bad at all.<br><br><b>Author: </b>Rees John; <br><b>Rating: </b>4<br><b>When: </b>2 years ago<br>Great location and building.  The garden is fantastic<br><br><b>Author: </b>Sophie Tordjman; <br><b>Rating: </b>5<br><b>When: </b>2 years ago<br>Great food, great atmosphere, great place and great service!<br><br><b>Author: </b>Rajiv Sikka; <br><b>Rating: </b>5<br><b>When: </b>2 years ago<br>Nice food and good service. Lovely ambience.<br><br>",PRK
38,Garden of the botanical school,http://www.jardindesplantesdeparis.fr/fr/programme/galeries-jardins-zoo-bibliotheques/jardin-plantes-2762#section-3,+33 1 40 79 56 01,2.359385499999999,48.8434937,4.6,611,"[]<b>Author: </b>Rudolph; <br><b>Rating: </b>4<br><b>When: </b>a month ago<br>Particularly nice when flowers are in bloom...decent place to stroll or jog...dusty gravel on most paths though...small zoo, tropical greenhouses, natural history museum, library, and restaurant on the grounds as well.<br><br><b>Author: </b>Matt Carlson; <br><b>Rating: </b>5<br><b>When: </b>11 months ago<br>Great place to enjoy lots and lots of different plants. A few scarce English signs but mostly French.  No grass for picnicking but lots of benches.  Fun to see plants from all over the world.<br><br><b>Author: </b>Foteini Paschalidou; <br><b>Rating: </b>5<br><b>When: </b>a year ago<br>its a very nice spot for some rest in the madness of the big city. every season there is different plants and flowers, its so nice for a small bite and in general for a stroll. Natural history museum is next door and worth a visit too<br><br><b>Author: </b>Kristen Potter; <br><b>Rating: </b>5<br><b>When: </b>a year ago<br>Beautiful place. Takes walk or a run, or just sit in the peaceful places, but do go!<br><br><b>Author: </b>SHAH KANAN CHOWDHURY; <br><b>Rating: </b>5<br><b>When: </b>2 months ago<br>Beautiful.<br><br>",PRK
19,Rosiers – Joseph Migneret Garden,,,2.360175,48.8573694,4.5,586,"[]<b>Author: </b>Kemal DİNÇ; <br><b>Rating: </b>3<br><b>When: </b>2 months ago<br>Very easy to miss the entrance. It's a nice park but I believe it's way too much surrounded by buildings. It's okay. Therefore 3 stars.<br><br><b>Author: </b>Elies Lucio; <br><b>Rating: </b>5<br><b>When: </b>2 months ago<br>Perfect place to eat a falafel<br><br><b>Author: </b>Apoorv Swarup; <br><b>Rating: </b>5<br><b>When: </b>11 months ago<br>Found this hidden gem close to my place through an FT article. Will be my go-to place to sit down and eat falafel from now!!<br><br><b>Author: </b>V H; <br><b>Rating: </b>5<br><b>When: </b>a year ago<br>Great little park. Feel a bit silly even reviewing it because it’s very rarely got more than half a dozen people in it, when the street outside is packed with tourists milling around and stuffing falafels down their gullets.  Incredibly peaceful spot and very, very easy to miss the entrance. Twice. Even with the address in Google Maps. Maybe it should just stay hidden.<br><br><b>Author: </b>Matteo Veleno; <br><b>Rating: </b>5<br><b>When: </b>a year ago<br>Beautiful hidden garden, a real gem if you manage to find it. It’s tucked away in between buildings but once you discover it you will love the peace & quiet, away from the bustling surroundings of shops, tourists. It’s worth a visit if you have some extra time in Paris and if you like to go off the beaten track a little.<br><br>",PRK
6,Zadkine Museum,http://www.zadkine.paris.fr/,+33 1 55 42 77 20,2.3340055,48.8430863,4.3,467,"[]<b>Author: </b>Wanda Needleman; <br><b>Rating: </b>5<br><b>When: </b>a year ago<br>Charming small museum ... Excellent exhibit<br><br><b>Author: </b>michael krass; <br><b>Rating: </b>1<br><b>When: </b>a year ago<br>a lousy experience. cranky mean uncaring staff, no no sense of the artist who worked there, the atmosphere gone. not recommended.<br><br><b>Author: </b>Gaston Assayas; <br><b>Rating: </b>5<br><b>When: </b>a year ago<br>I did love this museum, didn't knew the artist before, it was great!<br><br><b>Author: </b>Paz Prem; <br><b>Rating: </b>5<br><b>When: </b>a year ago<br>A beautiful collection of unique sculptures by the modernist Zadkine set within his former studio and around a lovely, tranquil courtyard. Well worth visiting and often free entry.<br><br><b>Author: </b>e m; <br><b>Rating: </b>5<br><b>When: </b>a year ago<br>wonderful little museum of sculptures and paintings themed on the forest.<br><br>",PRK
