,Unnamed: 0,Unnamed: 0.1,lugares,LAT_google,LON_google,labels,Quotes,Position,cluster_label,Quotes_total,day
3,149.0,466.0,St. Peter’s Basilica,41.9021667,12.4539367,LIB,"<b>674</b><br> 
Only a hundred yards away, inside the thick walls of StPeter’s Basilica, the world was serene<br><b>550</b><br>The springtime sun was setting behind StPeter’s Basilica, and a massive shadow spread, engulfing the piazza<br><b>585</b><br>We must rememb 
u 
er that the cardinals spent m ch of today in the
Vatican museums and StPeter’s Basilica, enjo 
reas without the crowds<br><b>980</b><br> 
The camerlegno staggered now through the dark 
e 
ness of StPeter’s Basilica<br><b>912</b><br>alighting like a silent angel on the deserted lawns, his black parachute shrouded from the madness by the towering shadow of StPeter’s Basilica<br><b>844</b><br> 
With a final joyous exultation, the camerlegno turned and dashed back into StPeter’s Basilica<br><b>911</b><br>Is this really happening?
Camerlegno Carlo Ventresca stood on the rooftop terrace of StPeter’s Basilica and looked down over the m 
ople stari 
ultitudes of pe 
ng up at him<br><b>149</b><br>Like a mountain parting the morning fog, the colossal dome rose out of the haze before them: StPeter’s Basilica<br><b>183</b><br> 
The Office of the Swiss Guard is housed adjacent to Il Corpo di Vigilanza, directly northeast of StPeter’s Basilica<br><b>179</b><br> 
After parking the cart on the wide lawn directly behind StPeter’s Basilica, the guard escorted Langdon and Vittoria up a stone escarpment to a ma 
k of the
rble plaza off the bac 
basilica<br><b>170</b><br> 35
T he Vatican’s helipad, for reasons of safety and noise control, is located in the northwest tip of Vatican City, as far from StPeter’s Basilica as possible<br><b>897</b><br>Everyone was pointing behind him 
toward the front of StPeter’s Basilica<br><b>637</b><br> 83
F lashlights were no match for the voluminous blackness of StPeter’s Basilica<br><b>1015</b><br>And had he not ascended miraculously into a pillar of fire, he would now be buried in the Vatican Grottoes along with the other Popes<br><b>513</b><br>StPeter’s Basilica<br><b>662</b><br> 
Thirty second 
, Vittoria was standing before a corpse when
s later, in the Vatican Grottoes 
the electronic squawk of a walkie-talkie broke the silence<br><b>581</b><br>However,ter assessing the situation, I am confident the antimatter canister is located in one of our white zones-those Vatican sectors accessible to public tours-the museums and StPeter’s Basilica, for example<br><b>851</b><br>On this very location, Langdon realized-Vatican Hill-Peter had been crucified and buried<br><b>879</b><br> 121
T he camerlegno erupted through the doors of StPeter’s Basilica at exactly 11:56 P<br><b>657</b><br> 85
T he Holy Vatican Grottoes are located beneath the main floor of StPeter’s Basilica<br><b>845</b><br> 
The main aisle of StPeter’s Basilica, Lieutenant Chartrand had once figured out, was longer than an Olympic soccer field<br><b>995</b><br> 
Deep in the Vatican Grottoes 
s<br><b>835</b><br>when Langdon stepped with the others from StPeter’s Basilica<br><b>656</b><br> 85
T he Holy Vatican Grottoes are located beneath the main floor of St",149.0,0.0,"<b>149</b><br>Like a mountain parting the morning fog, the colossal dome rose out of the haze before them: StPeter’s Basilica",1
4,156.0,487.0,St. Peter’s Square,41.9022225,12.456728300000002,LIB,"<b>805</b><br>To her shock, much of StPeter’s Square was still packed with people! The Swiss Guard had apparently been able to clear only
rea
about a hundred and fifty feet back-the a 
directly in front of the basilica-less than one-third of the square<br><b>833</b><br>Pe 
ter’s Square<br><b>156</b><br>She motioned frantically
downward toward StPeter’s Square directly beneath them<br><b>538</b><br>“I wasn’t thinking in those terms! That tile you’re talking about in StPeter’s Square is called the West Ponente -the i 
West W nd<br><b>523</b><br>The path intersected the Margherita Bridge, Via Cola di Riezo, and passed through Piazza del Risorgimento, hitting no churches at all until it dead-ended abruptly at the center of StPeter’s Square<br><b>840</b><br> 117
R obert Langdon had little doubt that the chaos and hysteria coursing through StPeter’s Square at this very instant exceeded anything Vatican Hill had ever witnessed<br><b>993</b><br> 
An early rainstorm had washed the crowds from StPeter’s Square<br><b>549</b><br>As Langdon looked out at the wide-open spaces of StPeter’s Square, a familiar question nagged<br><b>536</b><br>I know every corner of StPeter’s Square<br><b>219</b><br>With a commanding
view of StPeter’s Square,
the palace houses both the Papal Apartments and the Office of the Pope<br><b>586</b><br> 
The soldier pointed to StPeter’s Square<br><b>555</b><br> 
Somewhere around the obelisk, boldly positioned outside the largest church in the world, was the second altar of science-Bernini’s West Ponente -an elliptical block in StPeter’s Square<br><b>896</b><br> 
The silence of StPeter’s Square broke with a ripple at first<br><b>1003</b><br> 
Far below, in StPeter’s Square, reporter Gunther Glick watched in reflective silence<br><b>265</b><br> 43
L angdon stood m nless at the Pope’s bulle 
otio 
tproof window and gazed down at the
bustle of media trailers in StPeter’s Square<br><b>799</b><br>.”109
M
of S 
eanwhile, in StPeter’s Square, the wall
wiss Guards yelled orders and fanned
outward, trying to push the crowds back to a safer distance<br><b>990</b><br> 
They were singing in StPeter’s Square <br><b>575</b><br> 
Robert Langdon stood nearby staring out at StPeter’s Square<br><b>1021</b><br>He and Vittoria had talked about it last night as they stole away from StPeter’s Square<br><b>566</b><br> 
Her video came 
nchor as sh 
ra felt like an a 
e lumbered across StPeter’s Square, pushing
through the gathering crowd<br><b>529</b><br>StPeter’s Square is in Vatican City",156.0,0.0,"<b>156</b><br>She motioned frantically
downward toward StPeter’s Square directly beneath them",1
5,174.0,105.0,Governatorato,41.90221409999999,12.451155900000002,LIB,"<b>174</b><br>The severe-looking Governatorato build d
ing was now behin 
them, housing Vatican City’s administration",174.0,0.0,"<b>174</b><br>The severe-looking Governatorato build d
ing was now behin 
them, housing Vatican City’s administration",1
6,176.0,1012.0,the Vatican Museum,41.9064878,12.4536413,LIB,"<b>176</b><br>And up ahead on the left, the massive rectangular edifice of the Vatican Museum",176.0,0.0,"<b>176</b><br>And up ahead on the left, the massive rectangular edifice of the Vatican Museum",1
8,220.0,956.0,the Papal Apartments,41.9035313,12.4561705,LIB,"<b>811</b><br>Rocher
year’s worth of cancer res 
led Kohler up a handicapped ramp on a circuitous route into the Apostolic Palace<br><b>1000</b><br>A fellow cardinal emerged from the Apostolic Palace and strode beside him<br><b>220</b><br>Peter’s Square,
the palace houses both the Papal Apartments and the Office of the Pope",220.0,0.0,"<b>220</b><br>Peter’s Square,
the palace houses both the Papal Apartments and the Office of the Pope",1
9,249.0,720.0,Vatican Bank,41.9038641,12.4567781,LIB,<b>249</b><br>then there is the gold bullion and the real estate deeds inside the Vatican Bank vaults,249.0,0.0,<b>249</b><br>then there is the gold bullion and the real estate deeds inside the Vatican Bank vaults,1
16,522.0,245.0,Piazza del Risorgimento,41.90633370000001,12.4580356,LIB,"<b>522</b><br>The path intersected the Margherita Bridge, Via Cola di Riezo, and passed through Piazza del Risorgimento, hitting no churches at all until it dead-ended abruptly at the center of St",522.0,0.0,"<b>522</b><br>The path intersected the Margherita Bridge, Via Cola di Riezo, and passed through Piazza del Risorgimento, hitting no churches at all until it dead-ended abruptly at the center of St",1
22,841.0,823.0,Vatican Hill,41.903611,12.450278,LIB,"<b>870</b><br>He was running up the original Vatican Hill! Langdon had heard Vatican scholars claim that St<br><b>841</b><br>Peter’s Square at this very instant exceeded anything Vatican Hill had ever witnessed<br><b>873</b><br>Peter’s tomb was near the topof Vatican Hill, and he had always wondered how they knew",841.0,0.0,<b>841</b><br>Peter’s Square at this very instant exceeded anything Vatican Hill had ever witnessed,1
25,,,"<a href=""http://www.alexanderplatzjazz.com/""target=""_blank""> Alexanderplatz Jazz Club </a><br><b>Rating: </b>4.3<br><b>Popularity: </b><br>312",41.909107,12.453644,CLUB,"[]<b>Author: </b>Divan Hattingh; <br><b>Rating: </b>5<br><b>When: </b>7 months ago<br>Beautiful place full of History. Good food great Jazz. (Making a booking is absolutely necessary)<br><br><b>Author: </b>Levent Parman; <br><b>Rating: </b>4<br><b>When: </b>10 months ago<br>Jazz is a music genre that originated in the African-American communities of New Orleans, United States, in the late 19th and early 20th centuries, with its roots in blues and ragtime. Since the 1920s Jazz Age, it has been recognized as a major form of musical expression in traditional and popular music, linked by the common bonds of African-American and European-American musical parentage. Jazz is characterized by swing and blue notes, call and response vocals, polyrhythms and improvisation. Jazz has roots in West African cultural and musical expression, and in African-American music traditions.As jazz spread around the world, it drew on national, regional, and local musical cultures, which gave rise to different styles. New Orleans jazz began in the early 1910s, combining earlier brass-band marches, French quadrilles, biguine, ragtime and blues with collective polyphonic improvisation.
In the 1930s, heavily arranged dance-oriented swing big bands, Kansas City jazz, a hard-swinging, bluesy, improvisational style and Gypsy jazz (a style that emphasized musette waltzes) were the prominent styles. Bebop emerged in the 1940s, shifting jazz from danceable popular music toward a more challenging ""musician's music"" which was played at faster tempos and used more chord-based improvisation. Cool jazz developed near the end of the 1940s, introducing calmer, smoother sounds and long, linear melodic lines.
The mid-1950s saw the emergence of hard bop, which introduced influences from rhythm and blues, gospel, and blues, especially in the saxophone and piano playing. Modal jazz developed in the late 1950s, using the mode, or musical scale, as the basis of musical structure and improvisation, as did free jazz, which explored playing without regular meter, beat and formal structures. Jazz-rock fusion appeared in the late 1960s and early 1970s, combining jazz improvisation with rock music's rhythms, electric instruments, and highly amplified stage sound. In the early 1980s, a commercial form of jazz fusion called smooth jazz became successful, garnering significant radio airplay. Other styles and genres abound in the 2000s, such as Latin and Afro-Cuban jazz.<br><br><b>Author: </b>Cary Ota; <br><b>Rating: </b>4<br><b>When: </b>a year ago<br>Good music, but be ready to pay for the rest.<br><br><b>Author: </b>Paul Painter; <br><b>Rating: </b>1<br><b>When: </b>a year ago<br>Jazz Club with no Jazz.  We came here tonight and paid €20 entrance each expecting a night of jazz and dinner.  Instead we got some kind of jazz performers talking on a microphone all night assumably about jazz.....but no jazz. We don't speak Italian....but that wasn't the point.  We had dinner that was very average....very salty and nothing special.  So we spent €114 for.... nothing.  If you are a jazz club and you are not going to play any music please warn people before they come!!<br><br><b>Author: </b>Giorgio Bruschini; <br><b>Rating: </b>5<br><b>When: </b>a year ago<br>If you are searching for some live jazz music, this is one of the most famous place in Roma for this purpose. You can find live music every night and listen to very good musicians here.<br><br>",,,,1
30,,,"<a href=""http://www.angelicodiciotto.it/""target=""_blank""> Angelico18 </a><br><b>Rating: </b>5.0<br><b>Popularity: </b><br>103",41.90519789999999,12.4591442,CLUB,"[]<b>Author: </b>harry alexander Boer; <br><b>Rating: </b>5<br><b>When: </b>a year ago<br>A friend of mine told me about this place and I went without any expectations. It’s like going back in time and having a drink in Chicago. Best music, best cocktails and a wonderful service.... good job guys, I will be back!<br><br><b>Author: </b>Bryant B; <br><b>Rating: </b>5<br><b>When: </b>a year ago<br>Definitely worth visiting while in Rome. Stopped by during vacation in Italy and found this spot. Loved the environment and drinks, good prices and quality. Definitely will return whenever I am in Rome again.<br><br><b>Author: </b>Martina Orlando; <br><b>Rating: </b>5<br><b>When: </b>a year ago<br>Loved our experience here. It’s a small intimate spot, the atmosphere and drinks were absolutely amazing and service was great. Bartenders were attentive and even made us drinks based on our personal preferences. Definitely a spot you want to visit at least once!<br><br><b>Author: </b>Catherine Hickinbotham; <br><b>Rating: </b>5<br><b>When: </b>2 years ago<br>This is an amazing speakeasy. It is so cute and quaint. The bartender, Alessandro, makes an amazing whiskey sour. It is a traditional yet unique Italian bar. I highly recommend to anyone traveling to meet locals and experience nightlife like a local. The owner open up just a few months ago and did a wonderful transforming this bar into something special.<br><br><b>Author: </b>Giuseppe Brindisi; <br><b>Rating: </b>5<br><b>When: </b>3 years ago<br>Must see!<br><br>",,,,1
32,,,"<a href=""http://www.museivaticani.va/content/museivaticani/it.html""target=""_blank""> Vatican Museums </a><br><b>Rating: </b>4.6<br><b>Popularity: </b><br>109209",41.9064878,12.4536413,MUSE,"[]<b>Author: </b>Claudia Andrea C; <br><b>Rating: </b>5<br><b>When: </b>9 months ago<br>A must! I would highly recommend to assign half a day to the museums, in order to see everything inside. It is really big and it could take a while to finish it. Take comfy shoes because you will walk a lot. Also don't forget your water.<br><br><b>Author: </b>James Blassingame; <br><b>Rating: </b>5<br><b>When: </b>8 months ago<br>If you find yourself in Rome, do what the Romans do.........check out The Vatican!!!  The earlier in the day that you can get there the better off you will be. This place gets PACKED!!!  Not really an issue right now, but when school is in session the school groups swamp the place, and that's not even mentioning regular tourist.  The setting is immaculate, absolutely beautiful.  One thing that I noticed, there was a legit military/law enforcement presence at the Vatican.  If someone is going there with the intention of breaking bad, I pray for their soul.  The armed guards aren't playing, and looked legit as any military operation I can think of.  The Sistine Chapel is a sight to behold, worth the churning herd of people to see it in person.  Don't pull your cameras out, they don't take too kindly to that either.  This isn't from personal experience, but I didn't see some people who encountered issues.<br><br><b>Author: </b>Angelos Odyseakis; <br><b>Rating: </b>5<br><b>When: </b>8 months ago<br>Amazing experience, but very crowded.<br><br><b>Author: </b>Aicha Ben; <br><b>Rating: </b>5<br><b>When: </b>in the last week<br>Just amazing! Everything is beautiful and they have everything!! From Painting, sculptures to tapestry... but the ceilings... oh the ceilings just beautiful you’ll spend 80% of your time looking up<br><br><b>Author: </b>Mrs Mrs; <br><b>Rating: </b>5<br><b>When: </b>7 months ago<br>A fantastic museum that is like a time capsule. There are displays that go back as far as Constantine, all the way up to the present day. We were lucky enough to have come on an evening tour and the museum was not crowded. Our tour guide was able to give fantastic insight into the pieces of art and relics on display. The artwork on the ceiling is amazing, it looks like 3D plaster but it's not it's actually all hand painted!<br><br>",,,,1
