,Unnamed: 0,Unnamed: 0.1,lugares,LAT_google,LON_google,labels,Quotes,Position,cluster_label,day,Quotes_total
10,390.0,246.0,Piazza della Rotunda,41.8992619,12.4768866,LIB,"<b>390</b><br>Cars
to Piazza della Rotunda, Via delgi Orfani, Piazza Sant’Ignacio, and Sant’Eustachio<br><b>408</b><br>.”
As they rounded the corner into Piazza della Rotunda, the Pantheon rose before them",390.0,1.0,2,"<b>390</b><br>Cars
to Piazza della Rotunda, Via delgi Orfani, Piazza Sant’Ignacio, and Sant’Eustachio"
11,391.0,383.0,Sant’Eustachio,41.8997351,12.4746038,LIB,"<b>391</b><br>Cars
to Piazza della Rotunda, Via delgi Orfani, Piazza Sant’Ignacio, and Sant’Eustachio",391.0,1.0,2,"<b>391</b><br>Cars
to Piazza della Rotunda, Via delgi Orfani, Piazza Sant’Ignacio, and Sant’Eustachio"
19,742.0,240.0,Piazza Navona,41.8991633,12.4730742,LIB,"<b>742</b><br> 
Dead center of Piazza Navona, outside the church of St",742.0,0.0,2,"<b>742</b><br> 
Dead center of Piazza Navona, outside the church of St"
23,,,"<a href=""https://www.turismoroma.it/it/node/1516""target=""_blank""> Piazza Navona </a><br><b>Rating: </b>4.7<br><b>Popularity: </b><br>120123",41.8991633,12.4730742,TOUR,"[]<b>Author: </b>Marcos Chavarria; <br><b>Rating: </b>5<br><b>When: </b>2 months ago<br>So beautiful, and so crowded sometimes. It is sometimes impossible to get a good picture in this plaza, but it is Rome, you need to enjoy the life that comes with it. Is a great place to have dinner and if you wait time enough you can take a very good night picture. Just be patience.<br><br><b>Author: </b>Creative Jay; <br><b>Rating: </b>5<br><b>When: </b>6 months ago<br>Incredible place. The massive church as you walk onto the plaza is amazing. Make sure you go inside and view it, words can not describe how stunning it is. Go day or night and enjoy this place. The only negative is the restaurants. Just avoid them if you can<br><br><b>Author: </b>Shelby Elkins; <br><b>Rating: </b>5<br><b>When: </b>2 weeks ago<br>Free to enter and walk around. Beautiful fountains, access to a nice church, and plenty of places to eat. A must visit site when you are in Rome! Highly recommend!<br><br><b>Author: </b>Bert Parham; <br><b>Rating: </b>5<br><b>When: </b>9 months ago<br>A fantastic place to go and people watch, enjoy pretty good food and ice cream. We visited several times as our hotel was in close proximity. Each time of day brings something different.<br><br><b>Author: </b>Kai; <br><b>Rating: </b>5<br><b>When: </b>a week ago<br>It was really calming and relaxing. Honestly I would love to go there again. The restaurants and coffee shops where top quality and the place was magnificent.<br><br>",,,2,
27,,,"<a href=""https://www.turismoroma.it/it/luoghi/campo-de%E2%80%99-fiori-e-piazza-farnese""target=""_blank""> Campo de' Fiori </a><br><b>Rating: </b>4.4<br><b>Popularity: </b><br>40676",41.8955904,12.4721829,TOUR,"[]<b>Author: </b>Wunderklumpen; <br><b>Rating: </b>4<br><b>When: </b>8 months ago<br>It is okay. But not worth to visit.<br><br><b>Author: </b>Marlene Münch Schuster; <br><b>Rating: </b>4<br><b>When: </b>8 months ago<br>As most piazzas, it is beautiful. And I like Giordano Bruno, although I have been told he was lacking charm<br><br><b>Author: </b>Deniz Hassan; <br><b>Rating: </b>5<br><b>When: </b>9 months ago<br>Splendid square comprised of four roughly equal sides. It houses several pleasant establishments for drink and food. The water fountain has excellent pressure and nice, cool water.<br><br><b>Author: </b>Vladimir Balaz; <br><b>Rating: </b>5<br><b>When: </b>3 months ago<br>The place is famous for final moments on Giordano Bruno. The place, however, also has its own atmosphere. It is lively, with many people, shops and cafes. And there are flower shops as well, of course.<br><br><b>Author: </b>Hiba Traifeh; <br><b>Rating: </b>3<br><b>When: </b>8 months ago<br>If u already have seen all the amazing places in Rome, u will notice that this is like a 2de degree place. Maybe because when i arrived there the market was just ended en it was dirty.<br><br>",,,2,
30,,,"<a href=""http://www.060608.it/it/cultura-e-svago/beni-culturali/beni-architettonici-e-storici/fontana-dei-fiumi.html""target=""_blank""> Fiumi Fountain </a><br><b>Rating: </b>4.8<br><b>Popularity: </b><br>4572",41.8989673,12.4730872,TOUR,"[]<b>Author: </b>Marcos Chavarria; <br><b>Rating: </b>5<br><b>When: </b>2 months ago<br>All comments agree in one thing. This is a beautiful square, the 4 rivers fountain is a great sight. The details and the history behind it are just marvelous. You can have a coffee. Lunch or dinner at the surrounding restaurants, have a look at the daily life at the Piazza Navona is just delightful. Recommended for all parties<br><br><b>Author: </b>Shelby Elkins; <br><b>Rating: </b>5<br><b>When: </b>2 months ago<br>Always a pretty sight to see! Of course, Piazza Navona is free to visit. There are plenty of food options in the square and so much to see. The church is free to visit, and the three fountains are very nice. You can even talk to a psychic and learn your possible destiny!🤫<br><br><b>Author: </b>Mahammad Alizada; <br><b>Rating: </b>5<br><b>When: </b>8 months ago<br>Amazing<br><br><b>Author: </b>Hartmut P; <br><b>Rating: </b>5<br><b>When: </b>in the last week<br>Fountain made by the famous baroque artist Bernini , depicting the four great rivers of the World<br><br><b>Author: </b>Regan; <br><b>Rating: </b>5<br><b>When: </b>5 months ago<br>The coolest back story for a fountain ever! The figures on the fountain are all covering their faces to save their eyes from the sight of a rival Architects Building adjacent. Brilliant! Incredible sculpture also and set an an impressive square.<br><br>",,,2,
31,,,"<a href=""http://saintlouis-rome.net/""target=""_blank""> Church of St. Louis of the French </a><br><b>Rating: </b>4.8<br><b>Popularity: </b><br>4408",41.899581,12.4745405,TOUR,"[]<b>Author: </b>Father Kenny Ang; <br><b>Rating: </b>5<br><b>When: </b>7 months ago<br>This is one of my favorite churches in Rome, since I especially love Caravaggio and his works. Every time I come here, I almost always head directly to the Contarelli chapel just to delight in his three paintings of St. Matthew. My favorite one is the Calling of St. Matthew on the left-side wall of the chapel (which is the darker side of the wall, unfortunately). When I went there yesterday, some ladies already put some euros into the machine so the entire chapel was brightly illuminated. I was a lucky pilgrim and photographer!<br><br><b>Author: </b>Veranika Tsybulskaya; <br><b>Rating: </b>5<br><b>When: </b>8 months ago<br>Spectacular! Definitely worth to visit not only for a Caravaggio works, but for an ambience itself. Rich and spaced. Were lucky to end up there during the organ mass - truly recommend!<br><br><b>Author: </b>Iman Traveler; <br><b>Rating: </b>5<br><b>When: </b>3 months ago<br>3 Caravaggio paintings!!! What could you expect more?

Short explain:
is a Roman Catholic church in Rome, not far from Piazza Navona. The church is dedicated to the Virgin Mary, to St. Denis the Areopagite and St. Louis IX, king of France. The church was designed by Giacomo della Porta and built by Domenico Fontana between 1518 and 1589, and completed through the personal intervention of Catherine de' Medici, who donated to it some property in the area. It is the national church in Rome of France.<br><br><b>Author: </b>George; <br><b>Rating: </b>5<br><b>When: </b>8 months ago<br>The ceiling is covered in beautiful art. If you are in the area you must pop in for a look. It is free and marvelous.<br><br><b>Author: </b>Ron Nederpelt; <br><b>Rating: </b>5<br><b>When: </b>6 months ago<br>I Caravaggi. I CARAVAGGI! A day without seeing a painting by Caravaggio is a day not lived.<br><br>",,,2,
32,,,"<a href=""https://web.uniroma1.it/ortobotanico/""target=""_blank""> Orto Botanico di Roma </a><br><b>Rating: </b>4.4<br><b>Popularity: </b><br>3638",41.8923247,12.4628307,TOUR,"[]<b>Author: </b>tomas kochan; <br><b>Rating: </b>1<br><b>When: </b>8 months ago<br>Doesn't worth the money..8€ I could spend a lot better.<br><br><b>Author: </b>Vladimir Kostic; <br><b>Rating: </b>1<br><b>When: </b>8 months ago<br>Don't go here... 8eur ticket to see sad plants..many of them half dead... parts of the garden are literally a mess

there are many beautiful gardens in Rome that are better taken cared and more pleasant to spend time in... the only worthwhile place was a bench in bamboo section with a nice view (actually bamboo section was the only decent part)

All in all it was very sad experience for us<br><br><b>Author: </b>Alice Ho; <br><b>Rating: </b>2<br><b>When: </b>8 months ago<br>Maybe it's the time of the year. Not much plants nor flowers to see. Also not very well kept.<br><br><b>Author: </b>Dri Kool (thekoolitaly); <br><b>Rating: </b>5<br><b>When: </b>10 months ago<br>An absolute delight. During the summer can be an oasis to hide away from sun. Take a guided tour , highly recommended... although I'm not sure if their tours are only in Italian.<br><br><b>Author: </b>Kuala Bound; <br><b>Rating: </b>4<br><b>When: </b>10 months ago<br>The hill is a huge help to the beauty of the garden. I was impressed by the massive ancient platanus next to the eleven fountains steps. And i liked also the tropical greenhouse but i fear they should find a way to increase its roof not enough high. Fens valley looked a bit messy. The Samples garden can be risky so pay attention to bees.<br><br>",,,2,
34,,,"<a href=""http://www.romabeercompany.it/""target=""_blank""> Roma Beer Company - Campo de' Fiori </a><br><b>Rating: </b>4.0<br><b>Popularity: </b><br>264",41.8957931,12.4722989,CLUB,"[]<b>Author: </b>Balázs Krucsó; <br><b>Rating: </b>5<br><b>When: </b>8 months ago<br>We took a beer and a prosecco there. Both of them were absolutely delightful and also we chatted a lot with the algerian waitress, whos has a very unique life story on Campo de’ Fiori. Definitely recommend to get the place and drink a bit and talk with the employees. You will not regret it!<br><br><b>Author: </b>Rok Bergman; <br><b>Rating: </b>3<br><b>When: </b>10 months ago<br>Good food and good beer selecetion.<br><br><b>Author: </b>Mr JoneZ; <br><b>Rating: </b>5<br><b>When: </b>10 months ago<br>The food was very delicious and the waiters were very friendly. We recommend this place<br><br><b>Author: </b>Heloisa Lopes; <br><b>Rating: </b>2<br><b>When: </b>a year ago<br>We were attracted here during Happy Hour, I asked which beers were in Happy Hour, it was two. But they did not told us it was only 0,4L, so we asked 1L and it was not in Happy Hour, and we only discovered that while we were paying (they omitted the information, although I specifically asked which beers were included in Happy Hour). Besides that, they charged us for 2L of the beer that costs 14 euros, but we asked 1L of the 14 euros beer and 1L of the 12 euros beer. They subtracted the 2 euros, but complaining until the very end.<br><br><b>Author: </b>John Willemsen; <br><b>Rating: </b>4<br><b>When: </b>9 months ago<br>The aperitivo dish was okay, the beer not bad but also nothing special, the waiter (the Albanian one) was very friendly, charming and added nice vibes to our evening. If I went back, it would be because of him.<br><br>",,,2,
