,Unnamed: 0,Unnamed: 0.1,lugares,LAT_google,LON_google,labels,Quotes,Position,cluster_label,Quotes_total,day
2,34.0,767.0,Tuileries Gardens,48.8634916,2.3274943,LIB,"<b>37</b><br>Most tourists mistranslated Jardins des Tuileries as relating to the thousands of tulips that bloomed here, butTuilerieswas actually a literal reference to something far less romantic<br><b>34</b><br>The agent gunned the sedan across the junction and sped onto a wooded section of Rue Castiglione, which served as the northern entrance to the famed Tuileries Gardens – Paris’s own version of Central Park<br><b>295</b><br>  CHAPTER 32 The security alarm on the west end of the Denon Wing sent the pigeons in the nearby Tuileries Gardens scattering as Langdon and Sophie dashed out of the bulkhead into the Paris night<br><b>38</b><br>Langdon could now see the end of the Tuileries Gardens, marked by a giant stone archway",34.0,0.0,"<b>34</b><br>The agent gunned the sedan across the junction and sped onto a wooded section of Rue Castiglione, which served as the northern entrance to the famed Tuileries Gardens – Paris’s own version of Central Park",3
3,39.0,881.0,the Arc du Carrousel,48.86171299999999,2.3328946,LIB,"<b>39</b><br> Despite the orgiastic rituals once held at the Arc du Carrousel, art aficionados revered this place for another reason entirely",39.0,0.0,"<b>39</b><br> Despite the orgiastic rituals once held at the Arc du Carrousel, art aficionados revered this place for another reason entirely",3
5,43.0,375.0,Musée du Louvre,48.8606111,2.337644,LIB,"<b>174</b><br>Call me at the Louvre<br><b>68</b><br>Thirty yards ahead loomed the gateway to the Louvre’s most popular section –la Grande Galerie– a seemingly endless corridor that housed the Louvre’s most valuable Italian masterpieces<br><b>280</b><br>We’ve got a Louvre security officer on the gate<br><b>313</b><br>Disappointed, she knew he had not been expecting her and was probably working at the Louvre<br><b>271</b><br> Since taking up residence in the Louvre, theMona Lisa– orLa Jacondeas they call her in France – had been stolen twice, most recently in 1911, when she disappeared from the Louvre’s»satte impénétrable »– Le Salon Carre<br><b>175</b><br>Call me at the Louvre<br><b>595</b><br>She realized she was no closer than she had been at the Louvre to understanding what truth her grandfather had wanted to reveal to her<br><b>1096</b><br> I must go down there! Stepping out of the circle, he hurried across the courtyard back toward the towering pyramid entrance of the Louvre<br><b>47</b><br>Langdon had once walked the Louvre’s entire perimeter, an astonishing three-mile journey<br><b>223</b><br> For an instant, standing in the exit stairwell, Sophie forgot all about trying to leave the Louvre<br><b>270</b><br>  CHAPTER 26 Despite her monumental reputation, theMona Lisawas a mere thirty-one inches by twenty-one inches – smaller even than the posters of her sold in the Louvre gift shop<br><b>456</b><br>Furthermore, it perfectly explained why the scrambled numbers on the Louvre floor could be rearranged to form the famous progression<br><b>273</b><br> Since taking up residence in the Louvre, theMona Lisa– orLa Jacondeas they call her in France – had been stolen twice, most recently in 1911, when she disappeared from the Louvre’s»satte impénétrable »– Le Salon Carre<br><b>200</b><br>«You just escaped from the Louvre<br><b>452</b><br>«He left you only this key? Nothing else? No slip of paper?»Sophie knew she had been in a hurry inside the Louvre, but she was certain she had seen nothing else behindMadonna of the Rocks<br><b>658</b><br>«Did you send one to the curator of the Paris Louvre?»«What do you think? Your manuscript referenced his Louvre collection several times, his books are in your bibliography, and the guy has some serious clout for foreign sales<br><b>303</b><br> As they straightened out, Langdon turned in his seat, craning his neck to look out the rear window toward the Louvre<br><b>191</b><br>Although Paris fire codes required windows above fifteen meters in public buildings be breakable in case of fire, exiting a Louvre second-story window without the help of a hook and ladder would be suicide<br><b>70</b><br> «This area is still off limits to Louvre security,» Fache said<br><b>184</b><br> Here at the westernmost tip of the Denon Wing, the north-south thoroughfare of Place du Carrousel ran almost flush with the building with only a narrow sidewalk separating it from the Louvre’s outer wall<br><b>56</b><br>Built fifty-seven feet beneath ground level, the Louvre’s newly constructed 70, 000-square-foot lobby spread out like an endless grotto<br><b>196</b><br>The only vehicle on Pont du Carrousel was an enormous twin-bed Trailor delivery truck moving southward away from the Louvre<br><b>450</b><br>Inside the Louvre<br><b>201</b><br> Now, with the fire alarm silenced, Langdon could hear the sounds of DCPJ sirens tearing away from the Louvre<br><b>45</b><br>Shaped like an enormous horseshoe, the Louvre was the longest building in Europe, stretching farther than three Eiffel Towers laid end to end<br><b>222</b><br>There in the bowels of the Louvre… with images of PHI and Da Vinci swirling through his mind, Robert Langdon suddenly and unexpectedly deciphered Saunière’s code<br><b>65</b><br> Usually impeccably illuminated, the Louvre galleries were startlingly dark tonight<br><b>1095</b><br> Tremulous, Langdon walked to the edge and peered down into the Louvre’s sprawling underground complex, aglow with amber light<br><b>43</b><br> Musée du Louvre<br><b>547</b><br>It was the command post at the Louvre<br><b>89</b><br> Although the Grand Gallery housed the Louvre’s most famous Italian art, many visitors felt the wing’s most stunning offering was actually its famous parquet floor<br><b>214</b><br>I’m certain his message at the Louvre was his final effort to tell me something important, something he thought you could help me understand<br><b>57</b><br>Constructed in warm ocher marble to be compatible with the honey-colored stone of the Louvre facade above, the subterranean hall was usually vibrant with sunlight and tourists<br><b>54</b><br>Fache’s presence was anything but welcoming, and the Louvre itself had an almost sepulchral aura at this hour<br><b>48</b><br>The Louvre’s main entrance was visible now, rising boldly in the distance, encircled by seven triangular pools from which spouted illuminated fountains<br><b>118</b><br>.»Not far away, inside Saunière’s office, Lieutenant Collet had returned to the Louvre and was huddled over an audio console set up on the curator’s enormous desk<br><b>67</b><br>Thirty yards ahead loomed the gateway to the Louvre’s most popular section –la Grande Galerie– a seemingly endless corridor that housed the Louvre’s most valuable Italian masterpieces<br><b>442</b><br>A video camera overhead was aimed directly at them, and Langdon had the feeling that this camera, unlike those at the Louvre, was authentic<br><b>328</b><br>.»Langdon wondered again if he might have been better off taking his chances letting Fache arrest him at the Louvre<br><b>1094</b><br>There in the center, plunging into the earth like a crystal chasm, gaped the giant inverted pyramid of glass that he had seen a few nights ago when he entered the Louvre’s subterranean entresol<br><b>1004</b><br>In Saunière’s case, the curator had received a dinner invitation to Château Villette to discuss the possibility of Teabing’s funding a new Da Vinci Wing at the Louvre<br><b>189</b><br> « Alarme! »one of the agents yelled, eyeing his feed from the Louvre security center<br><b>455</b><br> 13-3-2-21-1-1-8-5 Grand-père wrote his account number on the Louvre floor! When Sophie had first seen the scrambled Fibonacci sequence on the parquet, she had assumed its sole purpose was to encourage DCPJ to call in their cryptographers and get Sophieinvolved<br><b>227</b><br> «Up ahead is the Salle des Etats,» her grandfather said as they approached the Louvre’s most famous room<br><b>290</b><br> The Louvre security agent advanced through the entrance to the Salle des Etats, his pistol outstretched, taking deadly aim at Langdon’s chest<br><b>66</b><br>With acres of galleries to watch over, the Louvre would require several hundred technicians simply to monitor the feeds<br><b>61</b><br>Not only did Saunière have a personal passion for relics relating to fertility, goddess cults, Wicca, and the sacred feminine, but during his twenty-year tenure as curator, Saunière had helped the Louvre amass the largest collection of goddess art on earth – labrys axes from the priestesses’ oldest Greek shrine in Delphi, gold caducei wands, hundreds of Tjetankhs resembling small standing angels, sistrum rattles used in ancient Egypt to dispel evil spirits, and an astonishing array of statues depicting Horus being nursed by the goddess Isis<br><b>300</b><br>The SmartCar engine whined in protest as Sophie urged it faster away from the Louvre<br><b>657</b><br>«Did you send one to the curator of the Paris Louvre?»«What do you think? Your manuscript referenced his Louvre collection several times, his books are in your bibliography, and the guy has some serious clout for foreign sales<br><b>49</b><br> The new entrance to the Paris Louvre had become almost as famous as the museum itself",43.0,0.0,<b>43</b><br> Musée du Louvre,3
9,181.0,370.0,Montmartre,48.8861929,2.3430895,LIB,"<b>366</b><br>Out the window to his right, he could see Montmartre and the beautiful dome of Sacré-Coeur<br><b>181</b><br>And to the right, high atop the sloping rise of Montmartre, the graceful arabesque dome of Sacré-Coeur, its polished stone glowing white like a resplendent sanctuary",181.0,0.0,"<b>181</b><br>And to the right, high atop the sloping rise of Montmartre, the graceful arabesque dome of Sacré-Coeur, its polished stone glowing white like a resplendent sanctuary",3
10,182.0,636.0,Sacré-Coeur,48.88670459999999,2.3431043,LIB,"<b>182</b><br>And to the right, high atop the sloping rise of Montmartre, the graceful arabesque dome of Sacré-Coeur, its polished stone glowing white like a resplendent sanctuary<br><b>367</b><br>Out the window to his right, he could see Montmartre and the beautiful dome of Sacré-Coeur",182.0,0.0,"<b>182</b><br>And to the right, high atop the sloping rise of Montmartre, the graceful arabesque dome of Sacré-Coeur, its polished stone glowing white like a resplendent sanctuary",3
11,197.0,508.0,Pont des Saints-Peres,48.8586063,2.3334474,LIB,"<b>197</b><br>«He’s turning right on Pont des Saints-Peres!»Sure enough, the Trailor truck that had crossed the bridge was slowing down and making a right turn onto Pont des Saints-Peres",197.0,0.0,"<b>197</b><br>«He’s turning right on Pont des Saints-Peres!»Sure enough, the Trailor truck that had crossed the bridge was slowing down and making a right turn onto Pont des Saints-Peres",3
14,297.0,47.0,Carrousel du Louvre,48.86275360000001,2.3348324000000003,LIB,"<b>297</b><br>He gripped the dash as the car shot out across a sidewalk and bounced back down over into the small rotary at Carrousel du Louvre<br><b>1091</b><br>Turning, he felt his feet again tracing the invisible path of the ancient Rose Line, carrying him across the courtyard to the Carrousel du Louvre – the enormous circle of grass surrounded by a perimeter of neatly trimmed hedges – once the site of Paris’s primeval nature-worshipping festivals… joyous rites to celebrate fertility and the Goddess<br><b>298</b><br> «No!» Langdon shouted, knowing the hedges around Carrousel du Louvre were there to hide the perilous chasm in the center –La Pyramide Inversée– the upside-down pyramid skylight he had seen earlier from inside the museum",297.0,0.0,<b>297</b><br>He gripped the dash as the car shot out across a sidewalk and bounced back down over into the small rotary at Carrousel du Louvre,3
16,362.0,171.0,Gare Saint-Lazare,48.8763009,2.3254025,LIB,"<b>362</b><br>  CHAPTER 35 The inside of Gare Saint-Lazare looked like every other train station in Europe, a gaping indoor- outdoor cavern dotted with the usual suspects – homeless men holding cardboard signs, collections of bleary-eyed college kids sleeping on backpacks and zoning out to their portable MP3 players, and clusters of blue-clad baggage porters smoking cigarettes",362.0,0.0,"<b>362</b><br>  CHAPTER 35 The inside of Gare Saint-Lazare looked like every other train station in Europe, a gaping indoor- outdoor cavern dotted with the usual suspects – homeless men holding cardboard signs, collections of bleary-eyed college kids sleeping on backpacks and zoning out to their portable MP3 players, and clusters of blue-clad baggage porters smoking cigarettes",3
20,461.0,688.0,St. Germain des Prés,48.85379810000001,2.3333285,LIB,<b>461</b><br> « This piece of shit? Bought it for twenty euro from a Taiwanese street vendor in StGermain des Prés,461.0,0.0,<b>461</b><br> « This piece of shit? Bought it for twenty euro from a Taiwanese street vendor in StGermain des Prés,3
23,1077.0,629.0,Rue des Petits Champs,48.866831,2.3365718,LIB,"<b>1077</b><br> Walking east on Rue des Petits Champs, Langdon felt a growing excitement",1077.0,0.0,"<b>1077</b><br> Walking east on Rue des Petits Champs, Langdon felt a growing excitement",3
24,1079.0,966.0,the Palais Royal,48.8637569,2.3371261000000003,LIB,"<b>1079</b><br>He turned south onto Rue Richelieu, where the air grew sweet with the scent of blossoming jasmine from the stately gardens of the Palais Royal",1079.0,0.0,"<b>1079</b><br>He turned south onto Rue Richelieu, where the air grew sweet with the scent of blossoming jasmine from the stately gardens of the Palais Royal",3
25,1081.0,890.0,the Comédie-Française,48.8635708,2.3359376,LIB,"<b>1081</b><br>As he cut across the corner of the Comédie-Française, another bronze medallion passed beneath his feet",1081.0,0.0,"<b>1081</b><br>As he cut across the corner of the Comédie-Française, another bronze medallion passed beneath his feet",3
27,,,"<a href=""https://www.louvre.fr/""target=""_blank""> Louvre Museum </a><br><b>Rating: </b>4.7<br><b>Popularity: </b><br>210845",48.8606111,2.337644,TOUR,"[]<b>Author: </b>Vic; <br><b>Rating: </b>5<br><b>When: </b>9 months ago<br>Absolutely in love with this place. It is huge so I would recommend spending a day or two if you really wanna go through everything. wasn’t too crowded overall except around the Mona Lisa where it was a stampede. There is something for everyone here, it ranges in different time periods and art forms. It surpasses anything we have in Canada in terms of an art museum.They have cute gift shops all around which is convenient. I came from Canada to visit and got the membership which I would recommend considering it was almost the same price as single admission and the line was shorter.p<br><br><b>Author: </b>Walt Bionik; <br><b>Rating: </b>5<br><b>When: </b>5 months ago<br>The best art museum in the world. The Mona Lisa may be on your bucket list, but please do yourself a favor and see the rest of the museum. There are many paintings that are breathtaking that do not get the attention because of the ""Photo Op"" paintings. Contrary to what I read, I did not have to wait in a long line. The Louvre is very easy to get to by Metro and easy to navigate. I'm American and it was my first time in Paris. I can't wait to visit again.<br><br><b>Author: </b>Priya Indian Vlogger in Germany; <br><b>Rating: </b>5<br><b>When: </b>8 months ago<br>There is no doubt that it is an absolute must visit for anyone who visits Paris. The place is the most beautiful museum of the whole world and houses a great deal of artworks, paintings and monuments. It is a  real gem with lots of very high-end artworks. The quality of all sculptures is way too high as you can easily see and feel it. Mona Lisa is also in this museum. I was simply amazed at each and every part of this museum as it was full of history and has lots of very fine artworks around. It is very well organized and maintained and worth every penny. I would recommend to must visit it if you are going to Paris.<br><br><b>Author: </b>Marinko Zubac; <br><b>Rating: </b>5<br><b>When: </b>9 months ago<br>The museum is amazing. We were the whole day in Louvre and still you have the impression that you could stay there forever. It's something you definitively should visit when in Paris.
Buy your tickets online so you don't have to wait in queues for the entrance.
The entrance to the museum is very simple. We waited for about 10 minutes to get through security. My suggestion is to get the Nintendo audio guide when visiting the Museum. It costs only 5 Eur and it helps a lot. The audio guide follows your location and helps to find around the museum. Its something like google maps for Louvre. When we were there Mona Lisa room was not too crowded so we had plenty of time to watch the painting. Do not search for souvenirs in the museum itself, you will have to go outside the museum in the direction of Metro station. There you will find the official Louvre Musem Shops.<br><br><b>Author: </b>Jenny Fall; <br><b>Rating: </b>5<br><b>When: </b>3 weeks ago<br>Visiting the Louvre is an amazing experience that will stay with you forever. There is so much history and beauty to absorb and admire. The building itself is exquisite along with the beautiful painted ceilings. Then, there is of course all of the art. Winged Victory, Venus Di Milo, and the Mona Lisa are just a few of the world's most famous works of art that are permanently on display at the Louvre.<br><br>",,,,3
29,,,"<a href=""https://www.parisinfo.com/musee-monument-paris/71304/Jardin-des-Tuileries""target=""_blank""> Tuileries Garden </a><br><b>Rating: </b>4.6<br><b>Popularity: </b><br>72225",48.8634916,2.327494299999999,TOUR,"[]<b>Author: </b>Joe N; <br><b>Rating: </b>5<br><b>When: </b>11 months ago<br>This place is gorgeous! Even though there aren't green leafy trees because of the season, it's still amazing to walk around and enjoy the scenery and marvel at all the buildings around the park. You can enjoy seeing family and tourists gathered and just enjoying the same space as you and make you just want to enjoy the moment even longer. It's a nice area to go for a run with the ground mostly heavy sand and not very rocky.<br><br><b>Author: </b>Luca Doria; <br><b>Rating: </b>2<br><b>When: </b>8 months ago<br>Impressive in the historical context and beautiful architecture that surrounds it but the swathes of grit and very little green make them quite soulless as many other gardens in central Paris. The great space occupied by grit and sand in hot days make you feel almost like you are in a desert. With impending climate change there should be more grass, bushes and somewhat a turn towards an English landscaped garden...it would be much better. I hope that Paris local authorities are gonna adapt these Gardens as overall they're not welcoming places.<br><br><b>Author: </b>Elena; <br><b>Rating: </b>4<br><b>When: </b>10 months ago<br>very beautiful! you can walk around, sit on one of the cute green chairs and watch. one of the water fountains, or relax in a nice café! beautiful roman statues you can see everywhere! sadly the floor is full of sand/dust and because it's a little windy the dust gets everywhere on your clothes and shoes...<br><br><b>Author: </b>Solyi H; <br><b>Rating: </b>5<br><b>When: </b>7 months ago<br>What a beautiful place.  The flower garden was exceptionally well designed taken cared of.  It’s lovely to go when there are very few people around.<br><br><b>Author: </b>Abigail Cai; <br><b>Rating: </b>5<br><b>When: </b>7 months ago<br>It’s my favorite vibe in Paris. I spent time sitting on the chair with my friends under the shade of the tree. There are always beautiful flowers there and the Ferris wheel.<br><br>",,,,3
30,,,"<a href=""https://www.musee-orsay.fr/""target=""_blank""> Musée d'Orsay </a><br><b>Rating: </b>4.7<br><b>Popularity: </b><br>53875",48.8599614,2.3265614,TOUR,"[]<b>Author: </b>igwinelove fujin421cellar; <br><b>Rating: </b>5<br><b>When: </b>a month ago<br>This is the greatest museum in the world. It’s so happy to live in Paris, as long as you have time, you can come and see it anytime. It’s very helpful for human beings. It’s very helpful for children. Born in Paris, you can come here every day when you have time.  In addition to food and wine, Chen Hao also has culture, art and healthy Paris. Happy Paris I love<br><br><b>Author: </b>Yrn Sbh Shll; <br><b>Rating: </b>5<br><b>When: </b>3 months ago<br>One of the best Museum. Display, atmosphere, the building, object are amazing. there is a locker room for free and it is so convenient to leave bags and walk around. taking picture was forbidden for many saloons. yet the memory of it good enough.<br><br><b>Author: </b>Fabio De Angelis; <br><b>Rating: </b>5<br><b>When: </b>2 months ago<br>Who am I to evaluate such a wonderful, astonishing museum, full of masterpieces of world culture? If you are in Paris, take your time to spend three, four hours, one day in this must-to-be-seen museum! Enjoy that time! ;)<br><br><b>Author: </b>Marcos Chavarria; <br><b>Rating: </b>4<br><b>When: </b>2 months ago<br>Great museum, great location. You could think it is a small museum, but the distribution and the amount of art pieces you will find are endless. You can spend 3 hrs here easily. I recommend it for youngs and adults. I would go back definitively.<br><br><b>Author: </b>Jessica Zug; <br><b>Rating: </b>5<br><b>When: </b>9 months ago<br>Beautiful museum if you're mainly interested in impressionism, expressionism and everything around and between that! Heaven on earth for Monet-lovers like me!<br><br>",,,,3
33,,,"<a href=""https://www.osullivans-pubs.com/pub-irlandais/grands-boulevards/""target=""_blank""> O'Sullivans Grands Boulevards </a><br><b>Rating: </b>3.8<br><b>Popularity: </b><br>2941",48.87136599999999,2.342792,CLUB,"[]<b>Author: </b>Joe; <br><b>Rating: </b>5<br><b>When: </b>9 months ago<br>Sick atmosphere<br><br><b>Author: </b>Safaa Norredine; <br><b>Rating: </b>2<br><b>When: </b>8 months ago<br>Nice chill bar when u donno where to go :)

The waiters there are extra nice btw :))<br><br><b>Author: </b>Lea; <br><b>Rating: </b>5<br><b>When: </b>a year ago<br>Really great place to go! The staff are so friendly and happy to help! The drinks are awesome and the food is great! Would definitely come back!<br><br><b>Author: </b>Terry Quinn; <br><b>Rating: </b>5<br><b>When: </b>a year ago<br>It was nice to go to a real Irish pub while visiting Paris. Jamison is not an easy drink to find but they had it! Food was good and the atmosphere was friendly. We watched the Women's Word cup game and we're not pressured in any way to leave. It was also great to have a person from Ireland to wait on us. (Sorry I don't remember his name)<br><br><b>Author: </b>A. OULDELALA; <br><b>Rating: </b>3<br><b>When: </b>a year ago<br>Nice place to gather, but too noisy though.<br><br>",,,,3
38,,,"<a href=""http://www.balrock.fr/""target=""_blank""> Bal Rock </a><br><b>Rating: </b>3.6<br><b>Popularity: </b><br>1040",48.87094739999999,2.3427048,CLUB,"[]<b>Author: </b>Amelie Charmant; <br><b>Rating: </b>5<br><b>When: </b>9 months ago<br>Comfortable places, friendly atmosthere<br><br><b>Author: </b>Brahim R; <br><b>Rating: </b>5<br><b>When: </b>a year ago<br>Best place in Paris to danse cuban salsa the Sunday<br><br><b>Author: </b>Sylvain Yver; <br><b>Rating: </b>1<br><b>When: </b>9 months ago<br>Booked in advance over the phone then, once one site, « we don’t take reservations »<br><br><b>Author: </b>David Rivas; <br><b>Rating: </b>5<br><b>When: </b>a year ago<br>Great place to grab a beer and some chicken wings while watching some soccer games!<br><br><b>Author: </b>Edo Cisca; <br><b>Rating: </b>1<br><b>When: </b>a year ago<br>Expensive, ridiculous service, poor quality food. Tourist trap.<br><br>",,,,3
