,Unnamed: 0,Unnamed: 0.1,lugares,LAT_google,LON_google,labels,Quotes,Position,cluster_label,Quotes_total,day
10,390.0,246.0,Piazza della Rotunda,41.8992619,12.4768866,LIB,"<b>408</b><br>.”
As they rounded the corner into Piazza della Rotunda, the Pantheon rose before them<br><b>390</b><br>Cars
to Piazza della Rotunda, Via delgi Orfani, Piazza Sant’Ignacio, and Sant’Eustachio",390.0,1.0,"<b>390</b><br>Cars
to Piazza della Rotunda, Via delgi Orfani, Piazza Sant’Ignacio, and Sant’Eustachio",0
11,391.0,383.0,Sant’Eustachio,41.8997351,12.4746038,LIB,"<b>391</b><br>Cars
to Piazza della Rotunda, Via delgi Orfani, Piazza Sant’Ignacio, and Sant’Eustachio",391.0,1.0,"<b>391</b><br>Cars
to Piazza della Rotunda, Via delgi Orfani, Piazza Sant’Ignacio, and Sant’Eustachio",0
19,742.0,240.0,Piazza Navona,41.8991633,12.4730742,LIB,"<b>742</b><br> 
Dead center of Piazza Navona, outside the church of St",742.0,0.0,"<b>742</b><br> 
Dead center of Piazza Navona, outside the church of St",0
23,,,"<a href=""https://www.turismoroma.it/it/node/1516""target=""_blank""> Piazza Navona </a><br><b>Rating: </b>4.7<br><b>Popularity: </b><br>120149",41.8991633,12.4730742,TOUR,"[]<b>Author: </b>Marcos Chavarria; <br><b>Rating: </b>5<br><b>When: </b>2 months ago<br>So beautiful, and so crowded sometimes. It is sometimes impossible to get a good picture in this plaza, but it is Rome, you need to enjoy the life that comes with it. Is a great place to have dinner and if you wait time enough you can take a very good night picture. Just be patience.<br><br><b>Author: </b>Creative Jay; <br><b>Rating: </b>5<br><b>When: </b>7 months ago<br>Incredible place. The massive church as you walk onto the plaza is amazing. Make sure you go inside and view it, words can not describe how stunning it is. Go day or night and enjoy this place. The only negative is the restaurants. Just avoid them if you can<br><br><b>Author: </b>Shelby Elkins; <br><b>Rating: </b>5<br><b>When: </b>2 weeks ago<br>Free to enter and walk around. Beautiful fountains, access to a nice church, and plenty of places to eat. A must visit site when you are in Rome! Highly recommend!<br><br><b>Author: </b>Bert Parham; <br><b>Rating: </b>5<br><b>When: </b>9 months ago<br>A fantastic place to go and people watch, enjoy pretty good food and ice cream. We visited several times as our hotel was in close proximity. Each time of day brings something different.<br><br><b>Author: </b>Kai; <br><b>Rating: </b>5<br><b>When: </b>a week ago<br>It was really calming and relaxing. Honestly I would love to go there again. The restaurants and coffee shops where top quality and the place was magnificent.<br><br>",,,,0
27,,,"<a href=""https://www.turismoroma.it/it/luoghi/campo-de%E2%80%99-fiori-e-piazza-farnese""target=""_blank""> Campo de' Fiori </a><br><b>Rating: </b>4.4<br><b>Popularity: </b><br>40690",41.8955904,12.4721829,TOUR,"[]<b>Author: </b>Wunderklumpen; <br><b>Rating: </b>4<br><b>When: </b>8 months ago<br>It is okay. But not worth to visit.<br><br><b>Author: </b>Marlene Münch Schuster; <br><b>Rating: </b>4<br><b>When: </b>8 months ago<br>As most piazzas, it is beautiful. And I like Giordano Bruno, although I have been told he was lacking charm<br><br><b>Author: </b>SilverWolf Beats; <br><b>Rating: </b>5<br><b>When: </b>in the last week<br>A good place to spend time with friends and family.  There's bars, restaurants and many more.  Police is always visible in the area to insure people follows safety protocol. Just a five minutes walk from the main road..<br><br><b>Author: </b>Deniz Hassan; <br><b>Rating: </b>5<br><b>When: </b>9 months ago<br>Splendid square comprised of four roughly equal sides. It houses several pleasant establishments for drink and food. The water fountain has excellent pressure and nice, cool water.<br><br><b>Author: </b>Vladimir Balaz; <br><b>Rating: </b>5<br><b>When: </b>3 months ago<br>The place is famous for final moments on Giordano Bruno. The place, however, also has its own atmosphere. It is lively, with many people, shops and cafes. And there are flower shops as well, of course.<br><br>",,,,0
30,,,"<a href=""http://www.beige-roma.com/""target=""_blank""> Beige Roma </a><br><b>Rating: </b>3.8<br><b>Popularity: </b><br>399",41.8908691,12.4712072,CLUB,"[]<b>Author: </b>Thomas Bollman; <br><b>Rating: </b>4<br><b>When: </b>a year ago<br>This place is much much bigger than it looks when you first walk in. Lots of places to sit and lounge around. Bartenders were very nice and their English was fine. Great for groups to sit around a table to have a drink or seven. Will go back on my next trip to Rome and when I’m not so hungover already.<br><br><b>Author: </b>Pondz Meme; <br><b>Rating: </b>5<br><b>When: </b>a year ago<br>Great staff.
Great food.
Great wine.
Great price.
The place is great. I threw a gathering for 17 people for my 19th bday and it was so nice. Totally recommend!!<br><br><b>Author: </b>Michal Glinka; <br><b>Rating: </b>3<br><b>When: </b>2 years ago<br>We arrived around 7pm for some good cocktails, but there was no other guests at the time. The bar was completely empty. The service was very good. The style of the bar is probably dated to the 90/00's looking on the interieur.<br><br><b>Author: </b>Wesam Rukun; <br><b>Rating: </b>3<br><b>When: </b>a year ago<br>An ok food. But the location is great.<br><br><b>Author: </b>Jorge R Tomey; <br><b>Rating: </b>4<br><b>When: </b>2 years ago<br>Good decor, gin and tonics €8 per. Closes at 0200h. Music wasn’t very good.<br><br>",,,,0
32,,,"<a href=""http://www.romabeercompany.it/""target=""_blank""> Roma Beer Company - Campo de' Fiori </a><br><b>Rating: </b>4.0<br><b>Popularity: </b><br>264",41.8957931,12.4722989,CLUB,"[]<b>Author: </b>Balázs Krucsó; <br><b>Rating: </b>5<br><b>When: </b>8 months ago<br>We took a beer and a prosecco there. Both of them were absolutely delightful and also we chatted a lot with the algerian waitress, whos has a very unique life story on Campo de’ Fiori. Definitely recommend to get the place and drink a bit and talk with the employees. You will not regret it!<br><br><b>Author: </b>Rok Bergman; <br><b>Rating: </b>3<br><b>When: </b>10 months ago<br>Good food and good beer selecetion.<br><br><b>Author: </b>Mr JoneZ; <br><b>Rating: </b>5<br><b>When: </b>10 months ago<br>The food was very delicious and the waiters were very friendly. We recommend this place<br><br><b>Author: </b>Heloisa Lopes; <br><b>Rating: </b>2<br><b>When: </b>a year ago<br>We were attracted here during Happy Hour, I asked which beers were in Happy Hour, it was two. But they did not told us it was only 0,4L, so we asked 1L and it was not in Happy Hour, and we only discovered that while we were paying (they omitted the information, although I specifically asked which beers were included in Happy Hour). Besides that, they charged us for 2L of the beer that costs 14 euros, but we asked 1L of the 14 euros beer and 1L of the 12 euros beer. They subtracted the 2 euros, but complaining until the very end.<br><br><b>Author: </b>John Willemsen; <br><b>Rating: </b>4<br><b>When: </b>9 months ago<br>The aperitivo dish was okay, the beer not bad but also nothing special, the waiter (the Albanian one) was very friendly, charming and added nice vibes to our evening. If I went back, it would be because of him.<br><br>",,,,0
33,,,"<a href=""""target=""_blank""> Trastevere Barrio </a><br><b>Rating: </b>4.6<br><b>Popularity: </b><br>234",41.8911486,12.4699402,CLUB,"[]<b>Author: </b>Maria Nicolaou; <br><b>Rating: </b>5<br><b>When: </b>a year ago<br>A neighborhood I always visit when in Rome. Lovely atmosphere, great restaurants, imaginative shops and souvenir shops. A lovely place for a stroll whether summer or winter.<br><br><b>Author: </b>Claudio C; <br><b>Rating: </b>5<br><b>When: </b>a year ago<br>Best place in Rome to eat!<br><br><b>Author: </b>Johanna Ortiz; <br><b>Rating: </b>5<br><b>When: </b>a year ago<br>Must try the pasta and meatballs 👌🏽<br><br><b>Author: </b>Jose Carlos Hernandez; <br><b>Rating: </b>5<br><b>When: </b>2 years ago<br>All day and night cool<br><br><b>Author: </b>PREMIUM Shop; <br><b>Rating: </b>3<br><b>When: </b>2 years ago<br>Nothing special. Go during the night.<br><br>",,,,0
38,,,"<a href=""http://www.museodiroma.it/""target=""_blank""> Museo di Roma - Palazzo Braschi </a><br><b>Rating: </b>4.5<br><b>Popularity: </b><br>2615",41.897551,12.4727241,MUSE,"[]<b>Author: </b>M in Paris; <br><b>Rating: </b>3<br><b>When: </b>2 months ago<br>The building is amazing and especially on the third floor there is a very interesting little exhibition of the evolution of the Roman architecture. The second floor you'll find a little bit of history of the clergy and romans aristocracy through the centuries but no ground breaking paintings.<br><br><b>Author: </b>Dominic Arbuthnott; <br><b>Rating: </b>4<br><b>When: </b>9 months ago<br>Great view from top floor<br><br><b>Author: </b>Vijay Sisodia; <br><b>Rating: </b>4<br><b>When: </b>a year ago<br>Nice little museum. (Be warned that it isn't very big so don't expect to spend more than a few hours here.)
Information is multilingual
Staff are friendly
Has seating area in almost every room.
Has good interactive videos explaining the history of Rome.
For those with a Roma pass, you still have to go to the ticket office to get your tickets.<br><br><b>Author: </b>David naftalis; <br><b>Rating: </b>2<br><b>When: </b>9 months ago<br>Museum with variable exhibitions.
Not pricy.
The staff not welcoming and very not patience...<br><br><b>Author: </b>Tony Popa; <br><b>Rating: </b>5<br><b>When: </b>a year ago<br>The Museo di Roma is a museum in Rome, Italy, part of the network of Roman civic museums. The museum was founded in the Fascist era with the aim of documenting the local history and traditions of the ""old Rome"" that was rapidly disappearing, but following many donations and acquisitions of works of art is now principally an art museum. The collections initially included 120 water-colours by the nineteenth-century painter Ettore Roesler Franz of Roma sparita, ""vanished Rome"", later moved to the Museo di Roma in Trastevere.<br><br>",,,,0
40,,,"<a href=""http://www.villafarnesina.it/""target=""_blank""> Villa Farnesina </a><br><b>Rating: </b>4.6<br><b>Popularity: </b><br>1488",41.89359939999999,12.4672868,MUSE,"[]<b>Author: </b>M in Paris; <br><b>Rating: </b>5<br><b>When: </b>2 months ago<br>Amazing ceiling painting from Raffaelo. It is mind blowing and definitely one of the more hidden unknown museums<br><br><b>Author: </b>JUZER KAPADIA; <br><b>Rating: </b>5<br><b>When: </b>2 months ago<br>The wealthy Sienese banker Agostino Chigi commissioned this villa in 1508 for his lavish banquets and for sojourns with the courtesan Imperia, who allegedly inspired one of the Three Graces painted by Raphael in the Loggia of Cupid and Psyche.
Designed by the Sienese architect Baldassare Peruzzi, the harmonious Farnesina, with a central block and projecting wings, is one of the first true Renaissance villas. Peruzzi decorated some of the interiors himself, such as the Sala della Prospettiva upstairs, in which illusionistic frescoes create the impression of looking out over Rome through a marble colonnade.
The painted vault of the Sala di Galatea shows the position of the stars at the time of Chigi’s birth. After his death, the banking business collapsed, and in 1577 the villa was sold to the Farnese family.<br><br><b>Author: </b>Andrew Potts; <br><b>Rating: </b>5<br><b>When: </b>6 months ago<br>Beautiful building, amazing Raphael frescoes.<br><br><b>Author: </b>A. Lexander; <br><b>Rating: </b>2<br><b>When: </b>10 months ago<br>""Don't download the guide app it takes too long almost 5 minutes per room"" was said to us when we bought tickets and wanted to download the free guide app they ADVERTISED AS PART OF TICKET... What a joke. And that for 10€. Very rude and unfriendly people at ticket counter.<br><br><b>Author: </b># Volkmer; <br><b>Rating: </b>5<br><b>When: </b>a year ago<br>The most amazing library I have ever seen in my life and probably the most amazing one I will ever see in my hole life. 😯 Just extraordinary fantastic. Extremely happy to be taken there.<br><br>",,,,0
41,,,"<a href=""http://galleriaspada.beniculturali.it/index.php?it/1/home""target=""_blank""> Spada Gallery </a><br><b>Rating: </b>4.5<br><b>Popularity: </b><br>1468",41.89420339999999,12.4719221,MUSE,"[]<b>Author: </b>Alex Unguru; <br><b>Rating: </b>5<br><b>When: </b>a year ago<br>Probably one of the most immersive Art Galleries in Rome. The smell of orange blossoms from the inner courtyard accompanies you in every room.
Better take a day, enjoy it in peace and then taste Rome from one of the nearby terraces.<br><br><b>Author: </b>Call Me M.; <br><b>Rating: </b>5<br><b>When: </b>7 months ago<br>Nice place to go, it wasnt crowded at all but your experience may differ!
If you like forced perspectives, this is for you! and you hardly pay anything (up to 25)<br><br><b>Author: </b>Avery Haviv; <br><b>Rating: </b>5<br><b>When: </b>a year ago<br>Lovely formally private art collection.  Very intimate and quiet experience.<br><br><b>Author: </b>Marek Rewa; <br><b>Rating: </b>5<br><b>When: </b>3 months ago<br>Very good experience<br><br><b>Author: </b>Tony Popa; <br><b>Rating: </b>5<br><b>When: </b>a year ago<br>The Galleria Spada is a museum in Rome (Italy), which is housed in the Palazzo Spada of the same name, located in the Piazza Capo di Ferro. The palazzo is also famous for its façade and for the forced perspective gallery by Francesco Borromini.

The gallery exhibits paintings from the 16th and 17th century.<br><br>",,,,0
