,Unnamed: 0,Unnamed: 0.1,lugares,LAT_google,LON_google,labels,Quotes,Position,cluster_label,day,Quotes_total
85,,,"<a href=""""target=""_blank""> Fontana del Putto </a><br><b>Rating: </b>4.0<br><b>Popularity: </b><br>2",41.8985622,12.466014,PRK,"[]<b>Author: </b>Stefano Manzo; <br><b>Rating: </b>4<br><b>When: </b>10 months ago<br>The Fontana del Putto, of the Renaissance type, is located in the V (Ponte) district, in Via Giulia, leaning against the left corner of the 16th century Palazzo Sacchetti, built on a project by Antonio da Sangallo the Younger to use it as his home.

History:

The fountain was built in a later period, but always in the 16th century and is attributed to Nanni di Baccio Bigio, who did some restoration work on the palace.

Description of the work:

The non-functioning fountain (mute) is quite graceful inside a niche, decorated with a valve there is a Putto embracing the tails of two dolphins in the shape of volutes under him, who have their mouths open, from which a time the water poured out on a pan.

Two niches frame the niche, adorned with bas-reliefs depicting masks and which have human figures as capitals which are surmounted by a broken lintel above which has two stars on the sides with eight points on the sides, probably heraldic symbols.

NOTE on the conservation status of the work:

It is not in good condition and a restoration activity is required that would require the integration of the deficiencies and a cleaning of the incrustations.<br><br><b>Author: </b>Paolo Emilio Capaldi; <br><b>Rating: </b>4<br><b>When: </b>4 years ago<br>Pretty fountain in Via Giulia, leaning against the left corner of Palazzo Sacchetti, corner via the mullet.
Made in the second half of the fifteenth century, perhaps by Sangallo the Younger.
At the center is a child supported by two dolphins and below, was a pan to collect water.
The frame shows two women and two faces of masks.
At the center, above the Putto, there is a shell; close the top frame the stars, the Chigi family crest.<br><br>",,,1,
87,,,"<a href=""http://060608.it/it/cultura-e-svago/beni-culturali/beni-architettonici-e-storici/fontanella-di-via-della-posta-vecchia.html""target=""_blank""> Fontana della Posta Vecchia </a><br><b>Rating: </b>3.5<br><b>Popularity: </b><br>2",41.8975985,12.4735755,PRK,"[]<b>Author: </b>Stefano Manzo; <br><b>Rating: </b>4<br><b>When: </b>2 years ago<br>In Via della Posta Vecchia is located in the district VI (Parione), between the picturesque Piazza De 'Massimi and Piazza Navona, it is a small quaint fountain in its simplicity.

It is leaning against a wall of the palace through a rectangular slab of white granite, in the upper part adorned on the sides by two bas-reliefs that represent flowers, always at the top but in the middle there is a cartouche with the inscription:

S.P.Q.R.
1872

Where the initials S.P.Q.R. Latin Senatvs PopvlvsQve Romanvs - the Senate and the Roman People, as the year 1872 is the year of construction.

As I said the fountain is very simple a small cinnamon, inserted in a circular panel, which pours water into a tray which is also circular but partially embedded (supported by an iron support like a modiglione), unfortunately the pan has the chipped edge in the front part, the water then falls into a collection basin on the ground of the semicircular shape.

To access it, there is a step always semicircular in shape, paved (like the basin) with the characteristic cobblestones, which act together with metal columns from delimiters of the area of ​​respect.

Not to be missed a few meters away, two sacred 17th century aedicules.<br><br><b>Author: </b>Roberto Michetti; <br><b>Rating: </b>3<br><b>When: </b>2 years ago<br>One of the first fountains built by the municipality of Rome after the unification of Italy ... dated 1872 is located a stone's throw from Piazza Navona.<br><br>",,,1,
91,,,"<a href=""""target=""_blank""> Fontana dei Quattro Fiumi </a><br><b>Rating: </b>0.0<br><b>Popularity: </b><br>0",41.898937,12.473092,PRK,,,,1,
