,Unnamed: 0,Unnamed: 0.1,lugares,LAT_google,LON_google,labels,Quotes,Position,cluster_label,day,Quotes_total
10,390.0,246.0,Piazza della Rotunda,41.8992619,12.4768866,LIB,"<b>390</b><br>Cars
to Piazza della Rotunda, Via delgi Orfani, Piazza Sant’Ignacio, and Sant’Eustachio<br><b>408</b><br>.”
As they rounded the corner into Piazza della Rotunda, the Pantheon rose before them",390.0,1.0,1,"<b>390</b><br>Cars
to Piazza della Rotunda, Via delgi Orfani, Piazza Sant’Ignacio, and Sant’Eustachio"
11,391.0,383.0,Sant’Eustachio,41.8997351,12.4746038,LIB,"<b>391</b><br>Cars
to Piazza della Rotunda, Via delgi Orfani, Piazza Sant’Ignacio, and Sant’Eustachio",391.0,1.0,1,"<b>391</b><br>Cars
to Piazza della Rotunda, Via delgi Orfani, Piazza Sant’Ignacio, and Sant’Eustachio"
19,742.0,240.0,Piazza Navona,41.8991633,12.4730742,LIB,"<b>742</b><br> 
Dead center of Piazza Navona, outside the church of St",742.0,0.0,1,"<b>742</b><br> 
Dead center of Piazza Navona, outside the church of St"
20,771.0,1016.0,the famous Bridge of Angels,41.901788,12.4664617,LIB,"<b>771</b><br>And as if that were not enough, leading solely and directly to the castle’s main entrance stood the famous Bridge of Angels ",771.0,0.0,1,"<b>771</b><br>And as if that were not enough, leading solely and directly to the castle’s main entrance stood the famous Bridge of Angels "
21,781.0,24.0,Castle St. Angelo,41.90306320000001,12.466276,LIB,"<b>781</b><br>Il Passetto -The Little Passage-was a slender, three-quarter-mile tunnel built between Castle StAngelo and the Vatican<br><b>892</b><br> 
He had come for her at Castle StAngelo<br><b>961</b><br>Europe’s top scientists mocking religion as they secretly assembled in the Vatican’s own Castle StAngelo",781.0,0.0,1,"<b>781</b><br>Il Passetto -The Little Passage-was a slender, three-quarter-mile tunnel built between Castle StAngelo and the Vatican"
23,,,"<a href=""https://www.turismoroma.it/it/node/1516""target=""_blank""> Piazza Navona </a><br><b>Rating: </b>4.7<br><b>Popularity: </b><br>120123",41.8991633,12.4730742,TOUR,"[]<b>Author: </b>Marcos Chavarria; <br><b>Rating: </b>5<br><b>When: </b>2 months ago<br>So beautiful, and so crowded sometimes. It is sometimes impossible to get a good picture in this plaza, but it is Rome, you need to enjoy the life that comes with it. Is a great place to have dinner and if you wait time enough you can take a very good night picture. Just be patience.<br><br><b>Author: </b>Creative Jay; <br><b>Rating: </b>5<br><b>When: </b>6 months ago<br>Incredible place. The massive church as you walk onto the plaza is amazing. Make sure you go inside and view it, words can not describe how stunning it is. Go day or night and enjoy this place. The only negative is the restaurants. Just avoid them if you can<br><br><b>Author: </b>Shelby Elkins; <br><b>Rating: </b>5<br><b>When: </b>2 weeks ago<br>Free to enter and walk around. Beautiful fountains, access to a nice church, and plenty of places to eat. A must visit site when you are in Rome! Highly recommend!<br><br><b>Author: </b>Bert Parham; <br><b>Rating: </b>5<br><b>When: </b>9 months ago<br>A fantastic place to go and people watch, enjoy pretty good food and ice cream. We visited several times as our hotel was in close proximity. Each time of day brings something different.<br><br><b>Author: </b>Kai; <br><b>Rating: </b>5<br><b>When: </b>a week ago<br>It was really calming and relaxing. Honestly I would love to go there again. The restaurants and coffee shops where top quality and the place was magnificent.<br><br>",,,1,
26,,,"<a href=""http://castelsantangelo.beniculturali.it/""target=""_blank""> Castel Sant'Angelo </a><br><b>Rating: </b>4.7<br><b>Popularity: </b><br>54165",41.90306319999999,12.466276,TOUR,"[]<b>Author: </b>Ghazzal Mehdi; <br><b>Rating: </b>5<br><b>When: </b>9 months ago<br>Surely a five star place. Perhaps the most iconic in Rome? To be honest, Rome has so many iconic places that I lost the count...
Anyway, near to. Vetican, great bridges.. Simply outstanding...<br><br><b>Author: </b>Marcos Chavarria; <br><b>Rating: </b>4<br><b>When: </b>2 months ago<br>Greater sight from the outside, I hope the pictures make sense of the very nice place this is. The architecture is different from other landmarks as it was intended for a different purpose in the religious history. Prepare to walk a lot. I would recommend the walking tour if possible.<br><br><b>Author: </b>Marcel van Poeijer; <br><b>Rating: </b>4<br><b>When: </b>4 months ago<br>This huge Castle is definitely worth a visit. Even though I did not go in (entrance fee = 15EU), I still loved the outside area and the little park next to it. When you go inside, it is recommended to go before sunrise, as the sunrise view on top of the terrace should be lovely.<br><br><b>Author: </b>Ken Saberi; <br><b>Rating: </b>4<br><b>When: </b>7 months ago<br>Great place to visit with spectacular views all around Rome. Interesting artefacts and some Papal history to see. Some of the rooms are stunning. There are a lot of stairs so people with mobility issues may struggle although there is a lift to the second level which can be used on request. This does mean that you will lose out on the top terrace which provides the best views. All the staff were extremely helpful and kind.<br><br><b>Author: </b>Rich; <br><b>Rating: </b>3<br><b>When: </b>8 months ago<br>A fine visit. The best thing about this castle is the view you get once you're on the top floor.<br><br>",,,1,
27,,,"<a href=""https://www.turismoroma.it/it/luoghi/campo-de%E2%80%99-fiori-e-piazza-farnese""target=""_blank""> Campo de' Fiori </a><br><b>Rating: </b>4.4<br><b>Popularity: </b><br>40676",41.8955904,12.4721829,TOUR,"[]<b>Author: </b>Wunderklumpen; <br><b>Rating: </b>4<br><b>When: </b>8 months ago<br>It is okay. But not worth to visit.<br><br><b>Author: </b>Marlene Münch Schuster; <br><b>Rating: </b>4<br><b>When: </b>8 months ago<br>As most piazzas, it is beautiful. And I like Giordano Bruno, although I have been told he was lacking charm<br><br><b>Author: </b>Deniz Hassan; <br><b>Rating: </b>5<br><b>When: </b>9 months ago<br>Splendid square comprised of four roughly equal sides. It houses several pleasant establishments for drink and food. The water fountain has excellent pressure and nice, cool water.<br><br><b>Author: </b>Vladimir Balaz; <br><b>Rating: </b>5<br><b>When: </b>3 months ago<br>The place is famous for final moments on Giordano Bruno. The place, however, also has its own atmosphere. It is lively, with many people, shops and cafes. And there are flower shops as well, of course.<br><br><b>Author: </b>Hiba Traifeh; <br><b>Rating: </b>3<br><b>When: </b>8 months ago<br>If u already have seen all the amazing places in Rome, u will notice that this is like a 2de degree place. Maybe because when i arrived there the market was just ended en it was dirty.<br><br>",,,1,
29,,,"<a href=""""target=""_blank""> St. Angelo Bridge </a><br><b>Rating: </b>4.7<br><b>Popularity: </b><br>14851",41.901788,12.4664617,TOUR,"[]<b>Author: </b>Aayush Khandelwal; <br><b>Rating: </b>5<br><b>When: </b>8 months ago<br>It's worth to visit. Look at the alignment with St Peters basilica. Sit near by on bridge and feel the beauty of place and architecture.<br><br><b>Author: </b>Vasilis Karaman; <br><b>Rating: </b>5<br><b>When: </b>4 months ago<br>Amazing bridge! The most beautiful I have ever seen. All these statues all over the road are in the highest level! At the night this beauty increases!!<br><br><b>Author: </b>Father Kenny Ang; <br><b>Rating: </b>4<br><b>When: </b>7 months ago<br>Seeing the statues of Saints Peter and Paul at the eastern end of this bridge reminds me that I’m standing in a city that witnessed the life of the early Christians. When I came here about two years ago, there were people dressed as Roman soldiers with whom tourists eagerly took pictures (I did too!). Unfortunately, I see that many visitors missed the ten statues of angels holding the symbols of Christ’s Passion devised by none other than Bernini (he wasn’t the only sculptor though; other sculptors collaborated in the project).<br><br><b>Author: </b>Dom Swatton; <br><b>Rating: </b>5<br><b>When: </b>8 months ago<br>Couldn't recommend this bridge more for crossing the water.
It has everything you need, clearly marked walkways, cobble stones and even statues.
Great views of the homeless camping along side the water.
Simply stunning<br><br><b>Author: </b>מאור לוי; <br><b>Rating: </b>5<br><b>When: </b>4 months ago<br>Their shark was, in this moment, a pioneering sheep. Credible grapefruits show us how goldfishes can be snails. An eager chicken is a grape of the mind! A powerful melon without bees is truly a chicken of boundless melons. Recent controversy aside, the chimpanzee of a peach becomes a painstaking lime; Few can name an amusing fish that isn't a confident camel. After a long day at school and work, they were lost without the pro-active giraffe that composed their peach. After a long day at school and work, a sympathetic squirrel without sheeps is truly a giraffe of dynamic sharks; Few can name a skillful lime that isn't a decisive cat. The kumquat is a cow!<br><br>",,,1,
30,,,"<a href=""http://www.060608.it/it/cultura-e-svago/beni-culturali/beni-architettonici-e-storici/fontana-dei-fiumi.html""target=""_blank""> Fiumi Fountain </a><br><b>Rating: </b>4.8<br><b>Popularity: </b><br>4572",41.8989673,12.4730872,TOUR,"[]<b>Author: </b>Marcos Chavarria; <br><b>Rating: </b>5<br><b>When: </b>2 months ago<br>All comments agree in one thing. This is a beautiful square, the 4 rivers fountain is a great sight. The details and the history behind it are just marvelous. You can have a coffee. Lunch or dinner at the surrounding restaurants, have a look at the daily life at the Piazza Navona is just delightful. Recommended for all parties<br><br><b>Author: </b>Shelby Elkins; <br><b>Rating: </b>5<br><b>When: </b>2 months ago<br>Always a pretty sight to see! Of course, Piazza Navona is free to visit. There are plenty of food options in the square and so much to see. The church is free to visit, and the three fountains are very nice. You can even talk to a psychic and learn your possible destiny!🤫<br><br><b>Author: </b>Mahammad Alizada; <br><b>Rating: </b>5<br><b>When: </b>8 months ago<br>Amazing<br><br><b>Author: </b>Hartmut P; <br><b>Rating: </b>5<br><b>When: </b>in the last week<br>Fountain made by the famous baroque artist Bernini , depicting the four great rivers of the World<br><br><b>Author: </b>Regan; <br><b>Rating: </b>5<br><b>When: </b>5 months ago<br>The coolest back story for a fountain ever! The figures on the fountain are all covering their faces to save their eyes from the sight of a rival Architects Building adjacent. Brilliant! Incredible sculpture also and set an an impressive square.<br><br>",,,1,
31,,,"<a href=""http://saintlouis-rome.net/""target=""_blank""> Church of St. Louis of the French </a><br><b>Rating: </b>4.8<br><b>Popularity: </b><br>4408",41.899581,12.4745405,TOUR,"[]<b>Author: </b>Father Kenny Ang; <br><b>Rating: </b>5<br><b>When: </b>7 months ago<br>This is one of my favorite churches in Rome, since I especially love Caravaggio and his works. Every time I come here, I almost always head directly to the Contarelli chapel just to delight in his three paintings of St. Matthew. My favorite one is the Calling of St. Matthew on the left-side wall of the chapel (which is the darker side of the wall, unfortunately). When I went there yesterday, some ladies already put some euros into the machine so the entire chapel was brightly illuminated. I was a lucky pilgrim and photographer!<br><br><b>Author: </b>Veranika Tsybulskaya; <br><b>Rating: </b>5<br><b>When: </b>8 months ago<br>Spectacular! Definitely worth to visit not only for a Caravaggio works, but for an ambience itself. Rich and spaced. Were lucky to end up there during the organ mass - truly recommend!<br><br><b>Author: </b>Iman Traveler; <br><b>Rating: </b>5<br><b>When: </b>3 months ago<br>3 Caravaggio paintings!!! What could you expect more?

Short explain:
is a Roman Catholic church in Rome, not far from Piazza Navona. The church is dedicated to the Virgin Mary, to St. Denis the Areopagite and St. Louis IX, king of France. The church was designed by Giacomo della Porta and built by Domenico Fontana between 1518 and 1589, and completed through the personal intervention of Catherine de' Medici, who donated to it some property in the area. It is the national church in Rome of France.<br><br><b>Author: </b>George; <br><b>Rating: </b>5<br><b>When: </b>8 months ago<br>The ceiling is covered in beautiful art. If you are in the area you must pop in for a look. It is free and marvelous.<br><br><b>Author: </b>Ron Nederpelt; <br><b>Rating: </b>5<br><b>When: </b>6 months ago<br>I Caravaggi. I CARAVAGGI! A day without seeing a painting by Caravaggio is a day not lived.<br><br>",,,1,
33,,,"<a href=""http://www.museodiroma.it/""target=""_blank""> Museo di Roma - Palazzo Braschi </a><br><b>Rating: </b>4.5<br><b>Popularity: </b><br>2614",41.897551,12.4727241,TOUR,"[]<b>Author: </b>M in Paris; <br><b>Rating: </b>3<br><b>When: </b>2 months ago<br>The building is amazing and especially on the third floor there is a very interesting little exhibition of the evolution of the Roman architecture. The second floor you'll find a little bit of history of the clergy and romans aristocracy through the centuries but no ground breaking paintings.<br><br><b>Author: </b>Dominic Arbuthnott; <br><b>Rating: </b>4<br><b>When: </b>8 months ago<br>Great view from top floor<br><br><b>Author: </b>Vijay Sisodia; <br><b>Rating: </b>4<br><b>When: </b>a year ago<br>Nice little museum. (Be warned that it isn't very big so don't expect to spend more than a few hours here.)
Information is multilingual
Staff are friendly
Has seating area in almost every room.
Has good interactive videos explaining the history of Rome.
For those with a Roma pass, you still have to go to the ticket office to get your tickets.<br><br><b>Author: </b>David naftalis; <br><b>Rating: </b>2<br><b>When: </b>9 months ago<br>Museum with variable exhibitions.
Not pricy.
The staff not welcoming and very not patience...<br><br><b>Author: </b>Tony Popa; <br><b>Rating: </b>5<br><b>When: </b>a year ago<br>The Museo di Roma is a museum in Rome, Italy, part of the network of Roman civic museums. The museum was founded in the Fascist era with the aim of documenting the local history and traditions of the ""old Rome"" that was rapidly disappearing, but following many donations and acquisitions of works of art is now principally an art museum. The collections initially included 120 water-colours by the nineteenth-century painter Ettore Roesler Franz of Roma sparita, ""vanished Rome"", later moved to the Museo di Roma in Trastevere.<br><br>",,,1,
35,,,"<a href=""http://www.vallicella.org/""target=""_blank""> Parrocchia Santa Maria in Vallicella </a><br><b>Rating: </b>4.7<br><b>Popularity: </b><br>1713",41.8984826,12.46916,TOUR,"[]<b>Author: </b>Hartmut P; <br><b>Rating: </b>4<br><b>When: </b>a week ago<br>A baroque Church , hidden is the painting from Ruben's behind a mechanical cover<br><br><b>Author: </b>S.Y. Park; <br><b>Rating: </b>4<br><b>When: </b>a year ago<br>Cozy, dark yet brilliantly rich in Golden Renaissance essences.  It really is inviting, for anyone to come.<br><br><b>Author: </b>Edward Mueller; <br><b>Rating: </b>4<br><b>When: </b>a year ago<br>Imposing Baroque.  Great gigantic grandiosity.<br><br><b>Author: </b>EFG Manju; <br><b>Rating: </b>5<br><b>When: </b>a year ago<br>A must visit to see the grandeur. Has a very calming influence on you.<br><br><b>Author: </b>Rob R; <br><b>Rating: </b>5<br><b>When: </b>a year ago<br>Whilst walking Rome I come across this church. Just like most churches in Rome they all have their individual beauty. This was a beautifully detailed building allowing for quite reflection during a busy trip.<br><br>",,,1,
37,,,"<a href=""http://www.villafarnesina.it/""target=""_blank""> Villa Farnesina </a><br><b>Rating: </b>4.6<br><b>Popularity: </b><br>1488",41.89359939999999,12.4672868,TOUR,"[]<b>Author: </b>M in Paris; <br><b>Rating: </b>5<br><b>When: </b>2 months ago<br>Amazing ceiling painting from Raffaelo. It is mind blowing and definitely one of the more hidden unknown museums<br><br><b>Author: </b>JUZER KAPADIA; <br><b>Rating: </b>5<br><b>When: </b>2 months ago<br>The wealthy Sienese banker Agostino Chigi commissioned this villa in 1508 for his lavish banquets and for sojourns with the courtesan Imperia, who allegedly inspired one of the Three Graces painted by Raphael in the Loggia of Cupid and Psyche.
Designed by the Sienese architect Baldassare Peruzzi, the harmonious Farnesina, with a central block and projecting wings, is one of the first true Renaissance villas. Peruzzi decorated some of the interiors himself, such as the Sala della Prospettiva upstairs, in which illusionistic frescoes create the impression of looking out over Rome through a marble colonnade.
The painted vault of the Sala di Galatea shows the position of the stars at the time of Chigi’s birth. After his death, the banking business collapsed, and in 1577 the villa was sold to the Farnese family.<br><br><b>Author: </b>Andrew Potts; <br><b>Rating: </b>5<br><b>When: </b>6 months ago<br>Beautiful building, amazing Raphael frescoes.<br><br><b>Author: </b>A. Lexander; <br><b>Rating: </b>2<br><b>When: </b>10 months ago<br>""Don't download the guide app it takes too long almost 5 minutes per room"" was said to us when we bought tickets and wanted to download the free guide app they ADVERTISED AS PART OF TICKET... What a joke. And that for 10€. Very rude and unfriendly people at ticket counter.<br><br><b>Author: </b># Volkmer; <br><b>Rating: </b>5<br><b>When: </b>a year ago<br>The most amazing library I have ever seen in my life and probably the most amazing one I will ever see in my hole life. 😯 Just extraordinary fantastic. Extremely happy to be taken there.<br><br>",,,1,
39,,,"<a href=""http://www.beige-roma.com/""target=""_blank""> Beige Roma </a><br><b>Rating: </b>3.8<br><b>Popularity: </b><br>399",41.8908691,12.4712072,CLUB,"[]<b>Author: </b>Thomas Bollman; <br><b>Rating: </b>4<br><b>When: </b>a year ago<br>This place is much much bigger than it looks when you first walk in. Lots of places to sit and lounge around. Bartenders were very nice and their English was fine. Great for groups to sit around a table to have a drink or seven. Will go back on my next trip to Rome and when I’m not so hungover already.<br><br><b>Author: </b>Pondz Meme; <br><b>Rating: </b>5<br><b>When: </b>a year ago<br>Great staff.
Great food.
Great wine.
Great price.
The place is great. I threw a gathering for 17 people for my 19th bday and it was so nice. Totally recommend!!<br><br><b>Author: </b>Michal Glinka; <br><b>Rating: </b>3<br><b>When: </b>2 years ago<br>We arrived around 7pm for some good cocktails, but there was no other guests at the time. The bar was completely empty. The service was very good. The style of the bar is probably dated to the 90/00's looking on the interieur.<br><br><b>Author: </b>Wesam Rukun; <br><b>Rating: </b>3<br><b>When: </b>a year ago<br>An ok food. But the location is great.<br><br><b>Author: </b>Jorge R Tomey; <br><b>Rating: </b>4<br><b>When: </b>2 years ago<br>Good decor, gin and tonics €8 per. Closes at 0200h. Music wasn’t very good.<br><br>",,,1,
41,,,"<a href=""http://www.romabeercompany.it/""target=""_blank""> Roma Beer Company - Campo de' Fiori </a><br><b>Rating: </b>4.0<br><b>Popularity: </b><br>264",41.8957931,12.4722989,CLUB,"[]<b>Author: </b>Balázs Krucsó; <br><b>Rating: </b>5<br><b>When: </b>8 months ago<br>We took a beer and a prosecco there. Both of them were absolutely delightful and also we chatted a lot with the algerian waitress, whos has a very unique life story on Campo de’ Fiori. Definitely recommend to get the place and drink a bit and talk with the employees. You will not regret it!<br><br><b>Author: </b>Rok Bergman; <br><b>Rating: </b>3<br><b>When: </b>10 months ago<br>Good food and good beer selecetion.<br><br><b>Author: </b>Mr JoneZ; <br><b>Rating: </b>5<br><b>When: </b>10 months ago<br>The food was very delicious and the waiters were very friendly. We recommend this place<br><br><b>Author: </b>Heloisa Lopes; <br><b>Rating: </b>2<br><b>When: </b>a year ago<br>We were attracted here during Happy Hour, I asked which beers were in Happy Hour, it was two. But they did not told us it was only 0,4L, so we asked 1L and it was not in Happy Hour, and we only discovered that while we were paying (they omitted the information, although I specifically asked which beers were included in Happy Hour). Besides that, they charged us for 2L of the beer that costs 14 euros, but we asked 1L of the 14 euros beer and 1L of the 12 euros beer. They subtracted the 2 euros, but complaining until the very end.<br><br><b>Author: </b>John Willemsen; <br><b>Rating: </b>4<br><b>When: </b>9 months ago<br>The aperitivo dish was okay, the beer not bad but also nothing special, the waiter (the Albanian one) was very friendly, charming and added nice vibes to our evening. If I went back, it would be because of him.<br><br>",,,1,
45,,,"<a href=""http://wisdomlessclub.com/""target=""_blank""> Wisdomless Club </a><br><b>Rating: </b>4.6<br><b>Popularity: </b><br>99",41.8976582,12.470452,CLUB,"[]<b>Author: </b>Jennifer Friedrich; <br><b>Rating: </b>5<br><b>When: </b>a year ago<br>What a fabulous find in Rome! Completely charming and fascinating cocktail bar- vintage decor with lots of wild taxidermy! The drinks were delicious and the staff friendly- go check them out!<br><br><b>Author: </b>neaux bodi; <br><b>Rating: </b>1<br><b>When: </b>a year ago<br>Had an awful experience here. Walked in and ordered a drink then went to find a seat. Ended up walking into a room we weren't supposed to be in I guess, even though there was no sign or door to stop us, the owner rushed us out then proceeded to scream at the bartender until she cried. Very very awkward situation. We quickly paid for our 3 drinks, which was €40, and got out of there. DO NOT GO TO THIS BAR!<br><br><b>Author: </b>Sokol Elmazaj; <br><b>Rating: </b>5<br><b>When: </b>a year ago<br>Lovely cocktail bar. You have to try this. Do not miss the Churchill.<br><br><b>Author: </b>Yana Osinsky; <br><b>Rating: </b>5<br><b>When: </b>a year ago<br>One of the best and craziest cocktail bars I have been in. If you visit Rome, you must visit this place! Enjoy...<br><br><b>Author: </b>Mr GillyFlower; <br><b>Rating: </b>5<br><b>When: </b>a year ago<br>Fantastic experience, warm welcoming from the staff and a great atmosphere. Lovely cocktails! Would recommend to everyone.<br><br>",,,1,
46,,,"<a href=""http://www.rabbitholeclubroma.it/""target=""_blank""> Rabbit Hole Club Roma </a><br><b>Rating: </b>3.3<br><b>Popularity: </b><br>92",41.89068080000001,12.4706659,CLUB,"[]<b>Author: </b>Blanche Leroy; <br><b>Rating: </b>1<br><b>When: </b>a year ago<br>Horrible place to go out, misorganized, you have to sign a form to get in after waiting an hour for no obvious reason. I do not recommend at all!<br><br><b>Author: </b>Ruth Tacandong; <br><b>Rating: </b>1<br><b>When: </b>2 years ago<br>Went shortly after it opened and stayed for an hour in hopes that the crowd would grow. Left because we realized that we were the only ones around as everyone left. 5$ cover charge isn't worth it. Music was hard to dance to and drinks were up to 20$; they also don't do any fancy shots. They also record your full name, birth date, and state you're from. Mandatory ID.

Would not recommend<br><br><b>Author: </b>Carlos Villavieja; <br><b>Rating: </b>1<br><b>When: </b>3 years ago<br>Three room underground disco. 10 euros entrance that only includes bad alcohol, they asked for an  additional 7 euros for a good gin or whisky, total 17. €. They don't serve quality alcohol,  probably fake brands, be careful.<br><br><b>Author: </b>Sophie Hartley; <br><b>Rating: </b>2<br><b>When: </b>2 years ago<br>Thought it was a club. It was not. Nice bar, but not worth 15 euros entry<br><br><b>Author: </b>Dominic Mullen; <br><b>Rating: </b>1<br><b>When: </b>3 years ago<br>went on a Friday night at midnight: no one was in the club. went back the same night at 2:30am and it was completely empty. not one person except for a couple in the smoke room<br><br>",,,1,
