,Unnamed: 0,Unnamed: 0.1,lugares,LAT_google,LON_google,labels,Quotes,Position,cluster_label,day,Quotes_total
10,390.0,246.0,Piazza della Rotunda,41.8992619,12.4768866,LIB,"<b>390</b><br>Cars
to Piazza della Rotunda, Via delgi Orfani, Piazza Sant’Ignacio, and Sant’Eustachio<br><b>408</b><br>.”
As they rounded the corner into Piazza della Rotunda, the Pantheon rose before them",390.0,1.0,1,"<b>390</b><br>Cars
to Piazza della Rotunda, Via delgi Orfani, Piazza Sant’Ignacio, and Sant’Eustachio"
11,391.0,383.0,Sant’Eustachio,41.8997351,12.4746038,LIB,"<b>391</b><br>Cars
to Piazza della Rotunda, Via delgi Orfani, Piazza Sant’Ignacio, and Sant’Eustachio",391.0,1.0,1,"<b>391</b><br>Cars
to Piazza della Rotunda, Via delgi Orfani, Piazza Sant’Ignacio, and Sant’Eustachio"
15,521.0,830.0,Via Cola di Riezo,41.9079743,12.465208,LIB,"<b>521</b><br>The path intersected the Margherita Bridge, Via Cola di Riezo, and passed through Piazza del Risorgimento, hitting no churches at all until it dead-ended abruptly at the center of St",521.0,0.0,1,"<b>521</b><br>The path intersected the Margherita Bridge, Via Cola di Riezo, and passed through Piazza del Risorgimento, hitting no churches at all until it dead-ended abruptly at the center of St"
19,742.0,240.0,Piazza Navona,41.8991633,12.4730742,LIB,"<b>742</b><br> 
Dead center of Piazza Navona, outside the church of St",742.0,0.0,1,"<b>742</b><br> 
Dead center of Piazza Navona, outside the church of St"
20,771.0,1016.0,the famous Bridge of Angels,41.901788,12.4664617,LIB,"<b>771</b><br>And as if that were not enough, leading solely and directly to the castle’s main entrance stood the famous Bridge of Angels ",771.0,0.0,1,"<b>771</b><br>And as if that were not enough, leading solely and directly to the castle’s main entrance stood the famous Bridge of Angels "
21,781.0,24.0,Castle St. Angelo,41.90306320000001,12.466276,LIB,"<b>781</b><br>Il Passetto -The Little Passage-was a slender, three-quarter-mile tunnel built between Castle StAngelo and the Vatican<br><b>892</b><br> 
He had come for her at Castle StAngelo<br><b>961</b><br>Europe’s top scientists mocking religion as they secretly assembled in the Vatican’s own Castle StAngelo",781.0,0.0,1,"<b>781</b><br>Il Passetto -The Little Passage-was a slender, three-quarter-mile tunnel built between Castle StAngelo and the Vatican"
